index,published,topic,term,domain,language,valid,de,title,description,en,la,url,image,archive,content,quote,added,feed,country,ipcc,continent
c9ac61a80fa3ad55068fcf88703f8166,2026-05-15T10:48:23Z,Drought,Dryness Kiribati,www.breitbart.com,en,0.2,"„Project Hail Mary“-Star Sandra Fuller über Deutschlands Nazi-Vergangenheit: „Ich fühle jeden Tag die Schuld“. Die deutsche Oscar-Preisträgerin Sandra Huller sagte am Freitag, sie fühle sich „jeden Tag“ schuldig wegen der Rolle Deutschlands im Zweiten Weltkrieg, als sie über ihre neueste Rolle in einem historischen Drama sprach.
Der Beitrag „Project Hail Mary“-Star Sandra Fuller über Deutschlands Nazi-Vergangenheit: „Ich fühle den Gu…“",‘Project Hail Mary’ Star Sandra Fuller on Germany’s Nazi Past: ‘I Feel the Guilt Every Day’,"German Oscar-winning actress Sandra Huller said Friday she felt guilt for Germany's role in World War II ""every day"" as she discussed her latest role in a historical drama.
The post ‘Project Hail Mary’ Star Sandra Fuller on Germany’s Nazi Past: ‘I Feel the Gu…","‘Project Hail Mary’ Star Sandra Fuller on Germany’s Nazi Past: ‘I Feel the Guilt Every Day’. German Oscar-winning actress Sandra Huller said Friday she felt guilt for Germany's role in World War II ""every day"" as she discussed her latest role in a historical drama.
The post ‘Project Hail Mary’ Star Sandra Fuller on Germany’s Nazi Past: ‘I Feel the Gu…","'Proiectum Ave Maria' Star Sandra Fuller in Germania Nazi Past: 'Ego culpam cotidie sentio'. Sandra Huller mima Germanica Oscar-vincens dixit Veneris crimen ob munus Germaniae in bello mundano II ""cotidie"" sensit, cum in dramate historico recentissimas partes suas tractavit.
Post 'Projectum Ave Maria' Star Sandra Fuller in Germania Nazi Past: 'Ego Gu...",https://www.breitbart.com/entertainment/2026/05/15/project-hail-mary-star-sandra-fuller-on-germanys-nazi-past-i-feel-the-guilt-every-day/,https://media.breitbart.com/media/2026/05/sandra-huller-640x335.jpg,,"Cannes (France) (AFP)  German Oscar-winning actress Sandra Huller said Friday she felt guilt for Germany’s role in World War II “every day” as she discussed her latest role in a historical drama.
Th… [+1642 chars]",,2026-05-22 12:17:52+00:00,edo,Kiribati,EAO,Atlantic Ocean
a6622e578795c9c1cd7381e205967af6,2026-05-15T14:05:21Z,Fog,Fog United States,www.salon.com,en,0.2,"Niedrigere Arzneimittelpreise werden die Krebsbehandlung nicht verbessern. Da bahnbrechende Medikamente den Patienten große Hoffnung bieten, sollten sich die Gesetzgeber auf die Stärkung des sozialen Sicherheitsnetzes konzentrieren",Lower drug prices won’t fix cancer care,"As breakthrough drugs offer critical hope to patients, lawmakers should focus on shoring up the social safety net","Lower drug prices won’t fix cancer care. As breakthrough drugs offer critical hope to patients, lawmakers should focus on shoring up the social safety net","Pretium medicamentorum inferiorum curam cancri non figunt. Sicut medicamenta dividuntur, spem criticam aegris praebent, legislatores in retia sociali subicere debent",https://www.salon.com/2026/05/15/lower-drug-prices-wont-fix-cancer-care/,https://www.salon.com/app/uploads/2026/05/Immunotherapy-2273912907.jpg,,After former President Jimmy Carter used the cancer drug Keytruda which ultimately helped him become the first U.S. president to live to 100 cancer patients across the United States had one request f… [+4015 chars],,2026-05-22 12:17:52+00:00,wmo,United States,CNA,North-America
de8cf37792c6195a2e9335fdda192bfb,2026-05-15T15:06:32Z,Earthquake,Earthquake Silver Springs,english.atlatszo.hu,en,0.2,"Gerade vor der Flucht verteilte das Orbán-Regime ein Vermögen an seine entfremdeten Partisanen. Wir haben uns die Verträge des Donau-Instituts angeschaut, über die die Vorgängerregierung Millionen an die europäische rechtspopulistische Bewegung zahlt und","Juste avant sa chute, le régime d'Orbán a distribué une fortune à ses partisans étrangers","We looked into the contracts of the Danube Institute, through which the previous gorvernment payments millions to the European right-wing populist movement and","Juste avant sa chute, le régime d'Orbán a distribué une fortune à ses partisans étrangers. We looked into the contracts of the Danube Institute, through which the previous gorvernment payments millions to the European right-wing populist movement and","Scaligeri avant sa chute, le regime d'Orbán a distribué une fortune à ses partisans etrangers. Inspeximus pactiones Instituti Danubii, per quos praevia regiminis solutiones decies centena millia ad motum popularem dextrum cornu Europaeum inspeximus.",https://english.atlatszo.hu/2026/05/14/just-before-the-election-the-orban-regime-distributed-a-fortune-among-its-foreign-cheerleaders/,https://english.atlatszo.hu/wp-content/uploads/2026/05/di_cover.png,,"Átlátszó has been granted access the contracts of the Danube Institute, a key arm of the Orbán governments network building among European right-wing populists and the MAGA world. Just before the ele… [+12193 chars]",,2026-05-22 12:17:52+00:00,usgs,United States,WNA,North-America
05a9e23be68022a667b5ad86028a873a,2026-05-16T06:46:44Z,Thunderstorm,Severe Weather India,deadline.com,en,0.2,"Arnaud Desplechin spricht über das hochkarätige englischsprachige Ensemble-Drama „The Thing That Hurts“ über Klienten von Beloved Dead Psychoanalytiker: „Ich wurde geboren, um diesen Film zu machen“ – Cannes Market. EXKLUSIV: Der Cannes-Hit Arnaud Desplechin ist dieses Jahr nicht beim Festival, aber seine kommende englischsprachige Produktion The Thing That Hurts sorgt mit Gravel Lake Entertainment für großes Aufsehen auf dem Markt. Mit Alfre Woodard, J.K. Simmons, Jason Sc…",Arnaud Desplechin Talks Starry English-Language Ensemble Drama ‘The Thing That Hurts’ About Clients Of Beloved Dead Psychoanalyst: “I Was Born To Make This Film” – Cannes Market,"EXCLUSIVE: Cannes habitué Arnaud Desplechin is not at the festival this year but his upcoming English-language production The Thing That Hurts is making a big splash at the market with Gravel Lake Entertainment. Featuring Alfre Woodard, J.K. Simmons, Jason Sc…","Arnaud Desplechin Talks Starry English-Language Ensemble Drama ‘The Thing That Hurts’ About Clients Of Beloved Dead Psychoanalyst: “I Was Born To Make This Film” – Cannes Market. EXCLUSIVE: Cannes habitué Arnaud Desplechin is not at the festival this year but his upcoming English-language production The Thing That Hurts is making a big splash at the market with Gravel Lake Entertainment. Featuring Alfre Woodard, J.K. Simmons, Jason Sc…","Arnaud Desplechin Sermones astril-anglico-Language Ensemble Drama 'res quae dolet' de Clientibus Dilecti Mortui Psychoanalyst: ""Natus sum ut hoc film Facere"" - Cannes Market. PRAECIPUUS: Cannes habitué Arnaud Desplechin non est in festo hoc anno, sed eius adventus productio Anglica-language. Res That Hurts magnum spargere facit ad mercatum cum Gravel Lake Entertainment. Alfre Woodard, J.K. Simmons, Iason Sc…",http://deadline.com/2026/05/arnaud-desplechin-ensemble-drama-thing-that-hurts-cannes-1236906590/,https://deadline.com/wp-content/uploads/2026/05/MixCollage-15-May-2026-08-47-PM-8662.jpg?w=1024,,EXCLUSIVE: Cannes habitué Arnaud Desplechin is not at the festival this year but his upcoming English-language production The Thing That Hurts is making a big splash at the market with Gravel Lake En… [+8078 chars],,2026-05-22 12:17:52+00:00,wmo,India,SAS,Asia
05fc9e028aca9c73578cf8a6f02ec6a8,2026-05-18T11:15:38Z,Flood,Flashflood Trumbull OH,www.masslive.com,en,0.2,"Hier erfahren Sie, was es wirklich kostet, ein WM-Spiel in Foxborough zu sehen. Tickets, Reisekosten und Unterkunft summieren sich schnell. MassLive hat alle Kosten zusammengestellt, die Ihnen entstehen könnten, um diesen Sommer ein WM-Spiel in Foxborough zu sehen.",Here’s what it really costs to see a World Cup match in Foxborough,"Tickets, travel and lodging add up quickly. MassLive tallied all the expenses you might incur to catch one World Cup match in Foxborough this summer.","Here’s what it really costs to see a World Cup match in Foxborough. Tickets, travel and lodging add up quickly. MassLive tallied all the expenses you might incur to catch one World Cup match in Foxborough this summer.","Hic est quid vere constat videre compositus in Foxborough Mundus Calicem. Tesseras, peregrinare et hospitari cito adde. MassLive omnes impensas congruebat, incurreres ut unum Calicem Mundi capiendum in Foxborough hac aestate capias.",https://www.masslive.com/boston/2026/05/how-attending-a-world-cup-match-in-foxborough-can-quickly-cost-1000.html,https://s.yimg.com/ny/api/res/1.2/7JQVw.QHMIV_grxL12xeww--/YXBwaWQ9aGlnaGxhbmRlcjt3PTEyMDA7aD04MDA7Y2Y9d2VicA--/https://media.zenfs.com/en/masslive_articles_390/4d950cf56f05e2b7716b4c0d895415f6,,"Soccer, or football for everyone else, is often called the beautiful game. But finding the money to attend its most prestigious tournament can get downright ugly.
Between match tickets, transportati… [+6967 chars]",,2026-05-22 12:17:52+00:00,wmo,United States,CNA,North-America
47e79d91b47ac01a9949520572df4a07,2026-05-18T11:31:00Z,Wildfire,Wildfire Himachal Pradesh,www.prnewswire.com,en,0.2,"NICB warnt davor, dass der Betrug durch Auftragnehmer in den USA landesweit weiter zunimmt. 35 Bundesstaaten haben die Woche zur Aufklärung über Betrug bei Auftragnehmern anerkannt, da Katastrophen und Reparaturkosten in den Vereinigten Staaten weiter steigen. OAK BROOK, Ill., 18. Mai 2026 /PRNewswire/ – Das National Insurance Crime Bureau (NICB), das führende, etablierte Nicht-…",NICB Warns Americans Contractor Fraud Continues to Rise Nationwide,"Thirty-five states have recognized Contractor Fraud Awareness Week as disasters and repair costs continue to climb across the United States OAK BROOK, Ill., May 18, 2026 /PRNewswire/ -- The National Insurance Crime Bureau (NICB), the leading, established non-…","NICB Warns Americans Contractor Fraud Continues to Rise Nationwide. Thirty-five states have recognized Contractor Fraud Awareness Week as disasters and repair costs continue to climb across the United States OAK BROOK, Ill., May 18, 2026 /PRNewswire/ -- The National Insurance Crime Bureau (NICB), the leading, established non-…","NICB monet Americani Contractor Fraus Nationwide surgere pergit. Triginta quinque civitates Contractor Fraus Conscientiae Hebdomadae agnoverunt pro calamitatibus et expensis reparandis pergunt ad scandendum per Civitates Foederatas OAK Brook, Ill., die 18 Maii 2026 / PRNewswire/ -- The National Insurance Crime Bureau (NICB), the leading",https://www.prnewswire.com/news-releases/nicb-warns-americans-contractor-fraud-continues-to-rise-nationwide-302774320.html,https://mma.prnewswire.com/media/2374575/nicb1_Logo.jpg?p=facebook,,"Thirty-five states have recognized Contractor Fraud Awareness Week as disasters and repair costs continue to climb across the United States
OAK BROOK, Ill., May 18, 2026 /PRNewswire/ -- The National… [+6231 chars]",,2026-05-22 12:17:52+00:00,wmo,India,SAS,Asia
dace2539bd1301d6cbece0197a92603b,2026-05-18T15:03:10Z,Flood,river flooding Australia,screenrant.com,en,0.2,Project Hail Mary ist jetzt vor der Veröffentlichung von Prime Video ein weltweiter Streaming-Hit. Ryan Gosling spielt die Hauptrolle in einer der größten Kassenerfolgsgeschichten des Jahres und jetzt ist „Project Hail Mary“ ein Hit in den Streaming-Charts.,Project Hail Mary Is Now A Global Streaming Hit Before Prime Video Release,"Ryan Gosling is starring in one of the biggest box office success stories of the year, and now Project Hail Mary is a hit on the streaming charts.","Project Hail Mary Is Now A Global Streaming Hit Before Prime Video Release. Ryan Gosling is starring in one of the biggest box office success stories of the year, and now Project Hail Mary is a hit on the streaming charts.","Project Hail Mary is now A Global Streaming Hit Before Prime Video Release. Ryan Gosling starring in one of the important box office success storys of the year, and now Project Hail Mary is hit on stream charts.",https://screenrant.com/project-hail-mary-vod-streaming-success-may-2026/,https://static0.srcdn.com/wordpress/wp-content/uploads/2026/03/ryan-gosling-as-ryland-smiling-toward-rocky-with-his-helmet-off-in-the-tunnel-in-project-hail-mary.jpg?w=1600&h=900&fit=crop,,"After becoming a box office behemoth this year, Ryan Gosling's Project Hail Mary is now a worldwide streaming hit.
Project Hail Mary is currently the No. 1 film on Amazon's global Premium Video On D… [+2925 chars]",,2026-05-22 12:17:52+00:00,aidr,Australia,NAU,Oceania
844b4c8bf9301dcd2234650c046bde76,2026-05-18T17:30:00Z,Snow&Ice,Snow United States,comicbook.com,en,0.2,"Das US-Publikum schläft beim neuen 6-teiligen Krimidrama von Netflix mit nahezu perfektem RT-Score. Aufgrund der Häufigkeit der neuen Netflix-Inhalte ändern sich die Top 10 auf der Plattform ständig. In der vergangenen Woche schwankte die Top-10-Show in den Vereinigten Staaten stark. Auch wenn „The Roast of Kevin Hart“ tagelang die Top-Show war, war das Wochenende …",U.S. Audiences Are Sleeping on Netflix’s New 6-Part Crime Drama With Near Perfect RT Score,"The frequency of Netflix’s new content means that the Top 10 on the platform is always changing. Over the past week, the Top 10 show in the United States has fluctuated wildly. Even though The Roast of Kevin Hart was the top show for days on end, the weekend …","U.S. Audiences Are Sleeping on Netflix’s New 6-Part Crime Drama With Near Perfect RT Score. The frequency of Netflix’s new content means that the Top 10 on the platform is always changing. Over the past week, the Top 10 show in the United States has fluctuated wildly. Even though The Roast of Kevin Hart was the top show for days on end, the weekend …","Audientiae US dormiunt in Netflix's New 6-Part Crime Drama With Near Perfect RT Score. Frequentia in novo contentorum Netflix significat Top 10 in suggestu semper variari. Per hebdomadam revolutam, Top X spectaculum in Civitatibus Foederatis Americae fluctuavit. Etiamsi Assum Kevin Hart summum spectaculum fuit per dies extremos, volutpat ...",http://comicbook.com/tv-shows/feature/u-s-audiences-are-sleeping-on-netflixs-new-6-part-crime-drama-with-near-perfect-rt-score/,"https://comicbook.com/wp-content/uploads/sites/4/2026/05/netflix-legends-series.jpg?resize=2000,1125",,"The frequency of Netflix’s new content means that the Top 10 on the platform is always changing. Over the past week, the Top 10 show in the United States has fluctuated wildly. Even though The Roast … [+3789 chars]",,2026-05-22 12:17:52+00:00,wmo,United States,CNA,North-America
f4b910c073cbb303d5c11b90618e306a,2026-05-18T22:19:17Z,Flood,Flood Bartholomew IN,www.tubefilter.com,en,0.2,"Top 50 der meistgesehenen YouTube-Kanäle weltweit • Woche vom 17.05.2026. In der zweiten vollen Maiwoche festigte MrBeast seine Position an der Spitze der globalen Top 50. Der Besitzer des Kanals mit den meisten Abonnenten auf YouTube erhält außerdem mehr wöchentliche Aufrufe als jeder andere YouTuber. Eine Summe von 1,42 Milliarden wöchentlichen Aufrufen war groß genug, um …",Top 50 Most Viewed YouTube Channels Worldwide • Week Of 05/17/2026,"During the second full week of May, MrBeast solidified his position at the front of the Global Top 50. The owner of YouTube's most-subscribed channel is also getting more weekly views than any other creator. A sum of 1.42 billion weekly views was big enough t…","Top 50 Most Viewed YouTube Channels Worldwide • Week Of 05/17/2026. During the second full week of May, MrBeast solidified his position at the front of the Global Top 50. The owner of YouTube's most-subscribed channel is also getting more weekly views than any other creator. A sum of 1.42 billion weekly views was big enough t…","Top 50 Most Viewed YouTube Channels Worldwide • Week Of 05/17/2026. In secunda plena septimana Maii, MrBeast locum suum in fronte Global Top L solidavit. Dominus canalis YouTube maxime subscripti etiam plus hebdomadalis opiniones quam quis alius creator questus est. Summa 1.42 billion weekly views satis magna erat t…",https://www.tubefilter.com/2026/05/18/top-50-most-viewed-youtube-channels-week-of-05-17-2026/,https://www.tubefilter.com/wp-content/uploads/2026/05/matured-women-words.jpg,,[Editors Note: Tubefilter Charts is a weekly rankings column from Tubefilter with data provided by GospelStats. Its exactly what it sounds like; a top number ranking of YouTube channels based on stat… [+4472 chars],,2026-05-22 12:17:52+00:00,wmo,United States,CNA,North-America
2b37ed67b3c48664bb881d52bda3bdda,2026-05-19T14:00:00Z,Earthquake,Earthquake Guam,comicbook.com,en,0.2,"5 moderne Science-Fiction-Meisterwerke, über die nicht genug Leute reden. Bild mit freundlicher Genehmigung von Karbo Vantas Entertainment, Sony. und Stage 6-Filme

Im 21. Jahrhundert gab es einige große Science-Fiction-Filme, die das Publikum begeisterten, darunter der jüngste Blockbuster „Project Hail Mary“. Allerdings gilt für jeden von der Kritik gefeierten Film …",5 Modern Sci-Fi Masterpieces Not Enough People Talk About,"Image Courtesy of Karbo Vantas Entertainment, Sony. and Stage 6 Films

In the 21st century, there have been some major sci-fi movies that enthralled audiences, including the recent blockbuster Project Hail Mary. However, for every critically acclaimed movie l…","5 Modern Sci-Fi Masterpieces Not Enough People Talk About. Image Courtesy of Karbo Vantas Entertainment, Sony. and Stage 6 Films

In the 21st century, there have been some major sci-fi movies that enthralled audiences, including the recent blockbuster Project Hail Mary. However, for every critically acclaimed movie l…","5 Modern Sci-Fi Masterpieces non satis de populo loqui. Image Comitas Karbo Vantas Entertainment, Sony. et Scaena VI cinematographica

Saeculo XXI, nonnullae fuerunt pelliculae sci-fi maioris, quae audientias obstringebat, inter quas recentes Projectus blockbuster Ave Maria. Sed pro omni critico acclamatur pellicula l…",http://comicbook.com/movies/list/5-modern-sci-fi-masterpieces-not-enough-people-talk-about/,"https://comicbook.com/wp-content/uploads/sites/4/2026/05/Moon-Predestination-and-Timecrimes.jpg?resize=2000,1125",,"In the 21st century, there have been some major sci-fi movies that enthralled audiences, including the recent blockbuster Project Hail Mary. However, for every critically acclaimed movie like Arrival… [+4882 chars]",,2026-05-22 12:17:52+00:00,usgs,Guam,NPO,Pacific Ocean
d5108a8d3621271c0d415150606aa0db,2026-05-19T14:22:59Z,Storm,Storm Fiordland north of Doubtful Sound,www.aljazeera.com,en,0.2,"Flucht nach Argentinien: Wie wichtig ist sie für Israels lateinamerikanische Reichweite? Experten sagen, Israel nutze den neuen Flug als geopolitisches Instrument, um seinen Fußabdruck in Lateinamerika zu festigen.",Flight to Argentina: How significant is it for Israel’s LatAm outreach?,Experts say Israel is using the new flight as a geopolitical tool to cement its footprint in Latin America.,Flight to Argentina: How significant is it for Israel’s LatAm outreach?. Experts say Israel is using the new flight as a geopolitical tool to cement its footprint in Latin America.,Fuga in Argentinam: Quomodo significans LatAm outreach est pro Israel? Periti dicunt Israelem uti nova fuga tamquam instrumento geopolitico ad suum vestigium firmandum in America Latina.,https://www.aljazeera.com/economy/2026/5/19/flight-to-argentina-how-significant-is-it-for-israels-latam-outreach,https://www.aljazeera.com/wp-content/uploads/2026/05/getty_6a0c41127a-1779187986_58fece-1779200209.jpg?resize=1200%2C630&quality=80,,Israel and Argentina have launched a direct flight starting in November as the two countries boost their ties under Argentinas far-right President Javier Milei and Israeli Prime Minister Benjamin Net… [+7479 chars],,2026-05-22 12:17:52+00:00,wmo,New Zealand,NZ,Oceania
1831212d37c220c876dd702f6f4255a9,2026-05-20T18:00:13Z,Precipitation,Torrential Rain Canada,www.city-journal.org,en,0.2,"Wie zwei Amerikaner im Auftrag philippinischer kommunistischer Terroristen im Feuergefecht starben ... Campusnetzwerke und Diasporagruppen bereiteten zwei Bürger auf radikale Gewalt vor, die zu ihrem Tod führte.",How two Americans died in gun battle on behalf of Filipino Communist terrorists...,Campus networks and diaspora groups groomed two citizens for radical violence that led to their deaths.,How two Americans died in gun battle on behalf of Filipino Communist terrorists.... Campus networks and diaspora groups groomed two citizens for radical violence that led to their deaths.,Quomodo duo Americani in pugna gunli pro terroristarum Communistarum Filipino mortui sunt.... Campi retiacula et degentium coetus duo cives paraverunt ob vim radicalem quae ad necem eorum perducta est.,https://www.city-journal.org/article/philippines-communist-party-lyle-prijoles-kai-dana-rene-sorem,https://media4.manhattan-institute.org/wp-content/uploads/sites/5/Philippines-Communist-Party-Lyle-Prijoles-Kai-Dana-Rene-Sorem-GettyImages-1546723437.jpg,,"Last month, two Americans were killed in a foreign state’s counterterrorism operation. If Lyle Prijoles, 40, and Kai Dana-Rene Sorem, 26, had been part of a group of jihadi terrorists in the Middle E… [+7389 chars]",,2026-05-22 12:17:52+00:00,wmo,Canada,NEN,North-America
1b3b35b76f5d5e0d87b1a35b7710c9de,2026-05-20T20:00:10Z,Storm,Storm Jamaica,www.foxnews.com,en,0.2,"Jeff Bezos bezeichnet Trump in seiner zweiten Amtszeit als „reifer“ und disziplinierter als in seiner ersten. Jeff Bezos sagt gegenüber CNBC, dass Präsident Donald Trump im Vergleich zu seiner ersten Amtszeit im Weißen Haus eine reifere und diszipliniertere Version seiner selbst sei.",Jeff Bezos calls Trump more 'mature' and disciplined in his second term compared to his first,"Jeff Bezos tells CNBC that President Donald Trump is a more mature, more disciplined version of himself compared to his first term in the White House.","Jeff Bezos calls Trump more 'mature' and disciplined in his second term compared to his first. Jeff Bezos tells CNBC that President Donald Trump is a more mature, more disciplined version of himself compared to his first term in the White House.","Jeff Bezos Trump plures 'maturos' vocat, et in secundo suo termino ad primum comparatum castigatus. Jeff Bezos narrat CNBC praesidem Donald Trump maturiorem esse, versionem disciplinae sui ipsius ad primum terminum in Domus Alba comparata.",https://www.foxnews.com/media/jeff-bezos-calls-trump-mature-disciplined-second-term-compared-first,https://static.foxnews.com/foxnews.com/content/uploads/2026/05/BEZOS-TRUMP.jpeg,,"Amazon founder Jeff Bezos said Wednesday that President Donald Trump was more ""mature"" and disciplined in his second term during an interview with CNBC.
""Im comparing him to his first term, and I th… [+3248 chars]",,2026-05-22 12:17:52+00:00,wmo,Jamaica,CAR,North-America
4dcdb9b556943cb834ed0170f81b841f,2026-05-20T20:54:25Z,Wildfire,Wildfire Harper Woods Ellis Woodward,www.usatoday.com,en,0.2,"Aaron Rodgers‘ NFL-Karriere-Timeline: Ein wilder Ritt für den viermaligen MVP. Aaron Rodgers plant, seine NFL-Karriere zu beenden, allerdings nicht vor einem letzten Einsatz bei den Pittsburgh Steelers in dieser Saison.",Aaron Rodgers' NFL career timeline: A wild ride for four-time MVP,"Aaron Rodgers plans to bring an end to his NFL career, but not before one last go with the Pittsburgh Steelers this season.","Aaron Rodgers' NFL career timeline: A wild ride for four-time MVP. Aaron Rodgers plans to bring an end to his NFL career, but not before one last go with the Pittsburgh Steelers this season.","Aaron Rodgers' NFL curriculo timeline: Vehiculum silvestre per quattuor tempus MVP. Aaron Rodgers cogitat finem vitae suae NFL deducere, sed non ante unum ultimum hoc tempore cum Steelers Pittsburgh ibit.",https://www.usatoday.com/story/sports/nfl/2026/05/20/aaron-rodgers-nfl-career-timeline-packers-jets-steelers-retirement/78029531007/,https://s.yimg.com/ny/api/res/1.2/uVf9DDoqvnycHOj3tPIfpQ--/YXBwaWQ9aGlnaGxhbmRlcjt3PTEyMDA7aD04MzU7Y2Y9d2VicA--/https://media.zenfs.com/en/usa_today_sports_articles_558/49b1fc0743ba43058b7b82eba2b19f87,,"Aaron Rodgers once called his football future ""a beautiful mystery."" Now, one of the game's all-time greats seems to have solved it.
The four-time NFL MVP plans to retire after his 22nd professional… [+11540 chars]",,2026-05-22 12:17:52+00:00,wmo,United States,CNA,North-America
