index,published,topic,term,domain,language,valid,de,title,description,en,la,url,image,archive,content,quote,added,feed,country,ipcc,continent
81530b4201811d6340ba32b6ddcf34f8,2025-12-05T19:10:25Z,Heat Wave,heatwave Australia,www.abc.net.au,en,0.8,"Im Westen Sydneys könnten die 40-Grad-Marke knacken, wenn eine Hitzewelle über Australien rollt. Die erste Hitzewelle des Sommers wird heute in ganz New South Wales ihren Höhepunkt erreichen. Temperaturen über 40 Grad Celsius dürften sich vom Nordwesten Westaustraliens bis nach Parramatta erstrecken.",Sydney's west could crack 40 degrees as heatwave rolls across Australia,"The first heatwave of the summer will reach its peak across New South Wales today, with temperatures above 40 degrees Celsius likely to span from Western Australia's north-west all the way to Parramatta.","Sydney's west could crack 40 degrees as heatwave rolls across Australia. The first heatwave of the summer will reach its peak across New South Wales today, with temperatures above 40 degrees Celsius likely to span from Western Australia's north-west all the way to Parramatta.","Sydney occidens 40 gradus resilire potuit sicut aestus aestus per Australiam volvitur. Prima aestus aestatis suum apicem trans Novam Australem Walliam hodie attinget, cum temperaturis supra 40 gradus Celsius usque ad occasum Australiae occidentis spatium usque ad Parramattam.",https://www.abc.net.au/news/2025-12-06/extreme-heatwave-brings-temperatures-in-40s-to-sydney/106105586,https://live-production.wcms.abc-cdn.net.au/dbca2f4c999cc67a9ee14273ef8bc29b?impolicy=wcms_watermark_news&cropH=2813&cropW=5000&xPos=0&yPos=0&width=862&height=485&imformat=generic,,"The first heatwave of the summer will reach its peak across New South Wales today, with temperatures above 40 degrees Celsius likely to span from Western Australia's north-west all the way to Parrama… [+5889 chars]",,2025-12-13 08:56:09+00:00,acwe,Australia,CAU,Oceania
409f09ce7b2011ad1bf08228a41ff550,2025-12-05T00:01:34Z,Heat Wave,heatwave Australia,www.abc.net.au,en,0.8,"Live: In ganz Australien kommt es zu Bränden und Hitzewellen, es werden extreme Warnungen ausgegeben. Es wird erwartet, dass sich eine breite Hitzewelle über ganz Australien ausbreitet, mit kurzen und heftigen Hitzeausbrüchen in den südlichen Bundesstaaten. Live verfolgen.","Live: Fires, heatwaves strike across Australia with extreme warnings issued","A broad heatwave is expected to spread across Australia, with short and sharp bursts of heat throughout the southern states. Follow live.","Live: Fires, heatwaves strike across Australia with extreme warnings issued. A broad heatwave is expected to spread across Australia, with short and sharp bursts of heat throughout the southern states. Follow live.","Vive: Ignes, aestus trans Australiam percutiunt cum monitis extremis editis. Lata aestus in Australiam diffundi expectatur, cum brevibus et acutis eruptionibus caloris per civitates meridionales. Vivamus sequere.",https://www.abc.net.au/news/2025-12-05/heatwaves-fires-live-blog-december-5/106105352,https://live-production.wcms.abc-cdn.net.au/490292c53ec9097c1403757563ac55e0?impolicy=wcms_watermark_news&cropH=864&cropW=1536&xPos=0&yPos=592&width=862&height=485&imformat=generic,,"Hello I'm Tessa Flemming and I'll be joining you as Australia swelters.
A broad heatwave is expected to spread across the country.
Throughout southern states, the burst of heat is short and sharp, … [+322 chars]",,2025-12-13 16:55:41+00:00,acwe,Australia,CAU,Oceania
d5dffc53333568a27e05a56fb40df139,2025-12-05T05:54:20Z,Heat Wave,heatwave Australia,www.abc.net.au,en,0.8,"Sind Sie von der extremen Hitzewelle in Australien betroffen? Erzählen Sie uns Ihre Geschichte. In mehreren Regionen des Landes wurden Warnungen vor extremer Hitze und Buschbränden ausgegeben. Teilen Sie Ihre Geschichte zusammen mit allen Videos oder Bildern, die Sie möglicherweise benötigen, um unsere Wetterberichterstattung zu informieren.",Are you affected by the extreme heatwave sweeping through Australia? Tell us your story,Extreme heat and bushfire warnings have been issued in several regions across the country. Share your story along with any videos or images you may have to help inform our weather coverage.,Are you affected by the extreme heatwave sweeping through Australia? Tell us your story. Extreme heat and bushfire warnings have been issued in several regions across the country. Share your story along with any videos or images you may have to help inform our weather coverage.,An extrema aestu fluctuante per Australiam vergente afficis? Narra nobis fabulam tuam. Extremi caloris et bushfire monita in pluribus regionibus per regionem edita sunt. Partis fabulam tuam una cum omnibus videos vel imaginibus iuvare potes certiorem nostrae tempestatis coverage.,https://www.abc.net.au/news/2025-12-05/audience-callout-extreme-heat-warning/106108490,https://live-production.wcms.abc-cdn.net.au/dafe973626e9a4ab81df66b26d020154?impolicy=wcms_watermark_news&cropH=2088&cropW=3712&xPos=0&yPos=328&width=862&height=485&imformat=generic,,"Extreme weather warnings are popping up across the country as temperatures quickly rise over summer.
With a ""hotter than average"" forecast, heatwaves and bushfires can be expected in several regions… [+327 chars]",,2025-12-13 16:55:41+00:00,acwe,Australia,CAU,Oceania
24c6085438190bcc9728a3d3b4f9de69,2025-12-15T13:01:50Z,Snow&Ice,Avalanche Canada,researchbuzz.me,en,0.9,"Avalanche Canada, Snapscope, Reddit, Mehr: Montag ResearchBuzz, 15. Dezember 2025. NEUE RESSOURCEN NTV: Avalanche Canada startet neue Datenbank für tödliche Lawinenvorfälle. „Avalanche Canada hat gerade eine neue Website gestartet, die alle bekannten Lawinentoten in Kanada seit 1792 dokumentiert. Zusätzlich zu […]","Avalanche Canada, Snapscope, Reddit, More: Monday ResearchBuzz, December 15, 2025",NEW RESOURCES NTV: Avalanche Canada launches new database for fatal avalanche incidents. “Avalanche Canada has just launched a new site documenting every known avalanche fatality in Canada since 1792. In addition to […],"Avalanche Canada, Snapscope, Reddit, More: Monday ResearchBuzz, December 15, 2025. NEW RESOURCES NTV: Avalanche Canada launches new database for fatal avalanche incidents. “Avalanche Canada has just launched a new site documenting every known avalanche fatality in Canada since 1792. In addition to […]","Avalanche Canada, Snapscope, Reddit, More: Monday ResearchBuzz, December 15, 2025. NEW RESOURCES NTV: Avalanche Canada, nova datorum perniciosa incidentia inducit. ""Avalanche Canada modo novum locum documenting omnem notam NIVIS CASUS fatalem in Canada cum 1792 excussit. Praeter […]",https://researchbuzz.me/2025/12/15/avalanche-canada-snapscope-reddit-more-monday-researchbuzz-december-15-2025/,https://s0.wp.com/_si/?t=eyJpbWciOiJodHRwczpcL1wvczAud3AuY29tXC9pXC9ibGFuay5qcGciLCJ0eHQiOiJSZXNlYXJjaEJ1enoiLCJ0ZW1wbGF0ZSI6ImhpZ2h3YXkiLCJmb250IjoiIiwiYmxvZ19pZCI6NDMyODc1Nn0.BjdcPIDlw4ZG0Ki13B-quwxnrzAxn9iB5rJXagRMNlcMQ,,"NEW RESOURCES 
NTV: Avalanche Canada launches new database for fatal avalanche incidents. “Avalanche Canada has just launched a new site documenting every known avalanche fatality in Canada since 17… [+5238 chars]",,2025-12-17 05:01:08+00:00,wmo,Canada,NEN,North-America
3f280e5937ff2302be68156b99234643,2025-12-16T02:18:47Z,Storm,storm Australia,www.fool.com.au,en,0.8,"Seek-Aktien dürften im nächsten Jahr um 45 % steigen: Hier ist der Grund. Macquarie teilt seine Meinung zum neuesten Beschäftigungsbericht für November.
Der Beitrag Seek-Aktien dürften im nächsten Jahr um 45 % steigen: Aus folgenden Gründen erschien zuerst auf The Motley Fool Australia.",Seek shares tipped to storm 45% higher next year: Here's why,"Macquarie shares its view on the latest employment report for November.
The post Seek shares tipped to storm 45% higher next year: Here's why appeared first on The Motley Fool Australia.","Seek shares tipped to storm 45% higher next year: Here's why. Macquarie shares its view on the latest employment report for November.
The post Seek shares tipped to storm 45% higher next year: Here's why appeared first on The Motley Fool Australia.",Quaere portiones 45% altioris anni sequentis ad expugnandam praefixa: Hic est cur. Macquarie sententiam suam communicat in relationibus Novembri Novembri. Postes quaerite communicat 45% superiore anno proximo expugnaturus: Hic primum apparuit cur in Australia Stulte Motley.,https://www.fool.com.au/2025/12/16/seek-shares-tipped-to-storm-45-higher-next-year-heres-why/,https://www.fool.com.au/wp-content/uploads/2022/02/jobs-1-1200x675.jpg,,"Seek Ltd (ASX: SEK) shares are trading in the red again in Tuesday morning trade. At the time of writing, the job listing company's shares are down 1.51% to $22.50 a piece. 
The latest tumble means … [+2235 chars]",,2025-12-20 16:54:50+00:00,aidr,Australia,SAU,Oceania
91c3efddf157263eca49c892a660c550,2025-12-19T19:50:45Z,Storm,storm Australia,www.abc.net.au,en,0.8,"Extreme Hitze, Feuchtigkeit und Stürme vor dem Weihnachtstag. Australien erlebt in der Vorweihnachtszeit ein wildes Wettermeer mit extremer Hitze, hoher Luftfeuchtigkeit, heftigen Gewittern und tropischen Stürmen.","Extreme heat, humidity and storms ahead of Christmas Day","Australia is experiencing a smorgasbord of wild weather in the lead-up to Christmas, featuring extreme heat, humidity, severe thunderstorms, and tropical storms all on the cards.","Extreme heat, humidity and storms ahead of Christmas Day. Australia is experiencing a smorgasbord of wild weather in the lead-up to Christmas, featuring extreme heat, humidity, severe thunderstorms, and tropical storms all on the cards.","Extremus calor, humiditas et procellae ante diem natalem Domini. Australia experitur smorgasbord tempestates silvestres in plumbo usque ad Nativitatem Domini, in agendo calorem extremum, humiditatem, procellas graves, et procellas tropicas omnibus in charta.",https://www.abc.net.au/news/2025-12-20/bom-christmas-weather-forecast/106163070,https://live-production.wcms.abc-cdn.net.au/edddf099b3cc436a435c32c3b0c8a1fe?impolicy=wcms_watermark_news&cropH=658&cropW=1170&xPos=0&yPos=121&width=862&height=485&imformat=generic,,"Australia is getting a smorgasbord of extreme weather over the next few days, featuring heat and humidity, severe thunderstorms and tropical storms.
It all comes ahead of a Christmas Day scorcher in… [+7625 chars]",,2025-12-22 05:03:32+00:00,aidr,Australia,SAU,Oceania
d0f6f78a4c948a75c9cdf4deb1519d54,2025-12-21T05:28:36Z,Fog,Fog India,www.ndtvprofit.com,en,0.8,"Nebel stört den Flugbetrieb in ganz Nordindien. Passagieren wird empfohlen, sich über Aktualisierungen zu informieren. Dichter Nebel in Teilen Nordindiens beeinträchtigt die Sicht und führt an mehreren Flughäfen zu möglichen Verspätungen oder Änderungen der Flugpläne. Die Behörden haben Passagiere aufgefordert, den Flugstatus bei den Fluggesellschaften zu bestätigen und zusätzliche Zeit für Reise und Formalitäten einzuplanen …","Fog Disrupts Flight Operations Across Northern India, Passengers Advised To Check Updates",Dense fog in parts of Northern India is impacting visibility and causing potential delays or changes in flight schedules at several airports. Authorities have urged passengers to confirm flight status with airlines and allow extra time for travel and formalit…,"Fog Disrupts Flight Operations Across Northern India, Passengers Advised To Check Updates. Dense fog in parts of Northern India is impacting visibility and causing potential delays or changes in flight schedules at several airports. Authorities have urged passengers to confirm flight status with airlines and allow extra time for travel and formalit…","Nebula Disrupts fuga Operations Trans Septentrionalem Indiam, Viatorum Admonitus ad Reprimendam Updates. Nebula densa in partibus Indiae septentrionalis visibilitatem impactus est et causat moras potentiales vel mutationes in cedulas volandi in pluribus nisl. Auctoritates viatores suaserunt ut statum fugae cum airlines confirmare et tempus extra tempus peregrinatione et formalit permitterent.",https://www.ndtvprofit.com/business/fog-disrupts-flight-operations-across-northern-india-passengers-advised-to-check-updates,https://media.assettype.com/bloombergquint%2F2025-12-16%2Fbz4b87pq%2FPTI12152025000062A.jpg?w=1200&auto=format%2Ccompress&ogImage=true,,Dense fog in parts of Northern India is impacting visibility and causing potential delays or changes in flight schedules at several airports. Authorities have urged passengers to confirm flight statu… [+1079 chars],,2025-12-24 05:03:24+00:00,wmo,India,SAS,Asia
e20da7ddcde49fd508c065533503d7ea,2025-12-15T09:31:11Z,Tropical Cyclone,cyclone Australia,economictimes.indiatimes.com,en,0.0,"Terroranschlag in Bondi Beach: Von der israelischen Geisel bis zum Zyklon Alfred – wie Elon Musks KI-Chatbot Grok den unbeteiligten Helden Ahmed al Ahmed falsch identifizierte. Elon Musks KI-Chatbot Grok ist unter Beschuss geraten, nachdem er falsche und irreführende Informationen über die Schießerei am australischen Bondi Beach verbreitet hat. Grok machte falsche Angaben über Ahmed al Ahmed, der mit bewaffneten Männern kämpfte, um das Leben von Zivilisten zu retten. Während in einer Antwort…","Bondi Beach terrorist attack: From Israeli hostage to cyclone Alfred, how Elon Musk's AI chatbot Grok misidentified hero bystander Ahmed al Ahmed",Elon Musk's AI Chatbot Grok has come under fire after spreading false and misleading information about Australia’s Bondi Beach shooting. Grok gave false information about Ahmed al Ahmed who fought with gunmen to save the lives of civilians. While in one respo…,"Bondi Beach terrorist attack: From Israeli hostage to cyclone Alfred, how Elon Musk's AI chatbot Grok misidentified hero bystander Ahmed al Ahmed. Elon Musk's AI Chatbot Grok has come under fire after spreading false and misleading information about Australia’s Bondi Beach shooting. Grok gave false information about Ahmed al Ahmed who fought with gunmen to save the lives of civilians. While in one respo…","Terroristae Bondi Beach impetum: Ab Israelis obses ad cyclonem Alfredi, quomodo Elon Musk AI chatbot Grok heros adstat Ahmed al Ahmed. Elon Musk's AI Chatbot Grok sub ignem venit postquam falsas et fallax notitias de Australiae Bondi Litus inhibuit. Grok falsum indicium dedit de Ahmed al Ahmed qui cum gunmens ad vitam civium salvandam pugnavit. Dum in uno respo…",https://economictimes.indiatimes.com/news/new-updates/bondi-beach-terrorist-attack-from-israeli-hostage-to-cyclone-alfred-how-elon-musks-ai-chatbot-grok-misidentifies-hero-bystander-ahmed-al-ahmed/articleshow/125976023.cms,"https://img.etimg.com/thumb/msid-125976173,width-1200,height-630,imgsize-36082,overlay-economictimes/articleshow.jpg",,"Following the devastating mass shooting at Bondi Beach in Australia's Sydney which killed at least 16 people, Elon Musk's Grok has found itself at the receiving end as it was found spreading incorrec… [+4012 chars]",,2025-12-24 16:58:12+00:00,aidr,Australia,NAU,Oceania
3efe3cd0c104f7097d32fc1fc529195a,2025-12-10T05:30:00Z,Storm,Storm Ireland,www.independent.ie,en,0.8,"Sturm Bram bringt Elend mit sich, da Tausende von Stromausfällen, Überschwemmungen und Reiseunterbrechungen mit Böen von bis zu 120 km/h betroffen sind. Sturm Bram verursachte gestern in ganz Irland Elend, da auf dem Höhepunkt des Sturms fast 60.000 Gebäude ohne Strom blieben und Tausende Pendler von annullierten Flügen, Fähren und Zügen sowie Straßensperrungen betroffen waren.","Storm Bram brings misery as thousands hit by power cuts, flooding and travel disruption with gusts of up to 120kmh","Storm Bram caused misery across Ireland yesterday as almost 60,000 premises were left without power at the height of the storm and thousands of commuters were hit by cancelled flights, ferries and trains as well as road closures.","Storm Bram brings misery as thousands hit by power cuts, flooding and travel disruption with gusts of up to 120kmh. Storm Bram caused misery across Ireland yesterday as almost 60,000 premises were left without power at the height of the storm and thousands of commuters were hit by cancelled flights, ferries and trains as well as road closures.","Tempestas Bram miseriam affert quam mille ictus potentiae secat, inundans et iter discidium cum procellis usque ad 120kmh. Tempestas Bram trans Hiberniam miserrimam effecit heri cum fere 60.000 praemissis sine potestate in summa tempestatis relicti ac mille commutrarum volatus, vecturae et impedimenta necnon viarum clausuras elisae sunt.",https://www.independent.ie/irish-news/storm-bram-brings-misery-as-thousands-hit-by-power-cuts-flooding-and-travel-disruption-with-gusts-of-up-to-120kmh/a133781220.html,https://focus.independent.ie/thumbor/5T-XRX-giZ_srO39lbXdStcgN8M=/60x0:735x450/629x0/prod-mh-ireland/0568b5ec-6c12-47d6-bdf4-de08d74a4f99/a5fc1263-3bdd-4f98-bbf4-63349ba7cc0d/video/video.jpg,,"Storm Bram caused misery across Ireland yesterday as almost 60,000 premises were left without power at the height of the storm and thousands of commuters were hit by cancelled flights, ferries and tr… [+4743 chars]",,2025-12-25 20:55:34+00:00,wmo,Ireland,NEU,Europe
fc6a309319500672ef9f047940fdc493,2025-12-08T21:18:35Z,Earthquake,Earthquake Canada,www.insurancejournal.com,en,0.8,"Erdbeben der Stärke 7,0 erschütterte abgelegenes Gebiet entlang der Grenze zwischen Alaska und Kanada. Ein starkes Erdbeben der Stärke 7,0 ereignete sich am Samstag in einem abgelegenen Gebiet nahe der Grenze zwischen Alaska und dem kanadischen Territorium Yukon. Es gab keine Tsunami-Warnung und Beamte sagten, es gebe keine unmittelbaren Berichte über Schäden oder Verletzungen. Der …",Magnitude-7.0 Earthquake Hit Remote Area Along Alaska-Canada Border,"A powerful, magnitude-7.0 earthquake struck in a remote area near the border between Alaska and the Canadian territory of Yukon on Saturday. There was no tsunami warning, and officials said there were no immediate reports of damage or injury. The …","Magnitude-7.0 Earthquake Hit Remote Area Along Alaska-Canada Border. A powerful, magnitude-7.0 earthquake struck in a remote area near the border between Alaska and the Canadian territory of Yukon on Saturday. There was no tsunami warning, and officials said there were no immediate reports of damage or injury. The …","Magnitude-7.0 Terrae motus Hit Longinquus Area Per Alaska-Canada Border. Terraemotus potens, magnitudine-7.0 concussus in area remota prope confinium inter Alaska et Canadensis territorium Yukon die Sabbati. Tsunami monitus non fuit, et magistratus dixerunt nullae proximi denuntiationes damni vel iniuriae esse. The ...",https://www.insurancejournal.com/news/west/2025/12/08/850301.htm,https://www.insurancejournal.com/img/social/opengraph/ij-social-default-1200x630.png,,"A powerful, magnitude-7.0 earthquake struck in a remote area near the border between Alaska and the Canadian territory of Yukon on Saturday. There was no tsunami warning, and officials said there wer… [+1128 chars]",,2025-12-26 02:32:52+00:00,usgs,Canada,NWN,North-America
8c487369589eee7451c83b414b957a97,2025-12-23T11:36:51Z,Precipitation,Rain Canada,www.cbc.ca,en,0.8,"Am Dienstagmorgen wird in Toronto Schnee und Eisregen erwartet. Schnee und Eisregen könnten sich am Dienstag auf den morgendlichen Pendelverkehr auswirken, heißt es in einer speziellen Wettererklärung von Environment Canada.","Snow, freezing rain expected in Toronto Tuesday morning","Snow and freezing rain could affect morning commutes on Tuesday, according to a special weather statement issued by Environment Canada.","Snow, freezing rain expected in Toronto Tuesday morning. Snow and freezing rain could affect morning commutes on Tuesday, according to a special weather statement issued by Environment Canada.","Nix, glacians, in Toronto Martis mane expectata est. Nix et imbres rigentes mane die Martis commutationes afficere potuerunt, secundum peculiarem tempestatem enuntiationem ab Environment Canadam editam.",https://www.cbc.ca/news/canada/toronto/snow-freezing-rain-toronto-weather-statement-9.7026102,"https://i.cbc.ca/ais/eea63663-e533-4017-b8cf-fdbd7d5c8f08,1766487035794/full/max/0/default.jpg?im=Crop%2Crect%3D%280%2C243%2C4663%2C2622%29%3BResize%3D620",,"Snow and freezing rain could affect morning commutes on Tuesday, according to a special weather statement issued by Environment Canada.
Toronto can expect between five and ten centimetres of snow wi… [+649 chars]",,2025-12-26 13:23:54+00:00,wmo,Canada,NEN,North-America
9948a3457194230cb319aed96814f154,2025-12-17T14:43:07Z,Storm,Storm Canada,www.cbc.ca,en,0.8,"Durch den Sturm wird der Strom für 120.000 Haushalte im Lower Mainland von British Columbia unterbrochen. Environment Canada empfiehlt, lose Gegenstände zu sichern und sich von heruntergefallenen Stromleitungen fernzuhalten.","Storm knocks out power for 120,000 homes across B.C.'s Lower Mainland",Environment Canada recommends people secure loose objects and stay away from fallen power lines.,"Storm knocks out power for 120,000 homes across B.C.'s Lower Mainland. Environment Canada recommends people secure loose objects and stay away from fallen power lines.",Tempestas potestatem per 120.000 domos per inferiorem continentem BC pulsat. Ambitus Canada homines commendat laxas res securas et a lineis potentiae lapsis discedite.,https://www.cbc.ca/news/canada/british-columbia/storms-downs-power-b-c-south-coast-9.7019260,"https://i.cbc.ca/ais/d9dc255a-3844-408f-b598-c6b20a07cc4b,1765982917687/full/max/0/default.jpg?im=Crop%2Crect%3D%28165%2C0%2C1639%2C921%29%3BResize%3D620",,"A wind and rainstorm has downed power for more than 100,000 B.C. Hydro customers across the Lower Mainland and Fraser Valley Wednesday morning. 

B.C. Hydro says its the third major weather-related o… [+1092 chars]",,2025-12-29 16:58:54+00:00,wmo,Canada,NEN,North-America
4f3206767251bfa7f40d1446c3f7597c,2025-12-04T00:01:00Z,Storm,Storm Ireland,www.rte.ie,en,0.4,„Storm Éowyn“ ist der meistgegoogelte Begriff des Jahres. Storm Éowyn war dieses Jahr der am häufigsten gesuchte Begriff bei Google in Irland.,'Storm Éowyn' most Googled term of the year,Storm Éowyn was the most searched term on Google in Ireland this year.,'Storm Éowyn' most Googled term of the year. Storm Éowyn was the most searched term on Google in Ireland this year.,'Tempestas Éowyn' terminus anni maxime Googled. Tempestas Éowyn erat exquisitissima terminus Google in Hibernia hoc anno.,https://www.rte.ie/news/2025/1204/1547174-google-most-searched/,https://www.rte.ie/images/0023937f-1600.jpg,,"Storm Éowyn was the most searched term on Google in Ireland this year.
People also turned to the search engine to find out how to pronounce the storm's name. ""How to pronounce Éowyn"" was the third m… [+1511 chars]",,2026-01-01 09:01:08+00:00,wmo,Ireland,NEU,Europe
d1c3fa3003ec7896718ec42b777ec216,2025-12-09T06:00:00Z,Storm,Storm Ireland,www.independent.ie,en,0.8,"Status-Orange-Warnungen: Storm Bram bringt starke Winde nach Irland, Meteorologen warnen vor „sehr windigen oder stürmischen Bedingungen“. {
 „themeId“: „lct_653b7fa7fed115003648bab8“,
 „clientId“: „64772ae4d1d7dec0c5b716af“,
 „liveblogId“: „6937bd39bcd16e9a09f660b8“
}","Status Orange warnings as Storm Bram to bring strong winds to Ireland, forecasters warn of ‘very windy or stormy conditions’","{
 ""themeId"": ""lct_653b7fa7fed115003648bab8"",
 ""clientId"": ""64772ae4d1d7dec0c5b716af"",
 ""liveblogId"": ""6937bd39bcd16e9a09f660b8""
}","Status Orange warnings as Storm Bram to bring strong winds to Ireland, forecasters warn of ‘very windy or stormy conditions’. {
 ""themeId"": ""lct_653b7fa7fed115003648bab8"",
 ""clientId"": ""64772ae4d1d7dec0c5b716af"",
 ""liveblogId"": ""6937bd39bcd16e9a09f660b8""
}","Status Aurei admonitiones ut Storm Bram ut ventos validos in Hiberniam adferant, forecasters monent de conditionibus valde ventis vel tempestatibus. { ""themeId"": ""lct_653b7fa7fed115003648bab8"", ""clientId"": ""64772ae4d1d7dec0c5b716af"", ""liveblogId"": ""6937bd39bcd16e9a09f660b8"" }",https://www.independent.ie/weather/status-orange-warnings-as-storm-bram-to-bring-strong-winds-to-ireland-forecasters-warn-of-very-windy-or-stormy-conditions/a1017141655.html,https://focus.independent.ie/thumbor/KnV96_J1ahBfTRZoRT-Kv0uofCg=/60x0:735x450/629x0/prod-mh-ireland/e5901dc1-659d-46be-9c27-257ab330c188/0b64c101-db4e-4aaa-985b-b35d5675324a/video/video.jpg,,Ireland is bracing for heavy winds and rain tonight as Storm Bram hits the country. Met Éireann has issued a Status Yellow wind warning for the whole country and two Status Orange wind warnings for 1… [+2814 chars],,2026-01-01 09:01:08+00:00,wmo,Ireland,NEU,Europe
