index,published,topic,term,domain,language,valid,de,title,description,en,la,url,image,archive,content,quote,added,feed,country,ipcc,continent
22a251161427b456090cc7a99547da25,2025-12-07T03:11:52Z,Earthquake,Earthquake United States,dailycaller.com,en,0.8,"Alaska wurde von über 20 Nachbeben heimgesucht, nachdem es von einem Erdbeben der Stärke 7,0 erschüttert wurde. Nach Angaben des United States Geological Survey (USGS) ereignete sich am Samstag in den Morgenstunden ein Erdbeben der Stärke 7,0 in Alaska.",Alaska Blasted With Over 20 Aftershocks After Getting Rocked With Magnitude 7.0 Earthquake,"According to the United States Geological Survey (USGS), a magnitude 7.0 earthquake struck Alaska during the morning hours Saturday.","Alaska Blasted With Over 20 Aftershocks After Getting Rocked With Magnitude 7.0 Earthquake. According to the United States Geological Survey (USGS), a magnitude 7.0 earthquake struck Alaska during the morning hours Saturday.","Alaska Blasted Cum Super 20 Aftershocks Post Questus Rocked Cum Magnitudine 7.0 Terraemotus. Secundum Civitates Foederatas Geological Survey (USGS), magnitudo 7.0 terrae motus Alaska horis matutinis Saturni percussit.",https://dailycaller.com/2025/12/06/alaska-20-aftershocks-magnitude-7-0-earthquake/,"https://images.dailycaller.com/image/width=1280,height=549,fit=cover,format=webp,f=auto/https://cdn01.dailycaller.com/wp-content/uploads/2025/12/GettyImages-1587622-scaled-e1765076733660.jpg",,"According to the United States Geological Survey (USGS), a magnitude 7.0 earthquake struck Alaska during the morning hours Saturday.

The earthquake struck at 11:41 a.m. local time northeast of Yakut… [+1963 chars]",,2026-01-02 05:05:18+00:00,usgs,United States,NWN,North-America
75c214c0968ca3dff5aeb78b214deb16,2025-12-07T21:14:26Z,Earthquake,Earthquake Canada,biztoc.com,en,0.8,Über 160 Erdbeben erschüttern Alaska innerhalb von 24 Stunden nach dem Beben der Stärke 7. Das erste Erdbeben am Samstag löste Erschütterungen im Südosten Alaskas und in Teilen Kanadas aus.,Over 160 Earthquakes Strike Alaska in 24 Hours Following Magnitude 7 Quake,The initial earthquake on Saturday sent tremors across southeastern Alaska and parts of Canada.,Over 160 Earthquakes Strike Alaska in 24 Hours Following Magnitude 7 Quake. The initial earthquake on Saturday sent tremors across southeastern Alaska and parts of Canada.,Plus 160 terrae motus Percutite Alaska in 24 Horis Post Magnitude 7 Quake. Terrae motus initialis die Saturni misit tremores trans Alascam et partes Canadae australes.,https://biztoc.com/x/c64777be357c63df,https://biztoc.com/cdn/955/og.png,,"The initial earthquake on Saturday sent tremors across southeastern Alaska and parts of Canada.
This story appeared on newsweek.com, 2025-12-07 21:10:02.",,2026-01-02 16:59:37+00:00,usgs,Canada,NWN,North-America
b2133bf1071c94a8e033ef64f35455dd,2025-12-21T03:53:16Z,Flood,flood Australia,economictimes.indiatimes.com,en,0.8,"Ausgedehntes Sturmsystem, das Südaustralien, Victoria und NSW erfasst, da weiterhin Hitzewellen und extreme Brandgefahr bestehen und sich bis nach Tasmanien und Süd-Queensland ausdehnt. Der Südosten Australiens bereitet sich auf eine Unwetterkatastrophe vor, bei der es neben extremer Hitze auch zu Gewittern, großem Hagel und schädlichen Winden kommen wird. Meteorologen warnen vor Sturzfluten und einer leichten Tornadogefahr in New South Wales und Victoria. Trotz d…","Widespread storm system to sweep South Australia, Victoria, and NSW as heatwave and extreme fire danger persist, extending into Tasmania and southern Queensland","South-east Australia braces for a severe weather onslaught, with thunderstorms, large hail, and damaging winds set to strike alongside extreme heat. Meteorologists warn of flash flooding and a slight tornado risk across New South Wales and Victoria. Despite t…","Widespread storm system to sweep South Australia, Victoria, and NSW as heatwave and extreme fire danger persist, extending into Tasmania and southern Queensland. South-east Australia braces for a severe weather onslaught, with thunderstorms, large hail, and damaging winds set to strike alongside extreme heat. Meteorologists warn of flash flooding and a slight tornado risk across New South Wales and Victoria. Despite t…","Systema tempestatis divulgatum Australium Australiam, Victoriam, et NSW evertendi ut periculum caloris et ignis extremi perseuerent, in Tasmania et Queenslandia australi extenduntur. Australis-orientalis Australia gravibus tempestatum incursibus adstringit, cum procellis, grandinibus, et ventis damnosis ad extremum caloris e regione percutiendum. Meteorologi monent de inundatione emicare et leve turbo periculum trans Novam Walliam et Victoriam. Quamvis t…",https://economictimes.indiatimes.com/news/international/australia/widespread-storm-system-to-sweep-south-australia-victoria-and-nsw-as-heatwave-and-extreme-fire-danger-persist-extending-into-tasmania-and-southern-queensland/articleshow/126101087.cms,"https://img.etimg.com/thumb/msid-126101099,width-1200,height-630,imgsize-172671,overlay-economictimes/articleshow.jpg",,"A volatile mix of severe thunderstorms, large hail and extreme heat is set to batter south-east Australia, as a significant storm outbreak moves across multiple states already sweltering under stifli… [+2856 chars]",,2026-01-04 03:01:47+00:00,aidr,Australia,EAU,Oceania
67bc1848de1ec4207ab64e0b3857cf15,2025-12-28T17:14:11Z,Snow&Ice,Ice United States,www.mensjournal.com,en,0.8,"Nationaler Wetterdienst gibt Warnung „Bleiben Sie drinnen“ heraus, da sich 36 Zoll Schnee nähern. Die Vereinigten Staaten wurden in den letzten Wochen bereits von zahlreichen Winterstürmen heimgesucht, die in Teilen des Landes starken Schneefall und starke Winde mit sich brachten...",National Weather Service Issues 'Stay Inside' Warning as 36 Inches of Snow Approach,"The United States has already been hit with quite a few winter storms over the past several weeks, bringing heavy snow and high winds to parts of the country...","National Weather Service Issues 'Stay Inside' Warning as 36 Inches of Snow Approach. The United States has already been hit with quite a few winter storms over the past several weeks, bringing heavy snow and high winds to parts of the country...","Nationalis Tempestatis Service Exitus 'Mane Intus' Admonitio ut 36 Unciarum Nivis Accessus. Civitates Americae Unitae iam compluribus tempestatibus hiemalibus per past aliquot septimanas percussae sunt, graves nives et ventos altos ad partes regionis afferentes.",https://www.mensjournal.com/news/national-weather-service-issues-stay-inside-warning-as-36-inches-of-snow-approach,https://media.zenfs.com/en/men_s_journal_718/7e2671cafe828b766082e81b9d89d550,,"The United States has already been hit with quite a few winter storms over the past several weeks, bringing heavy snow and high winds to parts of the country. Now, another major winter storm is appro… [+4511 chars]",,2026-01-04 20:55:04+00:00,wmo,United States,CNA,North-America
5eef11d74efe9eeea5731faa3570e4b6,2025-12-29T05:00:57Z,Storm,Storm United States,www.yahoo.com,en,0.8,"Truckern östlich der I-35 wurde geraten, zu Hause zu bleiben. Warm zu bleiben und abseits der Straße zu bleiben ist besser als Ezra. Während sich der Wintersturm Ezra in den zentralen und östlichen Vereinigten Staaten verstärkt, steht die Frachtbranche vor einer...",Truckers east of I-35 advised to stay home,"Staying warm and off the road is better than Ezra As Winter Storm Ezra intensifies across the central and eastern United States, the freight industry faces a...","Truckers east of I-35 advised to stay home. Staying warm and off the road is better than Ezra As Winter Storm Ezra intensifies across the central and eastern United States, the freight industry faces a...","Truckers oriens of I-35 consilium ut domum maneret. Calidum morans et via melior est quam Ezra, sicut Esdras hiemalis Storm exaggerat per Civitates Foederatas centrales et orientales, onerariam industriam respicit a...",https://www.yahoo.com/news/articles/truckers-east-35-advised-stay-050057425.html,https://media.zenfs.com/en/freightwaves_373/4b256169f8c4eded8771433a370733ab,,"Staying warm and off the road is better than Ezra
As Winter Storm Ezra intensifies across the central and eastern United States, the freight industry faces a severe threat from high winds that could… [+4336 chars]",,2026-01-04 20:55:04+00:00,wmo,United States,CNA,North-America
1dd97f6d81c758018f30760e83da5e8b,2025-12-06T20:49:45Z,Snow&Ice,Avalanche United States,www.denverpost.com,en,0.0,"Avalanche Journal: Könnte Brock Nelsons heiße Phase ihm helfen, eine wichtige Rolle im US-Olympiateam zu finden? Es ist ziemlich schwierig, einen geplanten Kader der Vereinigten Staaten für die Olympischen Winterspiele 2026 mit Brock Nelson zu finden.",Avalanche Journal: Could Brock Nelson’s hot streak help him find a depth role on the U.S. Olympic team?,It's pretty hard to find a projected United States roster for the 2026 Winter Olympics with Brock Nelson on it.,Avalanche Journal: Could Brock Nelson’s hot streak help him find a depth role on the U.S. Olympic team?. It's pretty hard to find a projected United States roster for the 2026 Winter Olympics with Brock Nelson on it.,Acta Avalanche: series calida potuit Brock Nelson ei adiuvare in U.S. Olympiae quadrigis munus invenire? Satis difficile est invenire proiectum Civitatum Foederatarum numero 2026 Olympia Hiemalia cum Brock Nelson in ea.,https://www.denverpost.com/2025/12/06/avalanche-nelson-united-states-olympics-roster/,https://www.denverpost.com/wp-content/uploads/2025/11/TDP-L-Avalanche-Rangers-RJS-17902.jpg?w=1024&h=698,,"It’s pretty hard to find a projected United States roster for the 2026 Winter Olympics with Brock Nelson on it.
It also might be harder for the Team USA braintrust to leave Nelson off the team than … [+6237 chars]",,2026-01-05 20:57:51+00:00,wmo,United States,CNA,North-America
c1c13562c72356355833ff91d4430a5f,2025-12-09T06:45:36Z,Storm,Storm Wales,www.bbc.com,en,0.8,"Überschwemmungen und Wetterwarnungen gelten in ganz Wales, da der Sturm Bram zuschlägt. Es gibt acht Hochwasserwarnungen sowie mehr als 50 Hochwasserwarnungen im ganzen Land.",Flood and weather warnings in place across Wales as Storm Bram hits,"Eight flood warnings are in place, along with more than 50 flood alerts across the country.","Flood and weather warnings in place across Wales as Storm Bram hits. Eight flood warnings are in place, along with more than 50 flood alerts across the country.","Diluvium et tempestas admonitiones in loco trans Walliam ut Storm Bram pervenit. Monitiones in diluvio octo in loco, una cum plus quam 50 summis montibus inundationis per regionem.",https://www.bbc.com/news/articles/cx2dxk3nn54o,https://ichef.bbci.co.uk/news/1024/branded_news/3375/live/acc85350-d42a-11f0-a892-01d657345866.jpg,,"Amy Mackrill,BBC Walesand
There were more than 50 flood alerts across Wales by 0600 GMT on Tuesday

Flood warnings and weather warnings for wind and rain are in place across Wales as Storm Bram hits… [+3889 chars]",,2026-01-06 17:03:22+00:00,wmo,United Kingdom,NEU,Europe
b0c48290d855aa1634f9fc3cc17cf398,2025-12-29T06:58:51Z,Storm,Storm Canada,economictimes.indiatimes.com,en,0.8,"In Ontario und Quebec wird mehrfach vor starkem Schneefall und Regen gewarnt, da der Wintersturm Kanada vor Silvester in höchster Alarmbereitschaft hält. Ontario steht vor strengem Winterwetter mit Schnee- und Eisregenwarnungen. Ein schwerer Sturm zieht auf den Süden Quebecs zu. In Städten wie London und Toronto könnte es zu starkem Regen und starkem Wind kommen. Eisiger Regen wird voraussichtlich zu Reiseverzögerungen und Stromausfällen führen …","Ontario, Quebec see multiple warnings of heavy snow and rain as winter storm keeps Canada on high alert ahead of New Year’s eve",Ontario is facing severe winter weather with snow and freezing rain warnings. A major storm is moving towards southern Quebec. Cities like London and Toronto could see heavy rain and high winds. Freezing rain is expected to cause travel delays and power outag…,"Ontario, Quebec see multiple warnings of heavy snow and rain as winter storm keeps Canada on high alert ahead of New Year’s eve. Ontario is facing severe winter weather with snow and freezing rain warnings. A major storm is moving towards southern Quebec. Cities like London and Toronto could see heavy rain and high winds. Freezing rain is expected to cause travel delays and power outag…","Ontario, Quebec multa monita gravium nivis et pluviarum vident sicut tempestas hiemalis Canadam in alto vigilat ante vigiliam Novus Annus custodit. Ontario tempestates hiemales graves nives et imbres rigentes monebant. Maior tempestas Quebecum meridionalem versus tendit. Urbes sicut London et Toronto videre potuerunt pluvias et ventos altos. Imber congelatio expectatur ut causa itinerantur moras et potentiam outag…",https://economictimes.indiatimes.com/news/international/canada/ontario-quebec-see-multiple-warnings-of-heavy-snow-and-rain-as-winter-storm-keeps-canada-on-high-alert-ahead-of-new-years-eve/articleshow/126226728.cms,"https://img.etimg.com/thumb/msid-126226828,width-1200,height-630,imgsize-213736,overlay-economictimes/articleshow.jpg",,"Ontario continues to reel under bone-chilling weather days ahead of New Year’s Eve as wintry precipitation pushes further into the region, prompting widespread snow and freezing rain warnings. The st… [+2449 chars]",,2026-01-09 09:03:28+00:00,wmo,Canada,NEN,North-America
8aa0dc6c3d3b3060c8552b42e36209ba,2025-12-29T15:13:33Z,Snow&Ice,Frost Chevery,www.cbsnews.com,en,0.2,Der Wintersturm könnte über den Großen Seen und im Nordosten zu einem Bombenzyklon werden. Ein mächtiges Wintersturmsystem könnte diese Woche über den Großen Seen und den Nordostregionen zu einem „Bombenzyklon“ werden.,Winter storm could become bomb cyclone over Great Lakes and Northeast,"A powerful winter storm system could become a ""bomb cyclone"" over the Great Lakes and Northeast regions this week.","Winter storm could become bomb cyclone over Great Lakes and Northeast. A powerful winter storm system could become a ""bomb cyclone"" over the Great Lakes and Northeast regions this week.","Tempestas hiemalis fieri potuit cyclone bomba super Magnas Lacus et Orientem. Potens ratio tempestatis hiemalis in ""cyclone bombo"" fieri potuit per Magnas Lacus et regiones septentrionales hac septimana.",https://www.cbsnews.com/news/winter-storm-bomb-cyclone-great-lakes-and-northeast-maps-latest-forecast/,https://assets1.cbsnewsstatic.com/hub/i/r/2025/12/29/e8c3c2db-d9e3-43dd-853e-5955ff553ef2/thumbnail/1200x630/30b2dd746dde7a9c4d52f748edb62ee9/ap25362546974747.jpg,,"A powerful storm system currently producing heavy snow, rain and strong winds across parts of the northern United States could become a ""bomb cyclone"" over the Great Lakes and Northeast regions, fore… [+2524 chars]",,2026-01-13 19:11:04+00:00,wmo,Canada,NEN,North-America
e40e567c2dabbea4efb0c23ee87c88c8,2025-12-15T09:45:00Z,Storm,Storm Bahrain,grist.org,en,0.3,"Was Ihre billige Kleidung den Planeten kostet. Eine globale Lieferkette, die auf Geschwindigkeit ausgelegt ist, hinterlässt Abfall, Giftstoffe und eine Spur von Umweltschäden.",What your cheap clothes cost the planet,"A global supply chain built for speed is leaving behind waste, toxins, and a trail of environmental wreckage.","What your cheap clothes cost the planet. A global supply chain built for speed is leaving behind waste, toxins, and a trail of environmental wreckage.","Quae vilis vestis tua tellure constant. Copia globalis catenae velocitatis aedificatae relicta est vastitas, toxina et vestigia naufragii environmental.",https://grist.org/business/what-your-cheap-clothes-cost-the-planet/,https://grist.org/wp-content/uploads/2025/12/fastfashion_6.jpg?quality=75&strip=all,,"This story is a partnership between Grist and The Nation.
The Atacama desert in Chile is one of the most beautiful and forbidding places on Earth, so dry that its sometimes used by scientists to tes… [+23963 chars]",,2026-01-13 19:17:07+00:00,wmo,Bahrain,ARP,Asia
0745e93bb7703cf03cca556ee026f08f,2025-12-19T14:00:00Z,Precipitation,Torrential Rain Tanzania,www.theatlantic.com,en,0.3,"Fotos der Woche: Londoner Nebel, Rollerdecken, riesiger Schneemann. Überschwemmungen im US-Bundesstaat Washington, Flamingos in Venedig, winterliche Kirschblüten in China, Neujahrsvorbereitungen in New York City und vieles mehr","Photos of the Week: London Fog, Scooter Blankets, Giant Snowman","Flooding in Washington State, flamingos in Venice, winter cherry blossoms in China, New Year’s preparations in New York City, and much more","Photos of the Week: London Fog, Scooter Blankets, Giant Snowman. Flooding in Washington State, flamingos in Venice, winter cherry blossoms in China, New Year’s preparations in New York City, and much more","Imagines Hebdomadae: Londinii Nebula, Scooter Stragula, Giant Snowman. Inundatio Civitatis Washington, phoenicopteri in Venetiis, cerasi hiberni in Sinis flores, praeparationes Novi Anni in Civitate New York, et multo magis",https://www.theatlantic.com/photography/2025/12/photos-of-the-week/685314/,https://cdn.theatlantic.com/thumbor/HQN350ekgGkrkQgcQcHvv2sxkBI=/0x644:5809x3670/1200x625/media/img/mt/2025/12/a01_AP25348699131869/original.jpg,,"Adam Gray / AP
A person takes a photo in Central Park after snowfall, Sunday, December 14, 2025, in New York City.
Yves Herman / Reuters
A protester walks next to burning tires on a square near th… [+5469 chars]",,2026-01-13 19:17:07+00:00,wmo,Tanzania,SEAF,Africa
