index,published,topic,term,domain,language,valid,de,title,description,en,la,url,image,archive,content,quote,added,feed,country,ipcc,continent
dbb8415f3e86b5c6c95062a509952471,2026-06-13T12:19:47Z,Flood,Flooding Middle Yukon Valley,www.foxnews.com,en,0.2,"TANVI RATNA: Wie Trumps Multifront-Druck Putins Handlungsspielraum schrumpft. Russlands Energiemacht steht unter beispiellosem Druck, da Sanktionen, ukrainische Drohnenangriffe und Europas legaler Gasausstieg Moskaus Möglichkeiten einschränken.",TANVI RATNA: How Trump's multi-front pressure is shrinking Putin's operating space,"Russia's energy leverage faces unprecedented pressure as sanctions, Ukrainian drone strikes, and Europe's legal gas phase-out compress Moscow's options.","TANVI RATNA: How Trump's multi-front pressure is shrinking Putin's operating space. Russia's energy leverage faces unprecedented pressure as sanctions, Ukrainian drone strikes, and Europe's legal gas phase-out compress Moscow's options.","TANVI RATNA: Quomodo Trump multi- pressionis anterius decrescit Putin spatium operandi. Incomparabilis pressio industriae Russiae facies pressionem ut sanctiones, Ucraina fucus ferit, et phaselus legum Europaei leguminarum Moscuae optiones comprimunt.",https://www.foxnews.com/opinion/tanvi-ratna-trumps-multi-front-pressure-shrinking-putins-operating-space,https://static.foxnews.com/foxnews.com/content/uploads/2025/09/donald-trump-vladimir-putin-split-thumb-v2.jpg,,"A sanctioned Russian LNG tanker from the Portovaya project idled near Singapore in May 2026 with no buyer. At the same time, Ukrainian drones had already knocked roughly 700,000 barrels per day of Ru… [+6775 chars]",,2026-06-18 12:51:32+00:00,wmo,United States,CNA,North-America
54bbb23de6ab0de3d1e60f320b18b0f6,2026-06-14T08:01:36Z,Snow&Ice,Freezing Qikiqtarjuaq,en.protothema.gr,en,0.2,"Elon Musk & SpaceX: Wie die „gescheiterte Idee“ und die „Tür“ der Russen zur Gründung eines 2-Billionen-Dollar-Unternehmens führten. Der reichste Geschäftsmann der Welt gab zunächst zu, dass die Erfolgsaussichten für SpaceX nicht über 10 % lagen – trotz der Ermutigung von Freunden und Experten, es aufzugeben, beharrte er darauf, steigerte seinen Wert exponentiell und hält den Traum von der Kolonisierung am Leben …",Elon Musk & SpaceX: How the “failed idea” and the Russians’ “door” led to the launch of a $2 trillion company,"The world’s richest businessman initially admitted that the chances of success for SpaceX did not exceed 10% - Despite encouragement from friends & experts to abandon it, he persisted, increased its value exponentially, and keeps alive the dream of colonizing…","Elon Musk & SpaceX: How the “failed idea” and the Russians’ “door” led to the launch of a $2 trillion company. The world’s richest businessman initially admitted that the chances of success for SpaceX did not exceed 10% - Despite encouragement from friends & experts to abandon it, he persisted, increased its value exponentially, and keeps alive the dream of colonizing…","Elon Musk & SpaceX: Quomodo ""idea fallit"" et Russorum ""ostium"" ad deducendum ad $2 trillion turmae deducendae sunt. Opulentissimus negotiator mundi initio confessus est casus successus pro SpaceX non excedere 10% - Quamvis ab amicis & peritis adhortatio ut eam deserat, perstitit, auget valorem exponentialiter, et vivit somnium deducendi…",https://en.protothema.gr/2026/06/14/elon-musk-spacex-how-the-failed-idea-and-the-russians-door-led-to-the-launch-of-a-2-trillion-company/,https://en.protothema.gr/wp-content/uploads/2026/06/musk_arthrou.webp,,"It was the early 21st century, about 25 years ago, when Anteo Reisi, a former roommate of Elon Musk at the University of Pennsylvania, was begging the then young tech freak entrepreneur not to found … [+6224 chars]",,2026-06-18 12:51:32+00:00,wmo,Canada,NEN,North-America
8ac64b5ec09070e4bfe18c392a5e09e4,2026-06-14T23:16:15Z,Heat Wave,Heat Wave ANANTHAGIRI K KOTAPADU mandals,cryptobriefing.com,en,0.2,"Iran erläutert den 14-Punkte-Entwurf einer Absichtserklärung mit den USA zur Freigabe von Vermögenswerten in Höhe von 24 Milliarden US-Dollar. Der Entwurf einer Absichtserklärung könnte geopolitische Spannungen lindern, Auswirkungen auf die globalen Ölpreise haben und Investoren auf die anhaltenden Herausforderungen bei der Durchsetzung von Kryptowährungen aufmerksam machen. Der Beitrag „Iran beschreibt den 14-Punkte-Entwurf einer Absichtserklärung mit den USA zur Freigabe von Vermögenswerten in Höhe von 24 Milliarden US-Dollar“ erschien zuerst auf Crypto Briefing.",Iran details 14-point draft MOU with US for $24B asset release,"The draft MOU could ease geopolitical tensions, impact global oil prices, and highlight ongoing crypto enforcement challenges for investors.
The post Iran details 14-point draft MOU with US for $24B asset release appeared first on Crypto Briefing.","Iran details 14-point draft MOU with US for $24B asset release. The draft MOU could ease geopolitical tensions, impact global oil prices, and highlight ongoing crypto enforcement challenges for investors.
The post Iran details 14-point draft MOU with US for $24B asset release appeared first on Crypto Briefing.","Irania singula 14-punctum captura MOU cum US pro $24B asset emissio. Captura MOU tensiones geopoliticas relevare potuit, pretia olei globalis impacta, cryptam cogendi provocationes collocandi in luce permanentem. Post Irania singula 14-punctum captura MOU cum US pro $24B dignissim emissio primum apparuit in Crypto Briefing.",https://cryptobriefing.com/iran-us-draft-mou-24b-asset-release/,https://static.cryptobriefing.com/wp-content/uploads/2026/06/14191607/iran-us-draft-deal-would-release-24b-in-funds-ensure-lebanon-800x420.jpeg,,"The proposed memorandum of understanding outlines a 60-day negotiation window that could reshape sanctions enforcement, oil markets, and crypto compliance landscapes Iran has publicly outlined a 14-p… [+2609 chars]",,2026-06-18 12:51:32+00:00,wmo,India,SAS,Asia
f40e1a7bd0323a4bbbf0445c38b05724,2026-06-15T07:20:41Z,Thunderstorm,Thunderstorm Ghana,www.dailymail.com,en,0.2,"Der kämpferische Trump stürmt in das G7-Pulverfass, während sich die Staats- und Regierungschefs der Welt auf einen Showdown mit Europa und Selenskyj vorbereiten. Wenn die Staats- und Regierungschefs der Welt in Evian-les-Bains zum dreitägigen G7-Gipfel zusammenkommen, werden sie dies unter dem erdrückenden Schatten eines globalen Krieges und einer Finanzpanik tun.",Combative Trump storms into G7 powder keg as world leaders brace for showdowns with Europe and Zelensky,"When world leaders gather in Evian-les-Bains for the three-day G7 summit, they will do so under the suffocating shadow of global war and financial panic.","Combative Trump storms into G7 powder keg as world leaders brace for showdowns with Europe and Zelensky. When world leaders gather in Evian-les-Bains for the three-day G7 summit, they will do so under the suffocating shadow of global war and financial panic.","Tempestates pugnaces Trump in G7 pulveris pyrii sicut duces mundi ad sollicitudines cum Europa et Zelensky stringunt. Cum principes mundi in Evian-les-Bains in summum G7 triduum conveniant, id sub umbra belli globalis et terrore oeconomi strangulante facturi sunt.",https://www.dailymail.com/news/article-15895393/Trump-storms-G7-Europe-Zelensky.html,https://i.dailymail.com/1s/2026/06/15/08/109355805-0-image-a-16_1781507683771.jpg,,"The picturesque shores of Lake Geneva are bracing for a diplomatic storm, with an ornery President Donald Trump flying to France in a combative mood fresh off hosting a UFC cage fight on the White Ho… [+7023 chars]",,2026-06-18 12:51:32+00:00,wmo,Ghana,WAF,Africa
9e823bda1d5c2d040cc9f6ac5fbe124f,2026-06-15T13:00:00Z,Flood,Flashflood Fulton IL Knox IL,www.smithsonianmag.com,en,0.2,"Als Clarence Birdseye die von Inuit-Fischern eingefrorene Forelle probierte, veränderte das die Art und Weise, wie wir Lebensmittel kaufen. Der erfinderische Unternehmer kam zu dem Schluss, dass die Struktur der Lebensmittel umso weniger geschädigt wird, je schneller Dinge eingefroren werden. Nach dem Auftauen waren sie „genau wie frisch“","When Clarence Birdseye Tasted the Trout That Had Been Frozen by Inuit Fishermen, It Changed the Way We Buy Food","The inventive entrepreneur concluded that the faster things were frozen, the less damage was done to the structure of the food. Once thawed, they were “exactly like fresh”","When Clarence Birdseye Tasted the Trout That Had Been Frozen by Inuit Fishermen, It Changed the Way We Buy Food. The inventive entrepreneur concluded that the faster things were frozen, the less damage was done to the structure of the food. Once thawed, they were “exactly like fresh”","Cum Clarentiae Birdseye gustaverat tructum quod fuerat glaciatum ab Inuit Piscatores, mutavit viam quam emimus cibum. Manceps inventivus conclusit res velociores congelatas esse, quo minus damnum structurae cibi illatum esset. Semel conti, erant ""prorsus ut recentes"".",https://www.smithsonianmag.com/innovation/when-clarence-birdseye-tasted-trout-had-been-frozen-inuit-fisherman-changed-way-buy-food-180988815/,https://th-thumbnailer.cdn-si-edu.com/FA3t8tIKGrbbP_R00ab2925vcG4=/fit-in/1600x0/filters:focal(1182x788:1183x789)/https://tf-cmsv2-smithsonianmag-media.s3.amazonaws.com/filer_public/90/f4/90f4ccbb-7744-4226-b543-3fda280ef95e/opener_-_frozenmealfinal.jpg,,"Illustration by Daria Kirpach
Its a tale ripe forthe screen. In 1912, a 25-year-old Brooklyn native with an adventurous streak journeys to the icy reaches of northeast Canada, where he spends the be… [+6034 chars]",,2026-06-18 12:51:32+00:00,wmo,United States,CNA,North-America
52e7dca55ec4c3a100d95c86c5c8bdb7,2026-06-15T14:08:08Z,Precipitation,Rain Bay of Plenty east of Whakatane,cryptobriefing.com,en,0.2,"Der Iran und die USA wollen am 19. Juni ein Memorandum of Understanding unterzeichnen, wobei Krypto-Börsen ins Kreuzfeuer geraten. Das MoU könnte die geopolitische Dynamik verändern und sich angesichts der zunehmenden Spannungen zwischen den USA und dem Iran auf die globalen Energiemärkte und Kryptovorschriften auswirken.
Nachdem der Iran und die USA am 19. Juni ein Memorandum of Understanding unterzeichnen wollten, erschienen Krypto-Börsen, die ins Kreuzfeuer geraten waren, erstmals …","Iran and US set to sign memorandum of understanding on June 19, crypto exchanges caught in the crossfire","The MoU could reshape geopolitical dynamics, impacting global energy markets and crypto regulations amid heightened US-Iran tensions.
The post Iran and US set to sign memorandum of understanding on June 19, crypto exchanges caught in the crossfire appeared fi…","Iran and US set to sign memorandum of understanding on June 19, crypto exchanges caught in the crossfire. The MoU could reshape geopolitical dynamics, impacting global energy markets and crypto regulations amid heightened US-Iran tensions.
The post Iran and US set to sign memorandum of understanding on June 19, crypto exchanges caught in the crossfire appeared fi…","Iran et US ad scribendum memorandum intellegendum die 19 mensis Iunii in crypto commerciorum in cruce crucis deprehensi sunt. MoU dynamicos geopoliticos reformare potuit, energiae globalis mercatus et cryptae inter tensiones augendas normas US Iraniae impingens.
Post Iran et US pone ad scribendum memorandum intellegendum die 19 mensis Iunii, crypto commercii deprehensus in cruce ignis apparuit fi…",https://cryptobriefing.com/iran-us-mou-crypto-exchanges-sanctions/,https://static.cryptobriefing.com/wp-content/uploads/2026/06/15100800/crypto-exchange-meaning-how-they-work-types-and-fees-800x420.jpeg,,The planned MoU could reshape sanctions dynamics while US Treasury crackdowns on Iranian crypto exchanges signal tighter enforcement ahead Iranian President Masoud Pezeshkian announced that Iran and … [+3547 chars],,2026-06-18 12:51:32+00:00,wmo,New Zealand,NZ,Oceania
090fce02f52bf7750c09f1d74e23e91a,2026-06-16T17:06:00Z,Flood,Flood Washington LA,www.cdc.gov,en,0.2,"Lebensmittelbedingte Krankheitsausbrüche im Zusammenhang mit Meeresgiften – Foodborne Disease Outbreak Surveillance System, USA, 2011–2023. In diesem Bericht werden 402 durch Meeresgifte verursachte Ausbrüche von lebensmittelbedingten Krankheiten beschrieben, die dem FDOSS gemeldet wurden. Diese Ausbrüche führten zu 1.280 Erkrankungen, 96 Krankenhausaufenthalten und einem Todesfall.","Foodborne Disease Outbreaks Associated with Marine Toxins - Foodborne Disease Outbreak Surveillance System, United States, 2011-2023","This report describes 402 foodborne disease outbreaks caused by marine toxins were reported to FDOSS. These outbreaks resulted in 1,280 illnesses, 96 hospitalizations, and one death.","Foodborne Disease Outbreaks Associated with Marine Toxins - Foodborne Disease Outbreak Surveillance System, United States, 2011-2023. This report describes 402 foodborne disease outbreaks caused by marine toxins were reported to FDOSS. These outbreaks resulted in 1,280 illnesses, 96 hospitalizations, and one death.","Foodborne Morbus tumultus Consociata cum Marine Toxins - Foodborne Morbus Outbreak Surveillance System, United States, 2011-2023. Haec relatio describit morbum 402 tumultuosi tumultus a toxino marino delato ad FDOSS. Hi motus in mille ducentis morbis, 96 hospitalizationibus et una morte consecuti sunt.",https://www.cdc.gov/mmwr/volumes/75/ss/ss7503a1.htm,https://www.cdc.gov/mmwr/volumes/75/ss/social-media/ss_generic_logo_1200x675.jpg?_=08763,,"Cassie M. Hartley, MPH1,2,*; Son T. Hoang, MPH1,*; Virginia A. Roberts, MSPH1,†; Anna N. Chard, PhD1,† (View author affiliations)
View suggested citation
Abstract
Problem/Condition: Marine toxins … [+50000 chars]",,2026-06-18 12:51:32+00:00,wmo,United States,CNA,North-America
5cb5d48077fbfc739e1055a9c199ccf4,2026-06-17T01:30:00Z,Precipitation,Torrential Rain Auckland and Great Barrier Island,www.archdaily.com,en,0.2,Geräte als architektonische Elemente: Gestaltung der zeitgenössischen Küche. Die Küche hat sich von einem funktionalen Raum zu einer gemeinsamen Umgebung und zum Herzstück vieler Haushalte entwickelt. Essen dient als Rahmen für tägliche Rituale in unzähligen Familien – und sogar für kollektive Praktiken im städtischen Leben – und bringt Menschen zusammen und lässt den Wunsch entstehen …,Appliances as Architectural Elements: Designing the Contemporary Kitchen,"The kitchen has evolved from a functional space into a shared environment and the heart of many households. Serving as the setting for daily rituals in countless families—and even collective practices in urban life—food brings people together, making the desi…","Appliances as Architectural Elements: Designing the Contemporary Kitchen. The kitchen has evolved from a functional space into a shared environment and the heart of many households. Serving as the setting for daily rituals in countless families—and even collective practices in urban life—food brings people together, making the desi…","Adjumenta ut Elementa Architectural: Coquina cogitans contemporaneum. Culina e spatio functionis in ambitum communem et cor multarum familiarum evolvit. Servientes ut institutio pro ritibus quotidianis in innumerabilibus familiis, ac etiam in exercitiis collectivis in vita urbana, cibus homines adunet, faciens desiderium.",https://www.archdaily.com/1042318/appliances-as-architectural-elements-designing-the-contemporary-kitchen,https://images.adsttc.com/media/images/6a29/a4a7/a0e0/6301/89c9/f2a3/large_jpg/home-appliances-as-architectural-elements-designing-the-contemporary-kitchen_6.jpg?1781114054,,"Courtesy of Gaggenau
The kitchen has evolved from a functional space into a shared environment and the heart of many households. Serving as the setting for daily rituals in countless familiesand eve… [+7717 chars]",,2026-06-18 12:51:32+00:00,wmo,New Zealand,NZ,Oceania
06c915ab0b810a4be2cda29595b72488,2026-06-15T11:00:08Z,Snow&Ice,Freezing United States,nationalpost.com,en,0.7,Wie erfolgreich ist das Einfrieren von Eizellen? Fruchtbarkeitskliniken müssen nichts sagen. Im Vereinigten Königreich und in den Vereinigten Staaten bieten öffentliche Register Erfolgsquoten für einzelne Kliniken an. In Kanada gibt es keine solche Anforderung,How successful is egg freezing? Fertility clinics don't have to say,"In the United Kingdom and United States, public registries offer up success rates for individual clinics. Canada has no such requirement","How successful is egg freezing? Fertility clinics don't have to say. In the United Kingdom and United States, public registries offer up success rates for individual clinics. Canada has no such requirement","Quam felix est frigore ovum? Nulla fecunditas dicere non est. In Civitatibus Foederatis et Civitatibus Foederatis, publica registria secundas rates pro singulis clinicis offerunt. Canada non habet talem postulationem",https://nationalpost.com/news/canada/success-frozen-eggs-to-baby-unknown,https://smartcdn.gprod.postmedia.digital/nationalpost/wp-content/uploads/2026/05/Fertility-Inc_Melika-Dolaty.jpg,,"Vancouvers Olive Fertility, which says it has among the best pregnancy success rates in Canada, does have this information.
After following 646 egg-freezing patients from 2013 to 2022, Olive doctors… [+3220 chars]",,2026-06-18 12:51:32+00:00,wmo,United States,CNA,North-America
035afd265f5d4a08b5c3a59fbde26dd8,2026-06-16T10:46:00Z,Snow&Ice,Ice United States,www.globenewswire.com,en,0.7,"My Derma Dream MyoGlow untersucht 2026 – Warum erhält das MyoGlow-Armgerät in den Vereinigten Staaten so viel Aufmerksamkeit? Miami, Florida, 16. Juni 2026 (GLOBE NEWSWIRE) – In Umkleidekabinen, Gruppentexten und Arztpraxen im ganzen Land finden stille Gespräche statt, die selten öffentlich an die Oberfläche kommen. Es geht um Waffen. Genauer gesagt geht es um den Moment, in dem eine Frau…",My Derma Dream MyoGlow Examined 2026 - Why Is the MyoGlow Arm Device Getting So Much Attention Across the United States?,"Miami, Florida, June 16, 2026 (GLOBE NEWSWIRE) -- There is a quiet conversation happening in fitting rooms, group texts, and medical offices all over the country that rarely surfaces publicly. It is about arms. More specifically, it is about the moment a woma…","My Derma Dream MyoGlow Examined 2026 - Why Is the MyoGlow Arm Device Getting So Much Attention Across the United States?. Miami, Florida, June 16, 2026 (GLOBE NEWSWIRE) -- There is a quiet conversation happening in fitting rooms, group texts, and medical offices all over the country that rarely surfaces publicly. It is about arms. More specifically, it is about the moment a woma…","My Derma Somnium MyoGlow Examinatum 2026 - Cur MyoGlow Arm Fabrica Questus Tantum Operam Trans Iunctus Civitas?. Miami, Florida, 16 Iunii 2026 (GLOBE NEWSWIRE) -- Colloquium quietum evenit in congruis cubiculis, textibus, et officiis medicorum per totam regionem raro superficiebus publice. Id est de armis. Specialius, de momento mulieris est…",https://www.globenewswire.com/news-release/2026/06/16/3312391/0/en/My-Derma-Dream-MyoGlow-Examined-2026-Why-Is-the-MyoGlow-Arm-Device-Getting-So-Much-Attention-Across-the-United-States.html,,,"Miami, Florida, June 16, 2026 (GLOBE NEWSWIRE) -- 
There is a quiet conversation happening in fitting rooms, group texts, and medical offices all over the country that rarely surfaces publicly. It i… [+26111 chars]",,2026-06-18 12:51:32+00:00,wmo,United States,CNA,North-America
f3817393764b4d8dd8a25c4804269969,2026-06-17T03:26:11Z,Snow&Ice,Freezing United States,www.fark.com,en,0.7,"Die Trump-Administration hat ihre Bemühungen, Windenergieprojekte in den gesamten Vereinigten Staaten zu stoppen, aufgegeben und ihre Anfechtung des Gerichtsurteils fallen gelassen, mit dem Präsident Donald Trumps Anordnung zum Einfrieren der Bundesgenehmigungen für Windprojekte aufgehoben wurde [Cool]. Die Trump-Regierung hat ihre Bemühungen, Windenergieprojekte in den gesamten Vereinigten Staaten zu stoppen, aufgegeben und ihre Anfechtung des Gerichtsurteils fallengelassen, mit dem Präsident Donald Trumps Anordnung zum Einfrieren der Bundesgenehmigungen für Windprojekte aufgehoben wurde",The Trump administration has abandoned its effort to halt wind energy projects across the United States and dropped its challenge to the court ruling that tossed President Donald Trump's order freezing federal permitting for wind projects [Cool],The Trump administration has abandoned its effort to halt wind energy projects across the United States and dropped its challenge to the court ruling that tossed President Donald Trump's order freezing federal permitting for wind projects,The Trump administration has abandoned its effort to halt wind energy projects across the United States and dropped its challenge to the court ruling that tossed President Donald Trump's order freezing federal permitting for wind projects [Cool]. The Trump administration has abandoned its effort to halt wind energy projects across the United States and dropped its challenge to the court ruling that tossed President Donald Trump's order freezing federal permitting for wind projects,"BUCINUM administratio suum nisum energiae ventorum trans Americae Foederatae Rei Publicae claudendae reliquit et provocationem ad aulam regendam emisit, quae ordinem Praesidis Donald Trump torpore foederati venti inceptis permittens [Cool] iactavit. BUCINUM administratio suum nisum energiae ventorum per Civitates Americae Unitas claudendi omisit et provocationem ad aulam regendam emisit, quae iussu Praesidis Donald Trump torpore foederati permittentes ventorum incepta iactaverat.",https://www.fark.com/comments/14101396/The-Trump-administration-has-abandoned-its-effort-to-halt-wind-energy-projects-across-United-States-dropped-its-challenge-to-court-ruling-that-tossed-President-Donald-Trumps-order-freezing-federal-permitting-for-wind-projects,https://usrimg-full.fark.net/v/vl/fark_vltpuLkZySTfw-TcWbhgjbO-g9k.jpg?AWSAccessKeyId=JO3ELGV4BGLFW7Y3EZXN&Expires=1782100800&Signature=gmSSQBKh3wxPvAr4hjW5nRjxGDQ%3D,,"I'm guessing energy execs got spooked &amp; told Donnie that they were very, very interested in the greenest energy they could find.&amp; I don't mean green energy
I mean energy that gives them gree… [+445 chars]",,2026-06-18 12:51:32+00:00,wmo,United States,CNA,North-America
716a14a593f61b6eb96dd5d17d21d6e4,2026-06-04T14:00:00Z,Flood,flash flood Victoria,journals.plos.org,en,0.2,"Die Feedback-Koordination der FoxO-vermittelten antibakteriellen Immunität durch PDGF/VEGF-Signalisierung etabliert die Hämolymph-Mikrobiota-Homöostase in Garnelen. Zusammenfassung des Autors: Die FoxO-vermittelte Transkription antimikrobieller Effektoren spielt eine wichtige Rolle bei der Interaktion zwischen Arthropoden und Bakterien. Diese Studie deckt einen Feedback-Regulationsmechanismus auf, durch den kommensale Mikrobiota die Grundaktivierung von FoxO einleitet und …",Feedback coordination of FoxO-mediated antibacterial immunity by PDGF/VEGF signaling establishes hemolymph microbiota homeostasis in shrimp,Author summary FoxO-mediated transcription of antimicrobial effectors plays an important role in arthropod-bacteria interactions. This study reveals a feedback regulatory mechanism by which commensal microbiota initiates the basal activation of FoxO and expre…,Feedback coordination of FoxO-mediated antibacterial immunity by PDGF/VEGF signaling establishes hemolymph microbiota homeostasis in shrimp. Author summary FoxO-mediated transcription of antimicrobial effectors plays an important role in arthropod-bacteria interactions. This study reveals a feedback regulatory mechanism by which commensal microbiota initiates the basal activation of FoxO and expre…,"Feedback coordinationem FoxO mediatae immunitatis antibacterialis per PDGF/VEGF significans, hemolymph microbiota homeostasim in squilla constituit. Auctor summariam FoxO mediatae transcriptionis effectorum antimicrobialium magni ponderis partes agit in interactionibus arthropodibus bacterialibus. Hoc studium feedback regulatory mechanismum indicat, quo microbiota commensalis activationem basalem FoxO et expre... inchoat.",https://journals.plos.org/plospathogens/article?id=10.1371/journal.ppat.1014307,https://journals.plos.org/plospathogens/article/figure/image?id=10.1371/journal.ppat.1014307.g006&size=inline,,"Citation: Liu P-P, Zhang M, Wei Z, Wang W-G, Wang J-X, Li Y, et al. (2026) Feedback coordination of FoxO-mediated antibacterial immunity by PDGF/VEGF signaling establishes hemolymph microbiota homeos… [+74592 chars]",,2026-06-19 13:34:38+00:00,acwe,Australia,SAU,Oceania
