index,published,topic,term,domain,language,valid,de,title,description,en,la,url,image,archive,content,quote,added,feed,country,ipcc,continent
82efa14a9b6cdf47074c69d85a6f0b0a,2026-06-15T13:30:12Z,Precipitation,Precipitation Taranaki Maunga,allears.net,en,0.2,"Sollten Sie schicke Schuhe oder nur Turnschuhe für Disney World einpacken? So entscheiden Sie. Packen für Disney World? Ihre Schuhe müssen zu Ihrem Urlaubsstil passen. Wir haben die Sneakers, Anzugschuhe und bequemen Wedges gefunden, die für Disney World tatsächlich Sinn machen.",Should You Pack Fancy Shoes or Just Sneakers for Disney World? Here’s How to Decide,"Packing for Disney World? Your shoes need to match your vacation style. We found the sneakers, dress shoes, and comfy wedges that actually make sense for Disney World.","Should You Pack Fancy Shoes or Just Sneakers for Disney World? Here’s How to Decide. Packing for Disney World? Your shoes need to match your vacation style. We found the sneakers, dress shoes, and comfy wedges that actually make sense for Disney World.","Si Pack Fancy Shoes or Just Sneakers for Disney World? Hic est quomodo decernere. Packing for Disney World? Calceamentum tuum opus est ut tua feriarum stilo aequas. Invenimus sneakers, calceos induere, et cuneis consolationes habere sensum in mundo Disney.",https://allears.net/2026/06/15/should-you-pack-fancy-shoes-or-just-sneakers-for-disney-world-heres-how-to-decide/,https://allears.net/wp-content/uploads/2023/12/AE-Style-Fry-MK-Peter-Pan-Outfit-Shoes-01-500x625.jpg,,"Packing shoes for Disney World sounds simple until you remember this is not a cookie-cutter vacation.
Quincy enjoying Garden View Tea Room
Some people attack the parks like they are training for an… [+12757 chars]",,2026-06-24 12:18:44+00:00,wmo,New Zealand,NZ,Oceania
6d1bc4397e596d5dd066211b81060ef9,2026-06-19T13:59:43Z,Cold Wave,Freezing Zimbabwe,outofofficeny.com,en,0.2,"Granatapfel: Nutzen für die Gesundheit, Ernährung, Verwendung und Rezepte. Entdecken Sie den Granatapfel: seine Geschichte, seine gesundheitlichen Vorteile, seine reichhaltigen Antioxidantien, seine kulinarischen Verwendungsmöglichkeiten und Tipps für die Auswahl, Lagerung und den Genuss dieser lebendigen Superfrucht.","Pomegranate: Health Benefits, Nutrition, Uses & Recipes","Discover the pomegranate: its history, health benefits, rich antioxidants, culinary uses, and tips for selecting, storing, and enjoying this vibrant superfruit.","Pomegranate: Health Benefits, Nutrition, Uses & Recipes. Discover the pomegranate: its history, health benefits, rich antioxidants, culinary uses, and tips for selecting, storing, and enjoying this vibrant superfruit.","Malumgranatum: Valetudo Beneficia, Nutrition, Usus & Recipes. Malumgranatum detegite: eius historiam, salubria beneficia, dives facilisis, usus culinaria, et apicibus ad eligendum, recondendum, et hoc venusto superfructu fruendum.",https://outofofficeny.com/canada/pomegranate-in-canada-benefits-buying-eating-and-cooking-smart/,https://outofofficeny.com/wp-content/uploads/2026/06/332213b86f631d1615993b0a99089d4a.jpg,,"The pomegranate is the kind of fruit that turns a regular Tuesday into a little celebration. Crack one open and you get a jewel box of tart-sweet arils, a burst of colour, and a reminder that healthy… [+45977 chars]",,2026-06-24 12:18:44+00:00,wmo,Zimbabwe,ESAF,Africa
00f1e11ca164265f48952ea7c036e44d,2026-06-20T12:31:52Z,Snow&Ice,Frost Lower Snake River Plain,www.dailymail.com,en,0.2,"Amerikas nächste Immobilien-Zeitbombe zündet den sonnenverwöhnten Wohntraum des Südens: „Neue Eigentumswohnungskrise“ löst eine erschreckende Warnung aus, während sie sich über das ganze Land schlängelt. Die Südstaaten Amerikas sind mit einer stillen Epidemie konfrontiert, die den Wert ihrer Häuser dezimiert.",America's next real estate time bomb detonates the sun-kissed southern housing dream: 'New condo crisis' sparks chilling warning as it snakes across the nation,America's southern states are facing a silent epidemic that is decimating home values.,America's next real estate time bomb detonates the sun-kissed southern housing dream: 'New condo crisis' sparks chilling warning as it snakes across the nation. America's southern states are facing a silent epidemic that is decimating home values.,"Americae proximum tempus reale praedium bombae meridionalis habitationi solis osculatae denotat somnium: ""Novi condo discriminis"" scintillae infrigidantes monentes serpentes per natione. Civitates Americae meridionales sunt contra tacitam pestilentiam quae bona domi decimat.",https://www.dailymail.com/yourmoney/article-15885877/southern-housing-dream-real-estate-time-bomb-condo-crisis.html,https://i.dailymail.com/1s/2026/06/17/17/109418091-0-image-a-8_1781712957044.jpg,,"America's southern states are facing a silent epidemic that is decimating home values and putting owners' health at risk.
Mold has long plagued homes in warmer climates, causing ailments ranging fro… [+9839 chars]",,2026-06-24 12:18:44+00:00,wmo,United States,CNA,North-America
c0680fc59fe0a6d878367e78bec192e2,2026-06-22T21:48:00Z,Storm,Storm inshore areas of south coast,www.globenewswire.com,en,0.2,"Bergel Magence LLP veröffentlicht Branchenbericht, der Torontos gefährlichste Kreuzungen für Autofahrer identifiziert. Toronto, ONTARIO, 22. Juni 2026 (GLOBE NEWSWIRE) – Bergel Magence LLP, eine in Toronto ansässige Anwaltskanzlei für Personenschäden, gab heute die Veröffentlichung ihres neuen Branchenberichts bekannt, der Torontos gefährlichste Kreuzungen für Autofahrer, Fußgänger und Radfahrer untersucht. D…",Bergel Magence LLP Releases Industry Report Identifying Toronto's Most Dangerous Intersections for Drivers,"Toronto, ONTARIO, June 22, 2026 (GLOBE NEWSWIRE) -- Bergel Magence LLP, a Toronto-based personal injury law firm, announced today the release of its new industry report examining Toronto's most dangerous intersections for drivers, pedestrians, and cyclists. D…","Bergel Magence LLP Releases Industry Report Identifying Toronto's Most Dangerous Intersections for Drivers. Toronto, ONTARIO, June 22, 2026 (GLOBE NEWSWIRE) -- Bergel Magence LLP, a Toronto-based personal injury law firm, announced today the release of its new industry report examining Toronto's most dangerous intersections for drivers, pedestrians, and cyclists. D…","Bergel Magence LLP Releases Industry Report identifying Toronto in periculosissimas sectiones pro Coegi. Toronto, ONTARIO, die 22 Iunii 2026 (GLOBE NEWSWIRE) Bergel Magence LLP, a Toronto-substructio iniuriae personalis legis firmae, hodie denuntiavit emissionem novae industriae suae famae examinandi periculosissimas intersectiones rectores, pedestres et Eques. D…",https://www.globenewswire.com/news-release/2026/06/22/3315651/0/en/Bergel-Magence-LLP-Releases-Industry-Report-Identifying-Toronto-s-Most-Dangerous-Intersections-for-Drivers.html,https://ml.globenewswire.com/Resource/Download/a97ff8a2-702b-4216-b243-eb57ef460ea7,,"Toronto, ONTARIO, June 22, 2026 (GLOBE NEWSWIRE) -- Bergel Magence LLP, a Toronto-based personal injury law firm, announced today the release of its new industry report examining Toronto's most dange… [+35806 chars]",,2026-06-24 12:18:44+00:00,wmo,Jamaica,CAR,North-America
96045e3b439eb1463cf3c827ee947b7f,2026-06-04T18:25:31Z,Flood,flooding Australia,www.nzherald.co.nz,en,0.3,Gewitter haben Tausende von Menschen mit Strom versorgt; Gewitter und Windgeschwindigkeiten von 100 km/h treffen auf die Nordinsel. MetService prognostiziert heute Böen von 100 km/h und mögliche Tornados im Norden.,Lightning storms cut power to thousands; thunderstorms and 100km/h winds to hit North Island,MetService is forecasting 100km/h gusts and possible tornadoes across the north today.,Lightning storms cut power to thousands; thunderstorms and 100km/h winds to hit North Island. MetService is forecasting 100km/h gusts and possible tornadoes across the north today.,Virtus fulmina mille secabat ; tonitribus et 100km/h ventis ad Islandiam septentrionalem feriendum. MetService providet 100km/h procellas et turbines per septentrionem hodie fieri.,https://www.nzherald.co.nz/nz/thunderstorms-and-100kmh-winds-to-hit-north-island-metservice-says/45E2SPQ6FNBJDAYOME6HNGZKIM/,https://www.nzherald.co.nz/resizer/v2/Z3DYOBFLPNDQVB4FBWJGOZZCMI.jpg?auth=9ab590d95626a7c6f55cb850542ff0a11057b496c3efe452310902368a7a66fc&width=1200&height=675&quality=70&smart=true,,"RNZ reported people between Stoke and Takaka had lost power, but it was gradually restored with lines company Network Tasmans website showing no unplanned outages by 1am.
MetService has warned there… [+2201 chars]",,2026-06-24 17:04:06+00:00,aidr,Australia,EAU,Oceania
d95bae874651fd34827ce465574e7694,2026-06-15T06:06:00Z,Flood,Flood Nemaha NE,www.creativeboom.com,en,0.3,"Booms & Shakes: Die Neueinstellungen, Eröffnungen und das Umdenken der Studios im Juni. Strategieführer sind gefragt, Social-First-Agenturen stellen mehr ein und ein Studio hat den Mut gewagt und sein eigenes Rebranding an jemand anderen übergeben. Schluck. Hier ist, was in der Cre passiert ist...","Booms & Shakes: June's hires, launches and the studios rethinking themselves","Strategy leaders are in demand, social-first agencies are hiring more, and one studio has done the brave thing and handed its own rebrand to someone else. Gulp. Here's what's been happening in the cre...","Booms & Shakes: June's hires, launches and the studios rethinking themselves. Strategy leaders are in demand, social-first agencies are hiring more, and one studio has done the brave thing and handed its own rebrand to someone else. Gulp. Here's what's been happening in the cre...","Booms & Shakes: Iunii mercedes immittit ac studiosi retexendi se. Imperatores belli flagitant, sociales primae institutiones plus conducunt, et una studio rem fortem gessit, suumque rebrandum alteri tradidit. Snip. Hic est quod factum est in cre...",https://www.creativeboom.com/news/booms-and-shakes-june-2026/,https://www.creativeboom.com/upload/articles/77/77decfe44eee76954ab1b5657929ba376242140c_800.jpg,,"Welcome back to Booms &amp; Shakes, our monthly round-up of the hires, promotions, launches and wins making noise across the creative world right now.
A few patterns jumped out of the inbox this rai… [+21158 chars]",,2026-06-25 17:12:15+00:00,wmo,United States,CNA,North-America
d6146fd0052e1f88fcf176cd2773d466,2026-06-17T11:52:41Z,Flood,Flood Benton IA Iowa IA,www.celebitchy.com,en,0.3,"Telegraph: Prinz Harry plant wirklich, Meghan und die Kinder im Juli nach Großbritannien zu bringen. Es war interessant zu sehen, wie sich diese Geschichte im Laufe der letzten etwa vier Stunden entwickelte. Hell und früh schwörten Tom Sykes und ein Reporter von news.com.au heute Morgen an der Ostküste, dass Prinz Harry plant, Meghan und ihr Kind mitzubringen …",Telegraph: Prince Harry really plans to bring Meghan & the kids to the UK in July,"It’s been interesting to see this story develop over the course of the past four hours or so. Bright and early this morning on the East Coast, Tom Sykes and a news.com.au reporter swore up and down that Prince Harry is planning to bring Meghan and their child…","Telegraph: Prince Harry really plans to bring Meghan & the kids to the UK in July. It’s been interesting to see this story develop over the course of the past four hours or so. Bright and early this morning on the East Coast, Tom Sykes and a news.com.au reporter swore up and down that Prince Harry is planning to bring Meghan and their child…",Telegraphum: Princeps Harrius vere cogitat Meghan & haedos in UK mense Iulio adducere. Studium fuit hanc fabulam evolvere per praeteritorum quattuor horarum aut sic. Splendide et primo hoc mane in Orientem Coast Tom Sykes et nuntius.com.au nuntius iuravit principem Harrium se meghan et puerum suum deducere…,https://www.celebitchy.com/982475/telegraph_prince_harry_really_plans_to_bring_meghan_the_kids_to_the_uk_in_july/,https://www.celebitchy.com/wp-content/uploads/2026/06/aa-coverimages55622850.jpg,,"Its been interesting to see this story develop over the course of the past four hours or so. Bright and early this morning on the East Coast, Tom Sykes and a news.com.au reporter swore up and down th… [+7375 chars]",,2026-06-25 17:12:15+00:00,wmo,United States,CNA,North-America
1930e77abf0e11b83ae0b5617748d680,2026-06-19T09:15:14Z,Flood,Flashflood Bourbon KS,bleedingcool.com,en,0.3,"Marvel Comics September 2026 Offizielle vollständige Ausschreibungen und Ausschreibungen. Der Ausschreibungs- und Ausschreibungskatalog von Marvel Comics für September 2026 wurde eingestellt, darunter „Avengers #1“ von Chip Zdarsky und Marco Checchetto, da nach „Avengers: Armageddon“ eine neue Ära beginnt. Amazing Spider-Man #1000, mit einer All-Star-Besetzung von Schöpfern …",Marvel Comics September 2026 Official Full Solicits And Solicitations,"Marvel Comics' September 2026 solicits and solicitations catalogue has dropped, including Avengers #1 by Chip Zdarsky and Marco Checchetto as a new era kicks off in the wake of Avengers: Armageddon. Amazing Spider-Man #1000, with an all-star lineup of creator…","Marvel Comics September 2026 Official Full Solicits And Solicitations. Marvel Comics' September 2026 solicits and solicitations catalogue has dropped, including Avengers #1 by Chip Zdarsky and Marco Checchetto as a new era kicks off in the wake of Avengers: Armageddon. Amazing Spider-Man #1000, with an all-star lineup of creator…","Mirare Comics September 2026 Officialis Solicitationes et sollicitationes plenae. Marvel Comics' September 2026 catalogum sollicitationum et sollicitationum omisit, inter Vindicias #1 ab Chip Zdarsky et Marco Checchetto ut nova aetas calcit in ortu Vindices: Armagedon. Prodigiosus Spider-homo #1000, cum omni-stella lineup creatoris…",https://bleedingcool.com/comics/marvel-comics-september-2026-official-full-solicits-and-solicitations/,https://bleedingcool.com/wp-content/uploads/2026/06/2026_July_PRH-Marvel-Catalog-044-1-2000x1125.jpg,,"Posted in: Avengers, Comics, Doctor Strange, Marvel Comics, Solicits, Spider-Man, Stan Lee, Venom, X-Men | Tagged: Armageddon, avx, Marvel Mangaverse, Queen In Black
Marvel Comics September 2026 sol… [+63023 chars]",,2026-06-25 17:12:15+00:00,wmo,United States,CNA,North-America
d5aa411480ba071c2fb3ad0d9f867a85,2026-06-21T14:01:29Z,Heat Wave,Heat Wave Coral Harbour,www.animenewsnetwork.com,en,0.3,"„Magical Sisters Lulutto Lilly Anime enthüllt das Oktober-Debüt des zweiten Teils mit neuem Darsteller“ . Miyari Nemoto schließt sich der Besetzung als neues Idol von Production Once More, Asahi Araki, an","Magical Sisters Lulutto Lilly Anime Reveals 2nd Part's October Debut, New Cast Member",Miyari Nemoto joins cast as Production Once More's new idol Asahi Araki,"Magical Sisters Lulutto Lilly Anime Reveals 2nd Part's October Debut, New Cast Member. Miyari Nemoto joins cast as Production Once More's new idol Asahi Araki","Magicae Sorores Lulutto Lilly Anime Reveals 2nd Part's October Debut, New Cast Member. Miyari Nemoto iungit conflatum Productio olim Mores novi idoli Asahi Araki",https://www.animenewsnetwork.com/news/2026-06-21/magical-sisters-lulutto-lilly-anime-reveals-2nd-part-october-debut-new-cast-member/.238752,https://www.animenewsnetwork.com/thumbnails/crop600x315gFK/cms/news.9/238752/sister.jpg,,"Bandai Namco Filmworks announced on Sunday that the second cours (quarter of a year) of Mah no Shimai Lulutto Lilly (Magical Sisters Lulutto Lilly), the new magical girl television anime that it is p… [+2912 chars]",,2026-06-25 17:12:15+00:00,wmo,Canada,NEN,North-America
9764233413319bc6e812b1a80e7c9d6b,2026-06-23T15:05:46Z,Flood,Flashflood Gage NE,johnchow.com,en,0.3,"Faszinierende Kasszinno-Taktiken, die Ihrem Unternehmen zum Wachstum verhelfen können. Point of Interest Wir können Online-Banking und Online-Shopping betreiben, einen Urlaub buchen und sogar Wetten platzieren und Casinospiele spielen. Wünschen Sie weitere Empfehlungen. Jeder Computer, der auf das Internet zugreift, kann anhand dieser Zahlenkombination eindeutig identifiziert werden, in der die Zahlen a…",Fascinating kasszinno Tactics That Can Help Your Business Grow,"Point of Interest We can do online banking, online shopping, book a holiday and even place bets and play casino games. Want more recommendations. Every computer accessing the internet can be clearly identified by this number combination in which the numbers a…","Fascinating kasszinno Tactics That Can Help Your Business Grow. Point of Interest We can do online banking, online shopping, book a holiday and even place bets and play casino games. Want more recommendations. Every computer accessing the internet can be clearly identified by this number combination in which the numbers a…","Fascinating kasszinno Tactics That can help Your Business Grow. Interesse interest possumus facere online banking, online shopping, librum ferias atque etiam sponsionibus ponere ac lusus varius ludere. Plusne commendationes. Omnis computatrum interreti accessio ab hoc numero coniunctionis in quo numeri a… clare identificari possunt.",https://johnchow.com/fascinating-kasszinno-tactics-that-can-help-your-business-grow/,,,"Point of Interest
We can do online banking, online shopping, book a holiday and even place bets and play casino games. Want more recommendations. Every computer accessing the internet can be clearly… [+21410 chars]",,2026-06-25 17:12:15+00:00,wmo,United States,CNA,North-America
cdae7258922d78428ec950678874d960,2026-06-24T13:52:59Z,Flood,Flashflood Angelina TX Nacogdoches TX,economictimes.indiatimes.com,en,0.3,"Eine Entdeckung unter 3 Kilometern Eis in der Antarktis könnte zur Lösung eines Millionen Jahre alten geologischen Rätsels beitragen. Eine neu entdeckte fächerförmige geologische Struktur, die unter fast 2 Meilen antarktischem Eis begraben liegt, verändert die Art und Weise, wie Wissenschaftler die verborgene Geschichte der Erde verstehen. Die Provinz des Ostantarktischen Fächerförmigen Beckens enthüllt uralte tektonische Bewegungen, Gondwana-Auseinanderbrechen …",A discovery under 2 miles of ice in Antarctica could help solve a geological mystery millions of years old,"Buried beneath nearly 2 miles of Antarctic ice, a newly discovered fan-shaped geological structure is changing how scientists understand Earth’s hidden history. The East Antarctic Fan-Shaped Basin Province reveals ancient tectonic movements, Gondwana breakup …","A discovery under 2 miles of ice in Antarctica could help solve a geological mystery millions of years old. Buried beneath nearly 2 miles of Antarctic ice, a newly discovered fan-shaped geological structure is changing how scientists understand Earth’s hidden history. The East Antarctic Fan-Shaped Basin Province reveals ancient tectonic movements, Gondwana breakup …","Inventio sub 2 milium glaciei in Antarctica adiuvare potuit mysterium geologicum solvere decies centena milia annorum. Sepultus sub glacie prope II milia passuum Antarctici, structura geologica fan-formata nuper inventa mutatur quomodo physici historiam absconditam Telluris intellegunt. Oriens Antarcticus Fan-Shaped Rasin Provincia antiquos motus tectonicos manifestat, Gondwana-usque ...",https://economictimes.indiatimes.com/news/international/us/a-discovery-under-2-miles-of-ice-in-antarctica-could-help-solve-a-geological-mystery-millions-of-years-old/articleshow/131967725.cms,"https://img.etimg.com/thumb/msid-131968571,width-1200,height-630,imgsize-1039172,overlay-economictimes/articleshow.jpg",,"Deep beneath nearly 2 miles of Antarctic ice, scientists have discovered a giant fan-shaped geological structure that may rewrite the story of how Earths ancient supercontinent Gondwana broke apart. … [+6318 chars]",,2026-06-25 17:12:15+00:00,wmo,United States,CNA,North-America
cb886fc99b17bcb072e43244cdb67876,2026-06-16T04:21:12Z,Flood,Flood Harlan NE Phelps NE,www.nzherald.co.nz,en,0.2,"Fieldays-Freiwilliger Alan Sharp geht nach 57 Dienstjahren in den Ruhestand. Alan Sharp plant, nach 57 Jahren in den Ruhestand zu gehen und sich auf seine lange aufgeschobene Wunschliste zu konzentrieren.",Fieldays volunteer Alan Sharp retires after 57 years of service,Alan Sharp plans to retire after 57 years and focus on his long-postponed bucket list.,Fieldays volunteer Alan Sharp retires after 57 years of service. Alan Sharp plans to retire after 57 years and focus on his long-postponed bucket list.,Fieldays voluntarius Alan Sharp secedit post 57 annos servitii. Alanus Sharp consilia post 57 annos decedere et in indice situlae diu distulit focus.,https://www.nzherald.co.nz/waikato-news/news/fieldays-volunteer-alan-sharp-retires-after-57-years-of-service/IYN56KDNZFHMRHKNMTY4BESY2M/,https://www.nzherald.co.nz/resizer/v2/HP67WWAQ2JF3ZNWDKRUJQM4B5U.jpg?auth=79f4054966318825f759780f54ab5f36d65472b55478693ca16e819975a7eac7&width=1200&height=675&quality=70&smart=true,,"Based on his fathers lifespan, he reckons he has 10 years left to work through it.
Despite the early starts and long days, Sharp said camaraderie, friendships and a sense of belonging have kept him … [+2341 chars]",,2026-06-25 21:42:11+00:00,wmo,United States,CNA,North-America
36304c19d8df26b2f9ad3bb61758d4b1,2026-06-11T21:35:43Z,Storm,Storm Surge inshore areas of south coast,www.nzherald.co.nz,en,0.2,"Der Winter beginnt trocken, da das El Niño-Wettermuster am neuseeländischen Himmel zurückkehrt. Das Wochenende wird mit klarem Himmel und frischen Temperaturen zum Traum eines jeden Sportfans.",Winter off to a dry start as El Nino weather pattern returns to New Zealand skies,"The weekend is shaping to be a sport fan's dream, with clear skies and crisp temperatures.","Winter off to a dry start as El Nino weather pattern returns to New Zealand skies. The weekend is shaping to be a sport fan's dream, with clear skies and crisp temperatures.","Hiems initio ad siccum satus sicut El Nino tempestas exemplaris ad caelos Novae Zelandiae redit. Volutpat fingit somnium esse lusum fan, cum serenis coelum et rigidas temperaturas.",https://www.nzherald.co.nz/nz/winter-off-to-a-dry-start-as-el-nino-weather-pattern-returns-to-new-zealand-skies/DGWWBOSK3JD2JCO2TGW2EKG2RY/,https://www.nzherald.co.nz/resizer/v2/Y73MADMLPDPNADA4MLUSJE24P4.jpg?auth=ac7c1de800c11d0c99f0160039510bc5ba72f85f559a1434af615ce98f0ad0ff&width=1200&height=675&quality=70&smart=true,,"It means snowfall would be best on the Alps so theres better skiing conditions closer to those hills.
Meanwhile those heading out to sports games and events this weekend can expect to feel the winte… [+1385 chars]",,2026-06-26 03:32:10+00:00,wmo,Jamaica,CAR,North-America
ca663a72938d9a7149b555bf959fee62,2026-06-15T14:00:00Z,Flood,Flooding Holmes OH Wayne OH,journals.plos.org,en,0.2,"Vollständige mitochondriale Genom- und Mikrosatellitenmarkerentwicklung der Antarktischen Jakobsmuschel (Adamussium colbecki) für ihre populationsgenetische Analyse. Adamussium colbecki ist eine ökologisch wichtige Art (Klasse Bivalvia), die im Südpolarmeer endemisch ist, die genomischen Ressourcen für diese Art sind jedoch noch begrenzt. In dieser Studie berichten wir zunächst über das vollständige und kommentierte mitochondriale Genom von A. colbe…",Complete mitochondrial genome and microsatellite marker development of the Antarctic scallop (Adamussium colbecki) for its population genetics analysis,"Adamussium colbecki is an ecologically important species (class Bivalvia) endemic to the Southern Ocean, but genomic resource for this species has remained yet limited. In this study, we first report the complete and annotated mitochondrial genome of A. colbe…","Complete mitochondrial genome and microsatellite marker development of the Antarctic scallop (Adamussium colbecki) for its population genetics analysis. Adamussium colbecki is an ecologically important species (class Bivalvia) endemic to the Southern Ocean, but genomic resource for this species has remained yet limited. In this study, we first report the complete and annotated mitochondrial genome of A. colbe…","Plenum genoma mitochondriale et microsatellitum evolutionis pectinalis Antarcticae (Adamussium colbecki) pro analysi geneticae populationis. Adamussium colbecki species oecologicae momenti (classis Bivalvia) endemica ad Oceanum Australem est, sed auxilium genomicum huius speciei adhuc limitatum mansit. In hoc studio primum integram et annotatam genome mitochondrialem de A. colbe referimus.",https://journals.plos.org/plosone/article?id=10.1371/journal.pone.0351123,https://journals.plos.org/plosone/article/figure/image?id=10.1371/journal.pone.0351123.g002&size=inline,,"Abstract
Adamussium colbecki is an ecologically important species (class Bivalvia) endemic to the Southern Ocean, but genomic resource for this species has remained yet limited. In this study, we fi… [+41982 chars]",,2026-06-26 03:32:10+00:00,wmo,United States,CNA,North-America
