index,published,topic,term,domain,language,valid,de,title,description,en,la,url,image,archive,content,quote,added,feed,country,ipcc,continent
81530b4201811d6340ba32b6ddcf34f8,2025-12-05T19:10:25Z,Heat Wave,heatwave Australia,www.abc.net.au,en,0.8,"Im Westen Sydneys könnten die 40-Grad-Marke knacken, wenn eine Hitzewelle über Australien rollt. Die erste Hitzewelle des Sommers wird heute in ganz New South Wales ihren Höhepunkt erreichen. Temperaturen über 40 Grad Celsius dürften sich vom Nordwesten Westaustraliens bis nach Parramatta erstrecken.",Sydney's west could crack 40 degrees as heatwave rolls across Australia,"The first heatwave of the summer will reach its peak across New South Wales today, with temperatures above 40 degrees Celsius likely to span from Western Australia's north-west all the way to Parramatta.","Sydney's west could crack 40 degrees as heatwave rolls across Australia. The first heatwave of the summer will reach its peak across New South Wales today, with temperatures above 40 degrees Celsius likely to span from Western Australia's north-west all the way to Parramatta.","Sydney occidens 40 gradus resilire potuit sicut aestus aestus per Australiam volvitur. Prima aestus aestatis suum apicem trans Novam Australem Walliam hodie attinget, cum temperaturis supra 40 gradus Celsius usque ad occasum Australiae occidentis spatium usque ad Parramattam.",https://www.abc.net.au/news/2025-12-06/extreme-heatwave-brings-temperatures-in-40s-to-sydney/106105586,https://live-production.wcms.abc-cdn.net.au/dbca2f4c999cc67a9ee14273ef8bc29b?impolicy=wcms_watermark_news&cropH=2813&cropW=5000&xPos=0&yPos=0&width=862&height=485&imformat=generic,,"The first heatwave of the summer will reach its peak across New South Wales today, with temperatures above 40 degrees Celsius likely to span from Western Australia's north-west all the way to Parrama… [+5889 chars]",,2025-12-13 08:56:09+00:00,acwe,Australia,CAU,Oceania
409f09ce7b2011ad1bf08228a41ff550,2025-12-05T00:01:34Z,Heat Wave,heatwave Australia,www.abc.net.au,en,0.8,"Live: In ganz Australien kommt es zu Bränden und Hitzewellen, es werden extreme Warnungen ausgegeben. Es wird erwartet, dass sich eine breite Hitzewelle über ganz Australien ausbreitet, mit kurzen und heftigen Hitzeausbrüchen in den südlichen Bundesstaaten. Live verfolgen.","Live: Fires, heatwaves strike across Australia with extreme warnings issued","A broad heatwave is expected to spread across Australia, with short and sharp bursts of heat throughout the southern states. Follow live.","Live: Fires, heatwaves strike across Australia with extreme warnings issued. A broad heatwave is expected to spread across Australia, with short and sharp bursts of heat throughout the southern states. Follow live.","Vive: Ignes, aestus trans Australiam percutiunt cum monitis extremis editis. Lata aestus in Australiam diffundi expectatur, cum brevibus et acutis eruptionibus caloris per civitates meridionales. Vivamus sequere.",https://www.abc.net.au/news/2025-12-05/heatwaves-fires-live-blog-december-5/106105352,https://live-production.wcms.abc-cdn.net.au/490292c53ec9097c1403757563ac55e0?impolicy=wcms_watermark_news&cropH=864&cropW=1536&xPos=0&yPos=592&width=862&height=485&imformat=generic,,"Hello I'm Tessa Flemming and I'll be joining you as Australia swelters.
A broad heatwave is expected to spread across the country.
Throughout southern states, the burst of heat is short and sharp, … [+322 chars]",,2025-12-13 16:55:41+00:00,acwe,Australia,CAU,Oceania
d5dffc53333568a27e05a56fb40df139,2025-12-05T05:54:20Z,Heat Wave,heatwave Australia,www.abc.net.au,en,0.8,"Sind Sie von der extremen Hitzewelle in Australien betroffen? Erzählen Sie uns Ihre Geschichte. In mehreren Regionen des Landes wurden Warnungen vor extremer Hitze und Buschbränden ausgegeben. Teilen Sie Ihre Geschichte zusammen mit allen Videos oder Bildern, die Sie möglicherweise benötigen, um unsere Wetterberichterstattung zu informieren.",Are you affected by the extreme heatwave sweeping through Australia? Tell us your story,Extreme heat and bushfire warnings have been issued in several regions across the country. Share your story along with any videos or images you may have to help inform our weather coverage.,Are you affected by the extreme heatwave sweeping through Australia? Tell us your story. Extreme heat and bushfire warnings have been issued in several regions across the country. Share your story along with any videos or images you may have to help inform our weather coverage.,An extrema aestu fluctuante per Australiam vergente afficis? Narra nobis fabulam tuam. Extremi caloris et bushfire monita in pluribus regionibus per regionem edita sunt. Partis fabulam tuam una cum omnibus videos vel imaginibus iuvare potes certiorem nostrae tempestatis coverage.,https://www.abc.net.au/news/2025-12-05/audience-callout-extreme-heat-warning/106108490,https://live-production.wcms.abc-cdn.net.au/dafe973626e9a4ab81df66b26d020154?impolicy=wcms_watermark_news&cropH=2088&cropW=3712&xPos=0&yPos=328&width=862&height=485&imformat=generic,,"Extreme weather warnings are popping up across the country as temperatures quickly rise over summer.
With a ""hotter than average"" forecast, heatwaves and bushfires can be expected in several regions… [+327 chars]",,2025-12-13 16:55:41+00:00,acwe,Australia,CAU,Oceania
24c6085438190bcc9728a3d3b4f9de69,2025-12-15T13:01:50Z,Snow&Ice,Avalanche Canada,researchbuzz.me,en,0.9,"Avalanche Canada, Snapscope, Reddit, Mehr: Montag ResearchBuzz, 15. Dezember 2025. NEUE RESSOURCEN NTV: Avalanche Canada startet neue Datenbank für tödliche Lawinenvorfälle. „Avalanche Canada hat gerade eine neue Website gestartet, die alle bekannten Lawinentoten in Kanada seit 1792 dokumentiert. Zusätzlich zu […]","Avalanche Canada, Snapscope, Reddit, More: Monday ResearchBuzz, December 15, 2025",NEW RESOURCES NTV: Avalanche Canada launches new database for fatal avalanche incidents. “Avalanche Canada has just launched a new site documenting every known avalanche fatality in Canada since 1792. In addition to […],"Avalanche Canada, Snapscope, Reddit, More: Monday ResearchBuzz, December 15, 2025. NEW RESOURCES NTV: Avalanche Canada launches new database for fatal avalanche incidents. “Avalanche Canada has just launched a new site documenting every known avalanche fatality in Canada since 1792. In addition to […]","Avalanche Canada, Snapscope, Reddit, More: Monday ResearchBuzz, December 15, 2025. NEW RESOURCES NTV: Avalanche Canada, nova datorum perniciosa incidentia inducit. ""Avalanche Canada modo novum locum documenting omnem notam NIVIS CASUS fatalem in Canada cum 1792 excussit. Praeter […]",https://researchbuzz.me/2025/12/15/avalanche-canada-snapscope-reddit-more-monday-researchbuzz-december-15-2025/,https://s0.wp.com/_si/?t=eyJpbWciOiJodHRwczpcL1wvczAud3AuY29tXC9pXC9ibGFuay5qcGciLCJ0eHQiOiJSZXNlYXJjaEJ1enoiLCJ0ZW1wbGF0ZSI6ImhpZ2h3YXkiLCJmb250IjoiIiwiYmxvZ19pZCI6NDMyODc1Nn0.BjdcPIDlw4ZG0Ki13B-quwxnrzAxn9iB5rJXagRMNlcMQ,,"NEW RESOURCES 
NTV: Avalanche Canada launches new database for fatal avalanche incidents. “Avalanche Canada has just launched a new site documenting every known avalanche fatality in Canada since 17… [+5238 chars]",,2025-12-17 05:01:08+00:00,wmo,Canada,NEN,North-America
3f280e5937ff2302be68156b99234643,2025-12-16T02:18:47Z,Storm,storm Australia,www.fool.com.au,en,0.8,"Seek-Aktien dürften im nächsten Jahr um 45 % steigen: Hier ist der Grund. Macquarie teilt seine Meinung zum neuesten Beschäftigungsbericht für November.
Der Beitrag Seek-Aktien dürften im nächsten Jahr um 45 % steigen: Aus folgenden Gründen erschien zuerst auf The Motley Fool Australia.",Seek shares tipped to storm 45% higher next year: Here's why,"Macquarie shares its view on the latest employment report for November.
The post Seek shares tipped to storm 45% higher next year: Here's why appeared first on The Motley Fool Australia.","Seek shares tipped to storm 45% higher next year: Here's why. Macquarie shares its view on the latest employment report for November.
The post Seek shares tipped to storm 45% higher next year: Here's why appeared first on The Motley Fool Australia.",Quaere portiones 45% altioris anni sequentis ad expugnandam praefixa: Hic est cur. Macquarie sententiam suam communicat in relationibus Novembri Novembri. Postes quaerite communicat 45% superiore anno proximo expugnaturus: Hic primum apparuit cur in Australia Stulte Motley.,https://www.fool.com.au/2025/12/16/seek-shares-tipped-to-storm-45-higher-next-year-heres-why/,https://www.fool.com.au/wp-content/uploads/2022/02/jobs-1-1200x675.jpg,,"Seek Ltd (ASX: SEK) shares are trading in the red again in Tuesday morning trade. At the time of writing, the job listing company's shares are down 1.51% to $22.50 a piece. 
The latest tumble means … [+2235 chars]",,2025-12-20 16:54:50+00:00,aidr,Australia,SAU,Oceania
