index,published,topic,term,domain,language,valid,de,title,description,en,la,url,image,archive,content,quote,added,feed,country,ipcc,continent
c2ccbd7a09422b7a4045a0b0fb2ded1c,2026-05-08T21:06:27Z,Heat Wave,heatwave South Australia,www.dailymail.com,en,0.3,"Im Inneren öffnet die neue 250-Millionen-Dollar-Festung des US-Fußballs als hochmodernes nationales Trainingszentrum in Atlanta ihre Pforten. Mehr als eine halbe Stunde südlich von Atlantas Centennial Olympic Park, vorbei an Autobahnen und Flughäfen, durch Kiefernwälder liegt das stärkste Statement, das der amerikanische Fußball jemals abgegeben hat.",Inside US Soccer's new $250million fortress as state-of-the-art national training center opens its doors in Atlanta,"Over half an hour south of Atlanta's Centennial Olympic Park, past highways and airports, through forests of pine trees lies the strongest statement American soccer has ever made.","Inside US Soccer's new $250million fortress as state-of-the-art national training center opens its doors in Atlanta. Over half an hour south of Atlanta's Centennial Olympic Park, past highways and airports, through forests of pine trees lies the strongest statement American soccer has ever made.","Intra US Morbi novum $250million propugnaculum ut status-of-artis nationalis disciplinae centrum ostia in Atlanta aperit. Plus dimidium horae meridianae Park Olympiae centenariae Atlantae, praeter vias et nisl, per silvas pineas iacet validissima editio Morbi Americani umquam facta est.",https://www.dailymail.com/sport/football/article-15802177/us-soccer-training-center-atlanta.html,https://i.dailymail.com/1s/2026/05/08/19/108478421-0-image-m-5_1778264487343.jpg,,"Over half an hour south of Atlanta's Centennial Olympic Park, past highways and airports, through forests of pine trees and just up the road from a massive movie studio lies the boldest and strongest… [+8338 chars]",,2026-05-27 03:37:39+00:00,acwe,Australia,CAU,Oceania
92d8f90705670451d96969fa28da3673,2026-05-15T06:00:00Z,Snow&Ice,Ice Canada,www.techradar.com,en,0.7,"So sehen Sie die IIHF-Weltmeisterschaft 2026: KOSTENLOSE Live-Streams und TV-Kanäle für Eishockey. Sehen Sie sich kostenlose Streams von der IIHF-Weltmeisterschaft 2026 an, während die USA ihren Titel verteidigen und Kanada Rache üben – Eishockey-TV-Kanäle, -Sender und -Streams.",How to watch IIHF World Championship 2026: FREE Live Streams & TV Channels for ice hockey,"Watch free streams from the IIHF World Championship 2026 as USA defend their title and Canada seek revenge – ice hockey TV channels, broadcasters and streams.","How to watch IIHF World Championship 2026: FREE Live Streams & TV Channels for ice hockey. Watch free streams from the IIHF World Championship 2026 as USA defend their title and Canada seek revenge – ice hockey TV channels, broadcasters and streams.","Quomodo vigilare IIHF Championship Mundus 2026: FREE Fluvii & TV canales pro hockey glaciei. Vigilate rivi liberi ab IIHF Championship Mundus 2026 ut USA suum titulum defendunt et Canada vindictam quaerunt – canales TV hockey, radiophonici et rivi.",https://www.techradar.com/how-to-watch/hockey/iihf-world-championship-2026-free-live-streams-ice-hockey,https://cdn.mos.cms.futurecdn.net/zy3tQjBkxLgW4zGYxERZEh-1024-80.jpg,,"<ul><li>IIHF World Championship 2026: Friday, May 15 to Sunday, May 31</li><li>FREE stream: ORF On (Austria, select games)</li><li>US stream: NHL Network via Sling TV</li><li>Access your usual stream… [+9102 chars]",,2026-05-27 12:51:24+00:00,wmo,Canada,NEN,North-America
9074b6d89d234fe53e9684c5062653b8,2026-05-26T15:59:07Z,Flood,Flooding Bartholomew IN Jackson IN,www.thehindubusinessline.com,en,0.3,"Bekämpfung des Ressourcennationalismus. Der Schritt Indonesiens, Kohleexporte über eine staatliche Einrichtung zu kanalisieren, muss Indien dazu veranlassen, seine Energiestrategie zu kalibrieren",Countering resource nationalism,Indonesia’s move to channelise coal exports through a state entity must make India calibrate its energy strategy,Countering resource nationalism. Indonesia’s move to channelise coal exports through a state entity must make India calibrate its energy strategy,Resource nationalismi contradicendo. Indonesia motus est ad exportationes carbonum per res publicas canalem faciendam suam industriam belli calibrare debet,https://www.thehindubusinessline.com/opinion/countering-resource-nationalism/article71026274.ece,https://bl-i.thgim.com/public/incoming/3v3oh3/article71026291.ece/alternates/LANDSCAPE_1200/iStock-1209889361.jpg,,"The current geopolitical uncertainty has triggered an energy market disruption that is benefiting coal.
No surprises then that the major coal exporting nations are aggressively leveraging the curren… [+5826 chars]",,2026-05-28 13:47:59+00:00,wmo,United States,CNA,North-America
5401b37bd5ccfaf5975e72549180b524,2026-05-23T03:21:29Z,Flood,Flooding India,indianexpress.com,en,0.7,"8-Millionen-Pfund-Kartell zerschlagen: Indischstämmiger Mann unter fünf inhaftiert, weil er London mit Drogen überschwemmt hat. Die Gruppe war am Import und der Lieferung von Kokain und Heroin nach London und in die umliegenden Gebiete beteiligt.",£8M cartel crushed: Indian-origin man among 5 jailed for flooding London with drugs,The group was involved in importing and supplying cocaine and heroin into London and nearby areas.,£8M cartel crushed: Indian-origin man among 5 jailed for flooding London with drugs. The group was involved in importing and supplying cocaine and heroin into London and nearby areas.,£8M cartel contriti: homo Indus-origo inter 5 inundationem Londinii pharmacis inclusus. Coetus implicatus est in importandis et praebendis cocaine et heroine in Londinii et vicinis locis.,https://indianexpress.com/article/world/uk-indian-origin-man-jagjit-singh-jailed-8-million-pounds-drug-smuggling-network-10703699/,https://images.indianexpress.com/2026/05/US-14-3.jpg,,"An Indian-origin man is among five people jailed in the UK for a combined 84 years for their role in a drug trafficking network, according to Press Trust of India (PTI).The group was involved in impo… [+1901 chars]",,2026-05-28 13:47:59+00:00,wmo,India,SAS,Asia
0361faa9c7234b36b06454441eca0abf,2026-05-11T20:19:09Z,Flood,Flood Gibson IN Knox IN,www.abc.net.au,en,0.2,"Erstes nordwestliches Wolkenband des Jahres 2026, das Regen aus den Tropen nach Tasmanien bringt. In einer willkommenen Wendung der Wettervariabilität wird sich diese Woche endlich das erste nordwestliche Wolkenband des Jahres 2026 über Australien entwickeln und ein breites Regenband liefern.",First north-west cloudband of 2026 to bring rain from tropics to Tasmania,"In a welcome twist of weather variability, the first north-west cloudband of 2026 will finally develop over Australia this week, delivering a broad band of rain.","First north-west cloudband of 2026 to bring rain from tropics to Tasmania. In a welcome twist of weather variability, the first north-west cloudband of 2026 will finally develop over Australia this week, delivering a broad band of rain.","Primum a septentrione-occidentali nubeculae 2026 pluviam e tropicis ad Tasmaniam apportant. In grata tempestatum variabilitas torquent, primum nubis occidentis septentrionalis anni 2026 tandem in Australia hac septimana evolvebit, lata pluviae manu tradens.",https://www.abc.net.au/news/2026-05-12/first-north-west-cloudband-weather-brings-rain-across-australia/106667518,https://live-production.wcms.abc-cdn.net.au/6ec16c95b49cd9e9ac747ffd4e29a7c2?impolicy=wcms_watermark_news&cropH=1152&cropW=2048&xPos=0&yPos=0&width=862&height=485&imformat=generic,,"After the nation's driest April in eight years, an unfavourable monthly outlook and El Niño looming in the near distant future, expectations for drought relief this May were not particularly high.
B… [+5021 chars]",,2026-05-28 18:11:26+00:00,wmo,United States,CNA,North-America
ebde501aa3327c2731f876db9e785f96,2026-05-05T14:06:09Z,Flood,Flooding Lee TX,www.globalresearch.ca,en,0.2,"Die Geopolitik der Energie: Strategische Dimensionen zeitgenössischer Konflikte in der Ukraine, im Nahen Osten und in Venezuela. Zusammenfassung
Aktuelle Konflikte in der Ukraine, im Nahen Osten und in Venezuela werden zunehmend durch die Linse der Energiegeopolitik interpretiert, wobei die Kontrolle von Kohlenwasserstoffreserven, Transitrouten und Marktabhängigkeiten sowohl als Instrument als auch als…","The Geopolitics of Energy: Strategic Dimensions of Contemporary Conflict in Ukraine, the Middle East, and Venezuela","Abstract
Contemporary conflicts in Ukraine, the Middle East, and Venezuela are increasingly interpreted through the lens of energy geopolitics, wherein the control of hydrocarbon reserves, transit routes, and market dependencies serves as both an instrument a…","The Geopolitics of Energy: Strategic Dimensions of Contemporary Conflict in Ukraine, the Middle East, and Venezuela. Abstract
Contemporary conflicts in Ukraine, the Middle East, and Venezuela are increasingly interpreted through the lens of energy geopolitics, wherein the control of hydrocarbon reserves, transit routes, and market dependencies serves as both an instrument a…","Geopolitici Energy: Dimensiones Strategicae Contemporalis Conflictus in Ucraina, Medio Oriente et Venezuela. Abstract
Conflictiones contemporaneae in Ucraina, Medio Oriente et Venezuela magis magis magisque interpretantur per lens energiae geopoliticae, in quibus imperium hydrocarbonium subsidiorum, viarum transitus, et mercatus dependentiae utraque instrumenti est...",https://www.globalresearch.ca/geopolitics-energy-ukraine-middle-east-venezuela/5925085,https://www.globalresearch.ca/wp-content/uploads/2022/04/oil-gas.jpg,,"Abstract
Contemporary conflicts in Ukraine, the Middle East, and Venezuela are increasingly interpreted through the lens of energy geopolitics, wherein the control of hydrocarbon reserves, transit r… [+27815 chars]",,2026-05-28 21:54:49+00:00,wmo,United States,CNA,North-America
8d135cef16e8a26a6b8a21c8bb609781,2026-05-06T09:09:55Z,Storm,Storm Surge Southern Lynn Canal,www.marketbeat.com,en,0.3,"Höhepunkte der Telefonkonferenz zum ersten Quartal von Crawford & Company. Crawford & Company (NYSE:CRD.A) meldete Ergebnisse für das erste Quartal 2026, die eine geringere Aktivität bei Schadensersatzansprüchen in den USA bei „relativ günstigen Wetterbedingungen“ widerspiegelten.",Crawford & Company Q1 Earnings Call Highlights,Crawford & Company (NYSE:CRD.A) reported first-quarter 2026 results that reflected lower U.S. property claims activity amid “relatively benign weather...,Crawford & Company Q1 Earnings Call Highlights. Crawford & Company (NYSE:CRD.A) reported first-quarter 2026 results that reflected lower U.S. property claims activity amid “relatively benign weather...,"Crawford & Company Q1 CAPTURA Call ornare ipsum. Crawford & Company (NYSE:CRD.A) nuntiaverunt primo-quartam partem 2026 eventus qui reflectuntur inferiora US proprietatis affirmat actionem inter ""secundum relationem benignam tempestatem...",https://www.marketbeat.com/instant-alerts/crawford-company-q1-earnings-call-highlights-2026-05-06/?utm_source=yahoofinance&amp;utm_medium=yahoofinance,https://s.yimg.com/os/en/marketbeat_955/9db00cb72a040791b520338513904cdf,,"Crawford &amp; Company logo
Key Points
<ul><li>Crawford reported Q1 revenue of $309.5 million and GAAP net income of $4.9 million, with consolidated operating earnings down 23.2% yearoveryear due t… [+9480 chars]",,2026-05-29 03:26:16+00:00,wmo,United States,CNA,North-America
85b8e121b168f952670ceb5606616dc0,2026-05-07T01:59:00Z,Flood,Flooding Jackson AR Woodruff AR,www.abc.net.au,en,0.3,"Wenn freiwillige Feuerwehrleute „erschöpft“ sind, könnten Innovationen ihnen helfen, zu bleiben. In ganz Australien kommt es zu Buschbränden mit einer neuen Heftigkeit. Es könnte dazu führen, dass unsere Freiwilligen überwältigt werden.",With volunteer firefighters 'exhausted' innovation might help them stay,Bushfires are occurring at a new level of ferocity across Australia. It could leave our volunteers overpowered.,With volunteer firefighters 'exhausted' innovation might help them stay. Bushfires are occurring at a new level of ferocity across Australia. It could leave our volunteers overpowered.,Cum Firefighters Voluntarius 'exhaustum' innovatio eos adiuvabat ut maneret. Bushfires in novo gradu ferocitatis trans Australiam fiunt. Posset voluntarios nostros relinquere opprimi.,https://www.abc.net.au/news/2026-05-07/rural-firefighters-are-dropping-how-do-we-encourage-them/106312728,https://live-production.wcms.abc-cdn.net.au/9787f86139b237342e75813784592243?impolicy=wcms_watermark_news&cropH=450&cropW=800&xPos=0&yPos=0&width=862&height=485&imformat=generic,,"Dry grass crunches underfoot in another scorching hot day.
It could begin with lightning, a harvesting accident, or an escaped burn-off.
But what happens next happens quickly.
Fire hurtles towards… [+10544 chars]",,2026-05-29 03:26:16+00:00,wmo,United States,CNA,North-America
8df404c4c7eef557d920f31c1f755053,2026-05-27T17:00:37Z,Flood,flood Australia,hackaday.com,en,0.3,"AMOC und die weltweiten Auswirkungen von Meeresströmungen. Auch wenn es beim Blick auf die oft ruhigen Gewässer der Ozeane der Erde schwer zu erkennen sein kann, transportieren ihre Strömungen täglich riesige Mengen Wasser um den Globus und liegen einer Dy…",AMOC and the Planet-Wide Impact of Ocean Currents,"Although it can be hard to tell from looking at the often placid waters of the Earth’s oceans, their currents carry immense amounts of water around the globe on a daily basis, underlying a dy…","AMOC and the Planet-Wide Impact of Ocean Currents. Although it can be hard to tell from looking at the often placid waters of the Earth’s oceans, their currents carry immense amounts of water around the globe on a daily basis, underlying a dy…","AMOC et Planet-Lata Impact Oceani Excursus. Etsi difficile dictu est ex speculandis saepe placidis aquis Oceani Telluris, eorum excursus immensas aquae quantitates circum globum cottidie portant, subiecta dy…",https://hackaday.com/2026/05/27/amoc-and-the-planet-wide-impact-of-ocean-currents/,https://hackaday.com/wp-content/uploads/2026/05/AMOC-scaled-2-1024x737-1_06184b.jpg,,"Although it can be hard to tell from looking at the often placid waters of the Earth’s oceans, their currents carry immense amounts of water around the globe on a daily basis, underlying a dynamic sy… [+9706 chars]",,2026-05-29 03:26:16+00:00,aidr,Australia,EAU,Oceania
cfe2b3f069595ba64de85f798a76111c,2026-05-07T06:25:25Z,Thunderstorm,Thunderstorm India,www.thehindubusinessline.com,en,0.7,"Der globale Gürtel aus Regen und Stürmen überquert den Äquator, nicht weit dahinter folgt der asiatische Monsun. Atmosphärische Veränderungen signalisieren den bevorstehenden asiatischen Monsun, wobei sich in ganz Indien und den umliegenden Regionen Gewitter vor dem Monsun entwickeln.","Global belt of rain, storms crosses Equator with Asian monsoon not far behind","Atmospheric shifts signal the approaching Asian monsoon, with pre-monsoon thunderstorms developing across India and surrounding regions.","Global belt of rain, storms crosses Equator with Asian monsoon not far behind. Atmospheric shifts signal the approaching Asian monsoon, with pre-monsoon thunderstorms developing across India and surrounding regions.","Cingulum pluviae, procellae Equatorem cum ETESIA Asiana non longe post transit. Mutationes atmosphaeriae significant accessus monsoons Asiatici, cum tempestatum prae-monsonorum per Indiam et regiones circumiacentes evolutionis.",https://www.thehindubusinessline.com/economy/agri-business/global-belt-of-rain-storms-crosses-equator-with-asian-monsoon-not-far-behind/article70949941.ece,https://bl-i.thgim.com/public/incoming/yjnpoy/article70949936.ece/alternates/LANDSCAPE_1200/WeathrMay7am.jpg,,"The dry season is tightening its grip over northern Australia, setting the stage for the vast machinery of the Asian monsoon to begin its annual migration northward. The Southern Hemisphere tropics h… [+3006 chars]",,2026-05-29 03:26:16+00:00,wmo,India,SAS,Asia
8ac3cad8470c3187b4705ff1189fa5d4,2026-05-01T13:00:00Z,Flood,Flashflood United States,www.theatlantic.com,en,0.3,"Fotos der Woche: Screeching Championship, Direct Democracy, Victory Plunge. Parkour-Training in den Bergen Afghanistans, eine Anzac-Day-Parade in Australien, ein Kunstprojekt zur Mondlandung in Nordirland, Corgi-Rennen in der Tschechischen Republik und vieles mehr","Photos of the Week: Screeching Championship, Direct Democracy, Victory Plunge","Parkour practice in the mountains of Afghanistan, an Anzac Day parade in Australia, a lunar-landing art project in Northern Ireland, corgi racing in the Czech Republic, and much more","Photos of the Week: Screeching Championship, Direct Democracy, Victory Plunge. Parkour practice in the mountains of Afghanistan, an Anzac Day parade in Australia, a lunar-landing art project in Northern Ireland, corgi racing in the Czech Republic, and much more","Imagines Hebdomadae: Stridens risus, Dirige Democratiam, Victoriam demitte. Parkour praxis in montibus Afghanistanis, pompa diei Anzac in Australia, ars lunaris in Hibernia septentrionali, corgi curriculi in Res publica Bohemica, et multo magis",https://www.theatlantic.com/photography/2026/05/photos-week-screeching-championship-direct-democracy-victory-plunge/687012/,https://cdn.theatlantic.com/thumbor/svaesHr-qmp6KFk7nGM7BhAmT9o=/0x235:7335x4055/1200x625/media/img/mt/2026/04/a01_G_2272691861/original.jpg,,"Carl Court / Getty
A competitor poses for photographers near the finish line of the Maldon Mud Race on April 26, 2026, in Maldon, England. More than 350 runners took part in the annual race, tacklin… [+6702 chars]",,2026-05-29 08:42:36+00:00,wmo,United States,CNA,North-America
b0f14772e3ebecca65c42f6d4b436bf7,2026-05-12T22:01:00Z,Snow&Ice,Snow Canada,streetartutopia.com,en,0.3,"#7 Neue Street Art (30 Fotos). Eine frische Street-Art-Runde aus Europa, Amerika, Australien und Indonesien. Erwarten Sie Libellen auf Ziegelsteinen, Raketenkatzen, mehrschichtige Porträts, eine neue Banksy-Skulptur, mythischen Donner, Monsterwände, botanische Riesen und Straßen, die hellwach wirken. Mehr: #6 Neu …",#7 New Street Art (30 Photos),"A fresh street art round from Europe, the Americas, Australia, and Indonesia. Expect dragonflies on brick, rocket cats, layered portraits, a new Banksy sculpture, mythic thunder, monster walls, botanical giants, and streets that feel wide awake. More: #6 New …","#7 New Street Art (30 Photos). A fresh street art round from Europe, the Americas, Australia, and Indonesia. Expect dragonflies on brick, rocket cats, layered portraits, a new Banksy sculpture, mythic thunder, monster walls, botanical giants, and streets that feel wide awake. More: #6 New …","#7 New Street Art (30 Photos). Nova via artis circumcirca ex Europa, America, Australia, et Indonesia. Exspecta dracones in latere, feles erucae, imagines stratae, sculptura nova Banksy, tonitrua fabulosa, moenia monstri, gigantes botanici, et plateas quae vigilantes sentiunt. Magis: #6 Nova ...",https://streetartutopia.com/2026/05/13/new-street-art-30-photos-part-8/,https://i0.wp.com/streetartutopia.com/wp-content/uploads/2026/05/new-street-art-1.jpeg?fit=1200%2C700&ssl=1,,"Most liked mode is active for this post: images are ranked by community likes.
Expect dragonflies on brick, rocket cats, layered portraits, a new Banksy sculpture, mythic thunder, monster walls, bot… [+16307 chars]",,2026-05-29 08:42:36+00:00,wmo,Canada,NEN,North-America
0a4535cf67c60d996a57ee6a903532d2,2026-05-18T13:28:00Z,Precipitation,Rain Chibougamau Manic 5 area,www.pitpass.com,en,0.2,"Großer Preis von Kanada: Vorschau – Pirelli. An diesem Wochenende wird Pirelli die drei weichsten Mischungen seiner Produktpalette liefern, die C3, C4 und C5.",Canadian Grand Prix: Preview - Pirelli,"This weekend Pirelli will supply the three softest compounds in its range, the C3, C4 and C5.","Canadian Grand Prix: Preview - Pirelli. This weekend Pirelli will supply the three softest compounds in its range, the C3, C4 and C5.","Praefectus Urbi: Preview - Pirelli. Haec volutpat Pirelli tres compositiones mollissimas in ambitu suo suppeditabit, C3, C4 et C5.",https://www.pitpass.com/82604/Canadian-Grand-Prix-Preview-Pirelli,http://www.pitpass.com/images/teams/800/pirelli/202605canadapreview.jpg,,"Another Sprint weekend awaits teams and drivers in Canada.
It will be the first time the shorter race is held in Montreal, and this year the Circus will tackle the semi permanent circuit along the S… [+3237 chars]",,2026-05-29 12:47:30+00:00,wmo,Canada,NEN,North-America
628d23cd5fceb58268f00b39ded47e75,2026-05-23T14:37:43Z,Flood,Flooding Rapides LA,nypost.com,en,0.2,"Alte versteinerte Bäume könnten endlich beweisen, dass die Flut der Arche Noah wahr ist: Wissenschaftler. Es stellt sich heraus, dass das Einzige, was noch tiefer vergraben ist als diese Bäume, die Debatte darüber ist, was sie begraben hat.",Ancient fossilized trees may finally prove Noah’s Ark flood is true: scientists,Turns out the only thing more deeply buried than these trees is the debate over what buried them.,Ancient fossilized trees may finally prove Noah’s Ark flood is true: scientists. Turns out the only thing more deeply buried than these trees is the debate over what buried them.,"Arbores antiquae fossilibus tandem probabunt Arcam Noe diluvium verum est: scientiarum. Sola res altius defossa est, quam has arbores disceptatio de illis sepelivit.",https://nypost.com/2026/05/23/science/fossil-trees-spark-noahs-ark-flood-debate/,https://nypost.com/wp-content/uploads/sites/2/2026/05/128528844.jpg?quality=75&strip=all&w=1200,,"Ready for a root awakening?
Towering fossilized tree trunks entombed upright in layers of rock across the US are stirring up a flood of debate with some researchers claiming the eerie formations cou… [+5525 chars]",,2026-05-29 12:47:30+00:00,wmo,United States,CNA,North-America
e6550ad4c31fcd265701c2ddd105ff8a,2026-05-04T18:40:12Z,Flood,Flashflood Jefferson WI,bringatrailer.com,en,0.3,"50.000 Kilometer langer Euro-Porsche 928 aus dem Jahr 1978. Dieser auf dem europäischen Markt erhältliche Porsche 928 aus dem Jahr 1978 wurde neu in Deutschland verkauft und blieb dort bis 2021 unter der Obhut seines ursprünglichen Besitzers zugelassen, bevor er vom jetzigen Besitzer gekauft und in die Vereinigten Staaten importiert wurde. Mit kupferbraunem Metallic-Finish über Schwarz.",50k-Kilometer Euro 1978 Porsche 928,"This European-market 1978 Porsche 928 was sold new in Germany and remained registered there under the care of its original owner until 2021, when it was purchased by the current owner and imported to the United States. Finished in Copper Brown Metallic over b…","50k-Kilometer Euro 1978 Porsche 928. This European-market 1978 Porsche 928 was sold new in Germany and remained registered there under the care of its original owner until 2021, when it was purchased by the current owner and imported to the United States. Finished in Copper Brown Metallic over b…","50k-Kilometer Euro 1978 Porsche 928. Hoc mercatum Europaeum 1978 Porsche 928 novum in Germania venditum est et ibi descripserunt sub cura possessoris sui primigenii usque ad annum 2021, cum a possessore hodierno emptus est et in Civitates Foederatas importatus est. Consummatum est in Copperis Metallicis super b...",https://bringatrailer.com/listing/1978-porsche-928-78/,https://bringatrailer.com/wp-content/uploads/2026/04/1978_porsche_928_jnfs5285-2-80862.jpg,,"This European-market 1978 Porsche 928 was sold new in Germany and remained registered there under the care of its original owner until 2021, when it was purchased by the current owner and imported to… [+2127 chars]",,2026-05-30 02:53:52+00:00,wmo,United States,CNA,North-America
0cc8362ce9229a3bfc4bb6d748caf72a,2026-05-04T19:38:54Z,Flood,Flood Tuscarawas OH,bringatrailer.com,en,0.3,"1998 Alfa Romeo 155 2.0 Twin Spark 5-Gang-Sonderedition ohne Reserve. Bei diesem Alfa Romeo 155 aus dem Jahr 1998 handelt es sich um eine auf dem japanischen Markt erhältliche Limousine, die der Verkäufer 2024 in Japan gekauft und 2025 in die Vereinigten Staaten importiert hat. Es handelt sich um die Nummer 22 von 500 Special Edition-Autos, die im letzten Modelljahr der Produktion für den japanischen Markt gebaut wurden, …",1998 Alfa Romeo 155 2.0 Twin Spark 5-Speed Special Edition at No Reserve,"This 1998 Alfa Romeo 155 is a Japanese-market sedan that was purchased by the seller in Japan in 2024 and imported to the United States in 2025. It is number 22 of 500 Special Edition cars built for the Japanese market for the final model year of production, …","1998 Alfa Romeo 155 2.0 Twin Spark 5-Speed Special Edition at No Reserve. This 1998 Alfa Romeo 155 is a Japanese-market sedan that was purchased by the seller in Japan in 2024 and imported to the United States in 2025. It is number 22 of 500 Special Edition cars built for the Japanese market for the final model year of production, …","1998 Alfa Romeo 155 2.0 Twin Spark 5-Speed ​​Special Edition at No Reserve. Hoc 1998 Alfa Romeo 155 sella Iaponicae mercatus est quae a venditore in Iaponia anno 2024 emptus est et in Civitates Foederatas anno 2025. Invecta est numerus XXII millium 500 Praecipuarum Editionum carros in mercatu Iaponico aedificatos ad extremum exemplar anni productionis, ...",https://bringatrailer.com/listing/1998-alfa-romeo-155/,https://bringatrailer.com/wp-content/uploads/2026/04/1998_alfa-romeo_155_pxl_20260425_122140579-03474.jpg,,This 1998 Alfa Romeo 155 is a Japanese-market sedan that was purchased by the seller in Japan in 2024 and imported to the United States in 2025. It is number 22 of 500 Special Edition cars built for … [+3379 chars],,2026-05-30 02:53:52+00:00,wmo,United States,CNA,North-America
