index,published,topic,term,domain,language,valid,de,title,description,en,la,url,image,archive,content,quote,added,feed,country,ipcc,continent
6858982590ec517b6cc241aa8a1b4245,2026-06-11T04:47:53Z,Flood,Flooding South Australia Cooper Creek,economictimes.indiatimes.com,en,0.2,"Die Wiederinbetriebnahme des Reaktors im größten Atomkraftwerk der Welt zeigt Mängel in Japans Plänen für radioaktive Abfälle auf. Japan hat sein größtes Atomkraftwerk wieder in Betrieb genommen, um den Energiebedarf zu decken. Das Land steht jedoch vor einer entscheidenden Herausforderung: einem gravierenden Platzmangel für abgebrannte Kernbrennstoffe. Da sich die Kühlbecken füllen, erkundet Japan abgelegene Inselstandorte für dauerhafte…",Reactor reboot at world's largest nuclear plant highlights flaws in Japan's radioactive waste plans,"Japan has restarted its largest nuclear power plant to meet energy demands. However, the nation faces a critical challenge: a severe shortage of space for spent nuclear fuel. With cooling pools filling up, Japan is exploring remote island locations for perman…","Reactor reboot at world's largest nuclear plant highlights flaws in Japan's radioactive waste plans. Japan has restarted its largest nuclear power plant to meet energy demands. However, the nation faces a critical challenge: a severe shortage of space for spent nuclear fuel. With cooling pools filling up, Japan is exploring remote island locations for perman…","Reactor reboot apud maximas plantas nuclei mundi vitia elucidat in consiliis vastis Iaponiae radioactivos. Iaponia maximam vim nuclei plantae obviam energiae poscit. Sed natio criticam provocationem respicit: gravis penuria spatii pro alimentis nuclei consumptis. Iaponia, lacunis replendis refrigeratis, insulas remotas locorum permansionum explorat.",https://economictimes.indiatimes.com/news/international/world-news/reactor-reboot-at-worlds-largest-nuclear-plant-highlights-flaws-in-japans-radioactive-waste-plans/articleshow/131649233.cms,"https://img.etimg.com/thumb/msid-131649285,width-1200,height-630,imgsize-82152,overlay-economictimes/articleshow.jpg",,"Kashiwazaki: Japan has resumed operations at the world's largest nuclear power plant to help the country meet huge electricity demands during a global oil crisis, but the reboot highlights a big prob… [+6837 chars]",,2026-06-12 12:54:17+00:00,wmo,Australia,CAU,Oceania
dd97acfd8b7d86298a9db675961a4e3e,2026-06-11T10:51:26Z,Precipitation,Downpour Fiordland north of Doubtful Sound,www.dailymail.com,en,0.2,"Die Weltmeisterschaft beginnt HEUTE! Ihr ultimativer Leitfaden zu den Chancen Englands und Schottlands, den Topspielen für Ihren Terminkalender – und all dem Chaos und den Kontroversen zu Beginn des größten Sportturniers der Welt. 48 Mannschaften werden in den USA, Kanada und Mexiko im Mittelpunkt stehen – von der winzigen Karibikinsel Curaçao mit 150.000 Einwohnern bis zum fünfmaligen Weltmeister Brasilien.","The World Cup starts TODAY! Your ultimate guide to England and Scotland's chances, the top games for your diary - and all the chaos and controversy as the planet's biggest sporting tournament kicks off","Forty-eight teams are set to take centre stage in the United States, Canada and Mexico - from the tiny Caribbean island of Curacao, with a population of 150,000, to five-time world champions Brazil.","The World Cup starts TODAY! Your ultimate guide to England and Scotland's chances, the top games for your diary - and all the chaos and controversy as the planet's biggest sporting tournament kicks off. Forty-eight teams are set to take centre stage in the United States, Canada and Mexico - from the tiny Caribbean island of Curacao, with a population of 150,000, to five-time world champions Brazil.","Mundus Calicem hodie incipit! Ultimus dux tuus in Angliam et Scotiae casus, summos ludos diarium tuum - et omnem chaos et controversiam sicut planetae maximus ludus torneamentum calcit. Quadraginta octo iugis in Civitatibus Foederatis, Canada et Mexici - ex minima Caribbeana insula Curacao, cum hominum 150.000 hominum, ad quinque-tempus mundi Brasiliae propugnatores capiunt.",https://www.dailymail.com/sport/football/article-15858087/World-Cup-watch-England-chances-controversy.html,https://i.dailymail.com/1s/2026/06/01/21/109020199-0-image-m-9_1780345565364.jpg,,"After what feels like a lifetime of waiting, the World Cup is finally upon us.
Forty-eight teams are set to take centre stage in the United States, Canada and Mexico - from the tiny Caribbean island… [+15607 chars]",,2026-06-12 12:54:17+00:00,wmo,New Zealand,NZ,Oceania
781c81c28f3ea3d806ed14ebd813504b,2026-06-10T04:27:23Z,Wildfire,Wildfire Routt,www.huffpost.com,en,0.3,"32.000 Menschen durch Erdbeben auf den Philippinen vertrieben. Rettungskräfte durchsuchen zerstörte Gebäude im Süden der Philippinen, um sicherzustellen, dass niemand noch eingeschlossen ist.","32,000 People Displaced By Philippine Earthquake",Rescuers are searching ruined buildings in the southern Philippines to ensure no one is still trapped.,"32,000 People Displaced By Philippine Earthquake. Rescuers are searching ruined buildings in the southern Philippines to ensure no one is still trapped.","32.000 Homines per Philippinas Terrae motus emoti. Resecutores aedificia ruinosa in Philippinis australibus quaerunt, ut neminem adhuc capi curent.",https://www.huffpost.com/entry/philippines-earthquake-2026_n_6a28e6bae4b0c0ad139b572a,https://img.huffingtonpost.com/asset/6a28e6bb14000077906b4c94.jpeg?cache=jKfqCr7vul&ops=1200_630,,"The 7.8 magnitude earthquake struck on Monday morning and left a trail of destruction in the southern Philippines.
GENERAL SANTOS, Philippines (AP) Rescuers searched ruined buildings in the southern… [+4547 chars]",,2026-06-12 12:54:17+00:00,wmo,United States,CNA,North-America
f6223dc2863796248dad806541a715e3,2026-06-07T16:30:21Z,Thunderstorm,Hail United States,www.delawareonline.com,en,0.2,"Wie das Hotel du Pont bei der Weltmeisterschaft ein „Heimatgefühl“ für die Elfenbeinküste schafft. Während das Hotel du Pont in Wilmington im Laufe der Jahre eine Flut berühmter Besucher angezogen hat, ist die Aufnahme von Fußballstars dort der neue Trend.",How Hotel du Pont creates 'sense of home' for Ivory Coast in World Cup,"While the Hotel du Pont in Wilmington has attracted a flood of famous visitors over the years, hosting soccer stars is the new wave there.","How Hotel du Pont creates 'sense of home' for Ivory Coast in World Cup. While the Hotel du Pont in Wilmington has attracted a flood of famous visitors over the years, hosting soccer stars is the new wave there.","Quomodo Hotel du Pont facit sensum domus pro Eburneo in World Cup. Dum Hotel du Pont in Wilmington inundationem visitatores clarorum super annos attraxit, morbi stellae obnoxius est nova unda ibi.",https://www.delawareonline.com/story/news/2026/06/07/ivory-coast-gets-home-feel-at-hotel-du-pont-for-fifa-world-cup-2026/90407854007/,https://s.yimg.com/ny/api/res/1.2/NcEoih66jKGPicJLbpcrFA--/YXBwaWQ9aGlnaGxhbmRlcjt3PTEyMDA7aD04MDA7Y2Y9d2VicA--/https://media.zenfs.com/en/delaware-online-the-news-journal/28c9de2395bf28c65f4010c164cf2d32,,"While the luxurious Hotel du Pont in Wilmington has attracted a flood of famous visitors over the years, from astronauts to U.S. presidents, hosting soccer stars is the new wave here this summer.
Iv… [+7755 chars]",,2026-06-12 21:42:53+00:00,wmo,United States,CNA,North-America
437478e4e66bf5af335e2823de30f36c,2026-06-08T07:49:43Z,Storm,Storm All waters,financialpost.com,en,0.3,"Aktien und Anleihen fallen, während die Streiks im Nahen Osten Öl fördern: Märkte schließen. Aktien und Anleihen fielen, da die Anleger mit steigenden Ölpreisen, zunehmenden Wetten auf US-Zinserhöhungen und einem Rückgang im Handel mit künstlicher Intelligenz zu kämpfen hatten.","Stocks, Bonds Fall as Mideast Strikes Lift Oil: Markets Wrap","Stocks and bonds dropped as investors grappled with rising oil prices, mounting bets on US interest rate hikes and a pullback in the artificial-intelligence trade.","Stocks, Bonds Fall as Mideast Strikes Lift Oil: Markets Wrap. Stocks and bonds dropped as investors grappled with rising oil prices, mounting bets on US interest rate hikes and a pullback in the artificial-intelligence trade.","Nervo, vincla Cadite ut Mideast Striges Leva Oleum: Mercatus AMICTORIUM. Liga et vincula omittuntur sicut investatores involuti cum pretia olei surgentia, ascendentes sponsiones in US rate hikes et recesserunt in commercio artificio-intelligentiae.",https://financialpost.com/pmn/business-pmn/stocks-bonds-fall-as-mideast-strikes-lift-oil-markets-wrap,https://smartcdn.gprod.postmedia.digital/financialpost/wp-content/uploads/2026/06/776507116.jpg,,"(Bloomberg) Stocks and bonds dropped as investors grappled with rising oil prices, mounting bets on US interest rate hikes and a pullback in the artificial-intelligence trade.
THIS CONTENT IS RESERV… [+4976 chars]",,2026-06-12 21:42:53+00:00,wmo,Solomon Islands,EPO,Oceania
fdb5c7852a462413759d5807d429f72a,2026-06-08T09:00:00Z,Storm,Storm Pangnirtung,www.cbc.ca,en,0.3,"Warum Ihre nächste Hausratversicherungsprämie von Laserscans und nicht von vergangenen Bränden abhängen könnte. Versicherungsmathematiker und Versicherungsexperten sagen, dass Waldbrände nicht den historischen Mustern folgen und sich auf unerwartete Weise verhalten. Versicherer greifen zur Risikobewertung auf Vorhersagemodelle zurück.","Why your next home insurance premium could depend on laser scans, not past fires",Actuaries and insurance experts say wildfires are not following historical patterns and are behaving in unexpected ways. Insurers are turning to predictive models to assess risk.,"Why your next home insurance premium could depend on laser scans, not past fires. Actuaries and insurance experts say wildfires are not following historical patterns and are behaving in unexpected ways. Insurers are turning to predictive models to assess risk.","Cur proximo tuo premium assecurationis domus laseris scans, non ignibus praeteritis pendere potuit. Actuaria et assecurationis periti dicunt incendia ignium non sequentes exemplaria historica et vias inopinatas gerere. Insurers convertuntur ad exempla predictive aestimandi periculum.",https://www.cbc.ca/news/canada/nova-scotia/wildfire-risk-new-techniques-insurance-uninsurable-9.7194081,"https://i.cbc.ca/ais/1.6898603,1780684539768/full/max/0/default.jpg?im=Crop%2Crect%3D%28529%2C1157%2C2471%2C1389%29%3BResize%3D620",,"When Tricia Murray rebuilt her home in Hammonds Plains, N.S., after the devastating 2023 wildfires, she expected her insurance premiums to soar.
Her original house was purchased in 2017 for $253,000… [+2490 chars]",,2026-06-12 21:42:53+00:00,wmo,Canada,NEN,North-America
2aec9f8afb012d290a734b77f4ce4bd7,2026-06-08T13:00:57Z,Flood,Flooding New South Wales Hastings River,www.fairobserver.com,en,0.3,"Ein anderes Großbritannien innerhalb einer anderen EU in einer gefährlicheren Welt. „Es gibt eine Flut in den Angelegenheiten der Menschen, die, von der Flut erfasst, zum Glück führt; wenn sie ausgelassen wird, endet die ganze Reise ihres Lebens in Untiefen und in Elend. Auf solch einem vollen Meer schwimmen wir jetzt; und wir müssen die Strömung nehmen, wenn sie uns dient, oder unser Wagnis verlieren …",A Different UK Within a Different EU in a More Dangerous World,"“There is a tide in the affairs of menWhich, taken at the flood, leads on to fortune;Omitted, all the voyage of their lifeIs bound in shallows and in miseries.On such a full sea are we now afloat;And we must take the current when it serves,Or lose our venture…","A Different UK Within a Different EU in a More Dangerous World. “There is a tide in the affairs of menWhich, taken at the flood, leads on to fortune;Omitted, all the voyage of their lifeIs bound in shallows and in miseries.On such a full sea are we now afloat;And we must take the current when it serves,Or lose our venture…","A DIVERSIS UK Intra alia EU in Mundo Periculoso. “Astus est in rebus humanis, in diluvio ductus ad fortunam; Omissus, omnis navigatio vitae suae in vadis et miseriis tenetur. In tam pleno mari nunc fluctuamus;",https://www.fairobserver.com/region/europe/a-different-uk-within-a-different-eu-in-a-more-dangerous-world/,https://www.fairobserver.com/wp-content/uploads/2026/06/Eu.jpg,,"There is a tide in the affairs of menWhich, taken at the flood, leads on to fortune;Omitted, all the voyage of their lifeIs bound in shallows and in miseries.On such a full sea are we now afloat;And … [+16047 chars]",,2026-06-12 21:42:53+00:00,wmo,Australia,CAU,Oceania
7e8306f022e9df07bfae97c69cc1096f,2026-06-09T00:35:13Z,Flood,Flooding Andrew MO Buchanan MO,survivalblog.com,en,0.3,"Vorbereitungsfortschritt der Redaktion. Um auf eine Krise vorbereitet zu sein, muss jeder Prepper Ziele festlegen und sowohl langfristige als auch kurzfristige Pläne erstellen. In dieser Kolumne überprüfen die SurvivalBlog-Redakteure die Vorbereitungsaktivitäten ihrer Woche und die geplanten Vorbereitungsaktivitäten für die kommende Woche. Diese reichen von Gesundheit…",Editors’ Prepping Progress,"To be prepared for a crisis, every Prepper must establish goals and make both long-term and short-term plans. In this column, the SurvivalBlog editors review their week’s prep activities and planned prep activities for the coming week. These range from health…","Editors’ Prepping Progress. To be prepared for a crisis, every Prepper must establish goals and make both long-term and short-term plans. In this column, the SurvivalBlog editors review their week’s prep activities and planned prep activities for the coming week. These range from health…","Editorum Prepping Progressio. Ad crisim parandum, omnis Prepper proposita constituere debet et tum longum tempus et breve consilium statuere. In hac columna, editores SurvivalBlog actiones suas hebdomadae currere ac meditatum currere ad actiones proximae septimanae recognoscant. Haec vagarentur a salute…",https://survivalblog.com/2026/06/09/editors-prepping-progress-415/,https://survivalblog.com/wp-content/uploads/2025/06/Wallach_Shearing.jpg,,"To be prepared for a crisis, every Prepper must establish goals and make both long-term and short-term plans. In this column, the SurvivalBlog editors review their week’s prep activities and planned … [+8029 chars]",,2026-06-12 21:42:53+00:00,wmo,United States,CNA,North-America
8de41f5cbba37605af22d8c84c251ebd,2026-06-09T14:34:10Z,Flood,Flooding Vernon MO,www.cbc.ca,en,0.3,"Weitere Stürme auf dem Weg nach West-Manitoba wurden von Überschwemmungen heimgesucht. Dem überschwemmten Westen von Manitoba, wo Menschen auf Dächern festsaßen und Straßen weggeschwemmt wurden, könnte eine weitere Runde heftiger Regenfälle bevorstehen.",More storms heading to flood-hit western Manitoba,"Flooded western Manitoba, where people were stranded on rooftops and roads have been washed away, could be in for another round of heavy rain.","More storms heading to flood-hit western Manitoba. Flooded western Manitoba, where people were stranded on rooftops and roads have been washed away, could be in for another round of heavy rain.","Plures tempestates ad diluvium occidentale Manitoba tendentes. Inundata occidentalis Manitoba, ubi homines tectorum et viae abluti sunt, in alia pluviae rotundo esse potuerunt.",https://www.cbc.ca/news/canada/manitoba/flooding-western-manitoba-thunderstorms-9.7228176,"https://i.cbc.ca/ais/8595c48f-6fba-4ffa-9967-2b873aa24b76,1781014459965/full/max/0/default.jpg?im=Crop%2Crect%3D%280%2C245%2C2000%2C1125%29%3BResize%3D620",,"Flood-hit western Manitoba, where people were stranded on rooftops and roads have been washed away, could be in for another round of heavy rain.
""Unfortunately, today there is another significant se… [+2920 chars]",,2026-06-12 21:42:53+00:00,wmo,United States,CNA,North-America
dba015cbd6d19fad89f3e7bfa94d8c13,2026-06-09T16:59:41Z,Flood,Flood Chatanika River Valley,abcnews.com,en,0.3,ANSEHEN: Artemis-III-Astronauten für „komplexe“ NASA-Mission enthüllt. Nach Angaben der NASA wird Artemis III im Jahr 2027 in einer „komplexen“ Mission die Besatzung des Orion-Raumschiffs an der Spitze der Space Launch System-Rakete starten.,WATCH: Artemis III astronauts revealed for 'complex' NASA mission,"Artemis III will launch the crew in the Orion spacecraft on top of the Space Launch System rocket in 2027 in a ""complex"" mission, according to NASA.","WATCH: Artemis III astronauts revealed for 'complex' NASA mission. Artemis III will launch the crew in the Orion spacecraft on top of the Space Launch System rocket in 2027 in a ""complex"" mission, according to NASA.","VIG: Artemis III astronauta pro 'complexa' NASA missione revelata est. Artemis III in navi spatii Orionis nautas demittet in eruca Systema Spatii anno 2027 in missione ""complexa"", secundum NASA.",https://abcnews.com/video/133718039/,https://i.abcnewsfe.com/a/ef186df2-49ac-4b0b-9a8c-544d4f4eb64a/260609_abcnl_12p_artemis_hpMain_16x9.jpg?w=992,,"<ul><li>Trump says Iran shot down the US helicopter, vows response
</li><li>Trump insists peace deal with Iran is close
</li><li>Nick Reiner demands trust fund money, court filing shows
</li><li>I… [+4516 chars]",,2026-06-12 21:42:53+00:00,wmo,United States,CNA,North-America
982a4314e7c6e723caf5c4f1afae797f,2026-06-09T20:03:40Z,Precipitation,Downpour Anticosti,abcnews.com,en,0.3,ANSEHEN: Die Fortsetzung von „Romy und Micheles High School Reunion“ ist offiziell in Arbeit. Sophie Flay berichtet in den „GMA3“ Pop News über die angesagtesten Geschichten des Tages.,WATCH: 'Romy and Michele's High School Reunion' sequel officially in the works,"Sophie Flay reports the buzziest stories of the day in ""GMA3"" Pop News.","WATCH: 'Romy and Michele's High School Reunion' sequel officially in the works. Sophie Flay reports the buzziest stories of the day in ""GMA3"" Pop News.","VIG: 'Romy et Michael's High School Reunion' in operibus publice sequebantur. Sophia Flay historias diei in ""GMA3"" Pop News refert.",https://abcnews.com/video/133716959/,https://i.abcnewsfe.com/a/9ab478b5-4e24-4081-9b7f-82233f54cbd2/260609_gma3_pop_news_hpMain_16x9.jpg?w=992,,"<ul><li>U.S. launches 'self-defense' strikes against Iran, U.S. Central Command says 
</li><li>What led to the swift Karmelo Anthony verdict and what happens next
</li><li>What to know about the ne… [+4553 chars]",,2026-06-12 21:42:53+00:00,wmo,Canada,NEN,North-America
b14b2fa0972544263229770320d2f9c9,2026-06-09T22:53:29Z,Wildfire,Wildfire Chhattisgarh,punchng.com,en,0.3,48 Stunden vor der Eröffnungsfeier der Weltmeisterschaft blockieren Demonstranten die Straße zum mexikanischen Stadion. Nur 48 Stunden vor der Eröffnungsfeier der Weltmeisterschaft blockieren Demonstranten die Straße zum Azteca-Stadion in Mexiko-Stadt. Erfahren Sie mehr über die laufenden Demonstrationen. Lesen Sie mehr: https://punchng.com/48-hours-to-world-cup-opening-ceremony-protesters-block-road-to-mexican…,"48 hours to World Cup opening ceremony, protesters block road to Mexican stadium","Just 48 hours before the World Cup opening ceremony, protesters block the road to Mexico City’s Azteca Stadium. Learn more about the ongoing demonstrations

Read More: https://punchng.com/48-hours-to-world-cup-opening-ceremony-protesters-block-road-to-mexican…","48 hours to World Cup opening ceremony, protesters block road to Mexican stadium. Just 48 hours before the World Cup opening ceremony, protesters block the road to Mexico City’s Azteca Stadium. Learn more about the ongoing demonstrations

Read More: https://punchng.com/48-hours-to-world-cup-opening-ceremony-protesters-block-road-to-mexican…","XLVIII horas ad Mundus Calicem caerimoniam aperiendam, cessores viam ad stadium Mexicanum intercludunt. Mox 48 horis ante Trophaeum Mundialem caerimoniam aperiendam, cessores viam ad Stadium Mexicanum in urbe Azteca claudunt. Plura de demonstrationibus permanentibus legere More: https://punchng.com/48-hours-to-world-cup-opening-ceremony-protesters-block-road-to-mexican...",https://punchng.com/?p=2162102,https://cdn.punchng.com/wp-content/uploads/2016/10/17155511/punchlogo.png,,"Thousands of demonstrators blocked an avenue leading to Mexico City’s Azteca Stadium on Tuesday, just days before the 2026 World Cup kicks off at the venue.
As football fans flood into tournament co… [+2428 chars]",,2026-06-12 21:42:53+00:00,wmo,India,SAS,Asia
d9194c785b6240cba17fe956572cccd9,2026-06-10T08:28:34Z,Snow&Ice,Snow United States,the-gadgeteer.com,en,0.3,"Die 21-Dollar-Taschenlampe, die alles in Ihrer Schublade ersetzen möchte. Die meisten EDC-Taschenlampen lösen eine Aufgabe gut und entschuldigen sich für den Rest. Sie tragen das helle Gerät für Distanzen, das UV-Gerät für Reisen, das rote Gerät für Camping und den Laser in einer Schublade, die Sie selten öffnen. Die in diesem System verankerte Annahme ist, dass kein einziger…",The $21 Flashlight That Wants to Replace Everything in Your Drawer,"Most EDC flashlights solve one job well and apologize for the rest. You carry the bright one for distance, the UV one for travel, the red one for camping, and the laser lives in a drawer you rarely open. The assumption baked into that system is that no single…","The $21 Flashlight That Wants to Replace Everything in Your Drawer. Most EDC flashlights solve one job well and apologize for the rest. You carry the bright one for distance, the UV one for travel, the red one for camping, and the laser lives in a drawer you rarely open. The assumption baked into that system is that no single…","In $21 Flashlight Quod omnia in tuo Drawer reficere vult. Most EDC flashlights unum solvere officium bene et veniam reliquis. Claram ad distantiam portas, UV unam ad iter, rubram ad castra, et laser vivit in perscriptorem rarius apertum. Assumptio in ista ratio coquitur quod nulla una…",https://the-gadgeteer.com/2026/06/10/vezerlezer-wk2-5-in-1-edc-flashlight-for-21-on-kickstarter/,https://the-gadgeteer.com/wp-content/uploads/2026/06/Vezerlezer-WK2-EDC-Flashlight-Lifestyle.jpg,,"If you buy something from a link in this article, we may earn a commission. Learn more
Most EDC flashlights solve one job well and apologize for the rest. You carry the bright one for distance, the … [+5187 chars]",,2026-06-12 21:42:53+00:00,wmo,United States,CNA,North-America
1baba769ed1c9d44b51ef8b7374b165f,2026-06-10T11:12:00Z,Precipitation,Precipitation Westland south of Hokitika,www.dw.com,en,0.3,"Möglicherweise steht der stärkste El Niño seit mehr als einem Jahrhundert bevor. Warnungen vor einem starken El Niño-Wetterphänomen in diesem Jahr deuten darauf hin, dass uns möglicherweise Dürre, Überschwemmungen und extreme Hitze bevorstehen. Welche Auswirkungen sind zu erwarten? Und können wir uns auf das Schlimmste vorbereiten?",The strongest El Nino in more than a century may be coming,"Warnings of a powerful El Nino weather pattern this year suggest that we may be about to face drought, flooding and extreme heat. What impacts are in store? And can we prepare for the worst of it?","The strongest El Nino in more than a century may be coming. Warnings of a powerful El Nino weather pattern this year suggest that we may be about to face drought, flooding and extreme heat. What impacts are in store? And can we prepare for the worst of it?","Fortissimum El Nino in plus quam saeculum potest venire. Admonitiones potentis Tempestatis El Nino hoc anno suggerunt ut siccitati, inundationis et caloris nimii incipiendi simus. Quid confligant in copia? Et parabimus ad pessimum?",https://www.dw.com/en/what-to-expect-from-el-nino-climate-pattern-influence-global-weather/a-77469489,https://static.dw.com/image/69416648_6.jpg,,A potentially powerful El Nino developing in the Pacific Ocean could reshape weather patterns around the world in the coming weeks. Forecasters that warn this could be among the strongest El Nino eve… [+5847 chars],,2026-06-12 21:42:53+00:00,wmo,New Zealand,NZ,Oceania
6d96278dc9114adcbd21101682731ea4,2026-06-10T15:20:47Z,Flood,Flooding India,www.cbc.ca,en,0.3,"Gemeinde in der Nähe von Pemberton ist zum dritten Mal in Folge von einem Gletscherseeausbruch bedroht. Zwei Dutzend Grundstücke nordwestlich von Pemberton, B.C., stehen weiterhin in Evakuierungsalarm, da Experten einen nahegelegenen Gletschersee überwachen, der ihrer Meinung nach fast seine maximale Kapazität erreicht hat.",Community near Pemberton facing threat of glacial lake outburst for 3rd year in a row,"Two dozen properties northwest of Pemberton, B.C., remain under evacuation alert as experts monitor a nearby glacial lake that they say is close to its maximum capacity.","Community near Pemberton facing threat of glacial lake outburst for 3rd year in a row. Two dozen properties northwest of Pemberton, B.C., remain under evacuation alert as experts monitor a nearby glacial lake that they say is close to its maximum capacity.","Communitas prope Pemberton contra comminationem lacus glacialis per 3 annum in ordine erupit. Duae duodenarum proprietatum ad septentrionem urbis Pemberton, BC, sub evacuatione vigilantes manent ut periti monitorem prope lacum glacialem quem dicunt prope maximam capacitatem eius esse.",https://www.cbc.ca/news/canada/british-columbia/threat-of-glacier-lake-outburst-from-place-glacier-9.7228895,"https://i.cbc.ca/ais/41721c7b-f5f3-4f31-bc67-abf3144a8439,1781103025568/full/max/0/default.jpg?im=Crop%2Crect%3D%280%2C0%2C1920%2C1080%29%3BResize%3D620",,"Experts say it's only a matter of time before a glacial lake near Pemberton, B.C., bursts again, unleashing flood waters on the surrounding area.
Two dozen properties in the Poole Creek and Gates La… [+4368 chars]",,2026-06-12 21:42:53+00:00,wmo,India,SAS,Asia
