index,published,topic,term,domain,language,valid,de,title,description,en,la,url,image,archive,content,quote,added,feed,country,ipcc,continent
0490dd816b2f6a9fa23c0747e293dd30,2026-05-02T05:00:00Z,Heat Wave,Heat Wave India,www.irishtimes.com,en,0.2,"Harry Byrne: „Alles, was ich tun wollte, war zurückzukommen und an Wettkämpfen teilzunehmen und einen fairen Sprung zu machen.“ Der 27-Jährige spricht über seine Bindung zu seinem Bruder Ross, seine Leihe in Bristol und seine Entschlossenheit, die Gelegenheit zu nutzen, die sich ihm am Samstag bietet, wenn er für Leinster gegen Toulon starten wird","Harry Byrne: ‘All I wanted to do was come back and compete, have a fair crack’","The 27-year-old discusses his bond with his brother Ross, his loan spell in Bristol and his determination to earn the opportunity coming his way on Saturday, when he is to start for Leinster against Toulon","Harry Byrne: ‘All I wanted to do was come back and compete, have a fair crack’. The 27-year-old discusses his bond with his brother Ross, his loan spell in Bristol and his determination to earn the opportunity coming his way on Saturday, when he is to start for Leinster against Toulon","Harrius Byrne: ""Omnes facere volui et redierunt certatim, rimam bonam habent"". XXVII annorum tractat de vinculo suo cum fratre Ross, de carmine suo apud Bristollium, et propositum est occasionem merendi viam ingrediendi Sabbati, cum Lageniae contra Toulon committitur.",https://www.irishtimes.com/sport/rugby/2026/05/02/harry-byrne-all-i-wanted-to-do-was-come-back-and-compete-have-a-fair-crack/,https://www.irishtimes.com/resizer/v2/RBJROKHAYW5ZGTRWZDQN662T6I.jpg?smart=true&auth=29257ffabd6b9b6442d7a5a14747a2424114ea6381661e15e957203202844479&width=1200&height=630,,"Finally. Hes had more than his share of slings and arrows. Hes had to take a detour and hes had to bide his time. But now, in his seventh season as a Leinster outhalf, and having just turned 27, Harr… [+10415 chars]",,2026-05-07 07:42:29+00:00,wmo,India,SAS,Asia
8c0b83e7031c9bc43c36627676e5ab2f,2026-05-02T16:30:48Z,Storm,Storm Taranaki and Wanganui,www.themarginalian.org,en,0.2,"Das wollende Monster: Eine zarte moderne Fabel über die schwierige Kunst, am stillen Punkt des Genugs auszuruhen. Wollen ist die bedrohliche Fehlergrenze zwischen Wunsch und Bedürfnis. Es ist die Klinge, die Ihre Gelassenheit lebendig macht, der Hammer, der Ihre Ganzheit zerschmettert – wenn Sie etwas wollen, halten Sie Ihr Leben ohne etwas für unvollständig. Es ist ein Perpetuum mobile, das Sie auf Trab hält.",The Wanting Monster: A Tender Modern Fable about the Difficult Art of Resting at the Still Point of Enough,"Wanting is the menacing margin of error between desire and need. It is the blade that vivisects your serenity, the hammer that shatters your wholeness — to want anything is to deem your life incomplete without it. It is a perpetual motion machine that keeps y…","The Wanting Monster: A Tender Modern Fable about the Difficult Art of Resting at the Still Point of Enough. Wanting is the menacing margin of error between desire and need. It is the blade that vivisects your serenity, the hammer that shatters your wholeness — to want anything is to deem your life incomplete without it. It is a perpetual motion machine that keeps y…","The Wanting Monster: A tender Modern Fable about the Art of difficult resting at the still point of enough. Deesse est inter cupiditatem et necessitatem minitantis erroris margo. Ferrum est quod serenitatem vestram vivificet, malleus qui totam rem tuam frangit, velle aliquid est vitam tuam incompletam sine eo putare. Motus perpetuus machina est quae y…",https://www.themarginalian.org/2026/05/02/the-wanting-monster/,https://www.themarginalian.org/wp-content/uploads/2025/05/thewantingmonster0.jpg?fit=1200%2C630&ssl=1,,"Wanting is the menacing margin of error between desire and need. It is the blade that vivisects your serenity, the hammer that shatters your wholeness — to want anything is to deem your life incomple… [+7557 chars]",,2026-05-07 07:42:29+00:00,wmo,New Zealand,NZ,Oceania
9e3dd6fad7b212709a715406a24640bb,2026-05-06T05:49:42Z,Snow&Ice,Snow Australia,www.abc.net.au,en,0.8,"Schnee, Regen und eisige Winde werden vorhergesagt, während die Polarexplosion den Südosten Australiens trifft. Eine winterliche Mischung aus Schnee, eisigen Temperaturen und Schauern wird den Südosten Australiens treffen und der jüngsten Serie warmen Herbstwetters ein jähes Ende setzen.","Snow, rain, icy winds forecast as polar blast hits south-east Australia","A wintry mix of snow, icy temperatures, and showers is set to hit Australia's south-east, bringing a sharp end to the recent run of warm autumn weather.","Snow, rain, icy winds forecast as polar blast hits south-east Australia. A wintry mix of snow, icy temperatures, and showers is set to hit Australia's south-east, bringing a sharp end to the recent run of warm autumn weather.","Nives, pluviae, venti gelidi praenuntiant sicut flatus polaris Austro-orientalis Australia pervenit. Hiemalis mixtura nivis, temperaturae gelidae, et imbres Australiae meridiem-orientalem feriendi positum est, acrem finem afferens ad recentem tempestatem autumni calidae currendi.",https://www.abc.net.au/news/2026-05-06/snow-cold-forecast-south-eastern-australia-may/106645038,https://live-production.wcms.abc-cdn.net.au/edabd6fb620ab06f317920c715fc5763?impolicy=wcms_watermark_news&cropH=1152&cropW=2048&xPos=0&yPos=108&width=862&height=485&imformat=generic,,"Snow as low as 500 metres is forecast to fall across three states on Wednesday and into Thursday, as a blast of polar air sweeps across the south-east of the country.
A significant cold front is set… [+5390 chars]",,2026-05-07 07:42:29+00:00,wmo,Australia,CAU,Oceania
32c410d710e5a182683aaae37c9e140b,2026-05-01T18:00:00Z,Fog,Fog United States,www.bikeexif.com,en,0.2,"Flashback Friday: Top 8 Harley Davidsons des Jahres 2020. Das Jahr 2020 war ein turbulentes Jahr für die Welt, aber für die Custom-Motorradszene war es ein Jahr konzentrierter, hochkarätiger Handwerkskunst. Während die globale Pandemie das Tempo des Lebens verlangsamte, gab sie den Bauherren die Einsamkeit, die sie brauchten, um ihre Kunst zu verfeinern.",Flashback Friday: Top 8 Harley Davidsons of 2020,"The year 2020 was a tumultuous one for the world, but for the custom motorcycle scene, it was a year of focused, high-caliber craftsmanship. While the global pandemic slowed the pace of life, it gave builders the solitude they needed to refine their art.In th…","Flashback Friday: Top 8 Harley Davidsons of 2020. The year 2020 was a tumultuous one for the world, but for the custom motorcycle scene, it was a year of focused, high-caliber craftsmanship. While the global pandemic slowed the pace of life, it gave builders the solitude they needed to refine their art.In th…","Flashback Veneris: Top 8 Harley Davidsons anni 2020. Annus 2020 tumultuosus erat pro mundo, sed pro more scaenae motorcycli, annus focused, summus calliditate artis. Cum pandemicus globalis gressum vitae retardavit, aedificatoribus solitudinem quam opus erat ad suam artem excolendam dedit. In th…",https://www.bikeexif.com/top-8-harley-davidsons-of-2020,https://images.bikeexif.com/2020/04/_1200x630_crop_center-center_82_none/softail-bobber-rough-crafts.jpg?v=1775765722,,"The year 2020 was a tumultuous one for the world, but for the custom motorcycle scene, it was a year of focused, high-caliber craftsmanship. While the global pandemic slowed the pace of life, it gave… [+8701 chars]",,2026-05-07 11:46:41+00:00,wmo,United States,CNA,North-America
17fda447b48e3c1fda049ca5b30f01c2,2026-05-04T00:24:44Z,Precipitation,Rain ALL provinces,indianexpress.com,en,0.2,"Shankar Prasad Sharma bei Idea Exchange: „Nepal möchte seine außenpolitischen Beziehungen ausbalancieren, weil wir alle unsere Freunde brauchen.“ Shankar Prasad Sharma ist seit vier Jahren Botschafter Nepals in Indien. Als Spitzenakademiker und einer der führenden Ökonomen Nepals war er stellvertretender Vorsitzender der nepalesischen Planungskommission und fungierte auch als nepalesischer Botschafter in den USA während der …",Shankar Prasad Sharma at Idea Exchange: ‘Nepal would like to balance its foreign policy relationship because we need all our friends’,"Shankar Prasad Sharma has been the ambassador of Nepal to India for the last four years. A top academic and one of Nepal’s foremost economists, he was the Vice Chairman of Nepal’s Planning Commission and also served as Nepal’s ambassador to the US during the …","Shankar Prasad Sharma at Idea Exchange: ‘Nepal would like to balance its foreign policy relationship because we need all our friends’. Shankar Prasad Sharma has been the ambassador of Nepal to India for the last four years. A top academic and one of Nepal’s foremost economists, he was the Vice Chairman of Nepal’s Planning Commission and also served as Nepal’s ambassador to the US during the …","Shankar Prasad Sharma ad Ideam Exchange: ""Nepalus se similis rationi suo alieno consilio aequare vult quod omnibus amicis nostris indigemus"". Shankar Prasad Sharma legatus Nepalini Indiae proximis quattuor annis fuit. Suprema academica et unus e primoribus economistarum Nepal, erat Vice Praeses Commissionis Nepalensis et etiam legatus Nepali ad US in ... functus est.",https://indianexpress.com/article/idea-exchange/shankar-prasad-sharma-at-idea-exchange-nepal-would-like-to-balance-its-foreign-policy-relationship-because-we-need-all-our-friends-10671159/,https://images.indianexpress.com/2026/05/Idea-Exchange-Dr.-Shankar-Prasad-Sharma.jpg,,"Shankar Prasad Sharma, outgoing Ambassador of Nepal to India, on the churn in Nepal and what led to the Gen Z uprising, Nepals bilateral ties with India, and navigating the politics of water and boun… [+16382 chars]",,2026-05-07 11:46:41+00:00,wmo,Solomon Islands,EPO,Oceania
8c2af25d50840ec0223c2c214f7c3184,2026-05-05T22:54:20Z,Flood,Flood Calhoun IL Pike MO,www.vox.com,en,0.2,"Wie ein „Super-El Niño“ zu einer rekordverdächtigen Erwärmung führen könnte. Diese Geschichte wurde ursprünglich von Inside Climate News veröffentlicht und wird hier im Rahmen der Zusammenarbeit mit Climate Desk wiedergegeben. Der Pazifische Ozean ist ein riesiger Klimakessel mit einer leistungsstarken Wärmemaschine, die Stürme, Fischerei und Niederschlagsmuster zur Hälfte beeinflusst …",How a “super El Niño” could create record-breaking warming,"This story was originally published by Inside Climate News and is reproduced here as part of the Climate Desk collaboration. The Pacific Ocean is a giant climate cauldron, with a powerful heat engine that affects storms, fisheries, and rainfall patterns half …","How a “super El Niño” could create record-breaking warming. This story was originally published by Inside Climate News and is reproduced here as part of the Climate Desk collaboration. The Pacific Ocean is a giant climate cauldron, with a powerful heat engine that affects storms, fisheries, and rainfall patterns half …","Quomodo ""super El Niño"" recordum fractionis calefactionis creare potuit. Haec narratio primum ab Inside Clima News divulgata est et hic ut pars collaborationis Climatis Desk exprimitur. Oceanus Pacificus est ingens aeni climatis, cum tormento calore valido, quod tempestates, piscationes et pluvias formas media ... afficit.",https://www.vox.com/climate/487891/super-el-nino-record-breaking-warming-climate-pacific,https://platform.vox.com/wp-content/uploads/sites/2/2026/05/gettyimages-2176775395.jpg?quality=90&strip=all&crop=0%2C10.726170651738%2C100%2C78.547658696523&w=1200,,"Yagua Indigenous people carrying water and goods due to the low level of the Amazon River in Colombia, in October 2024. | Luis Acosta/AFP via Getty Images


This story was originally published by In… [+7978 chars]",,2026-05-07 11:46:41+00:00,wmo,United States,CNA,North-America
d8ec03b3182614843fc57c418c7a5bdb,2026-05-02T11:05:00Z,Flood,Flashflood Pike IL Pike MO,www.coolcatteacher.com,en,0.3,"Real World STEM: Echte Werkzeuge, echte Kunden, echtes Geld. Aus dem Cool Cat-Lehrerblog von Vicki Davis Abonnieren Sie den 10-minütigen Lehrer-Podcast überall dort, wo Sie Podcasts hören.
Wie sieht die MINT-Ausbildung in der realen Welt an einer High School aus, wo die Schüler echte Produktionsverträge abschließen, ein Praktikum am MIT absolvieren und … verdienen?","Real World STEM: Real Tools, Real Clients, Real Money","From the Cool Cat Teacher Blog by Vicki Davis Subscribe to the 10 Minute Teacher Podcast anywhere you listen to podcasts.
What does real world STEM education look like in a high school where students run actual manufacturing contracts, intern at MIT, and earn…","Real World STEM: Real Tools, Real Clients, Real Money. From the Cool Cat Teacher Blog by Vicki Davis Subscribe to the 10 Minute Teacher Podcast anywhere you listen to podcasts.
What does real world STEM education look like in a high school where students run actual manufacturing contracts, intern at MIT, and earn…","Real World STEM: Real Tools, Real Clients, Real Money. From the Cool Cat Teacher Blog by Vicki Davis Subscribe to the 10 Minute Teacher Podcast usquam audis podcasts. Quid realem mundi STEM educationem simile in alta schola ubi discipuli currunt actuales contractus fabricandi, interne ad MIT et earn…",https://www.coolcatteacher.com/e933/,https://www.coolcatteacher.com/wp-content/uploads/2026/05/933-graphic-version2-realworldstem.png,,"Sometimes there are conversations that need to be had. This is one of those. I sat down with Joe Fatheree and Dr. Mark Buckner two leading innovators in the space of STEM, AI, and helping high school… [+48442 chars]",,2026-05-07 11:46:41+00:00,wmo,United States,CNA,North-America
6a6ddc7dfbce5298497fab9ab5a5422a,2026-05-01T19:57:32Z,Cold Wave,cold weather Queensland,clarkesworldmagazine.com,en,0.2,Aly von Grace Chan. Teil 1: 2075 sagte Aly. Xavi joggte aus seinem Mietshaus. Er schloss sich dem Strom der Mittagsläufer an […],Aly by Grace Chan,Part 1: 2075 said Aly. Xavi jogged out of his tenement building. He joined the stream of lunchtime runners […],Aly by Grace Chan. Part 1: 2075 said Aly. Xavi jogged out of his tenement building. He joined the stream of lunchtime runners […],Aly Dei Gratia Chan. Pars 1: 2075 dixit Aly. Xavi lenteque de tenemento suo aedificando. Flumen prandii cursoribus copulavit […],https://clarkesworldmagazine.com/chan_05_26/,https://clarkesworldmagazine.com/covers/cw_236_800.jpg?3,,"Part 1: 2075
&lt;It might be good for you to take a new route,&gt; said Aly.
Xavi jogged out of his tenement building. He joined the stream of lunchtime runners pounding the flagstones of the river… [+53748 chars]",,2026-05-07 16:49:17+00:00,acwe,Australia,CAU,Oceania
d3c42bb04e0832392bfe14e9916bd6c3,2026-05-05T20:30:00Z,Snow&Ice,Freezing Qikiqtarjuaq,www.prnewswire.com,en,0.3,"Bristow Group gibt Ergebnisse für das erste Quartal 2026 bekannt. HOUSTON, 5. Mai 2026 /PRNewswire/ -- Highlights des ersten Quartals: Gesamtumsatz von 388,7 Millionen US-Dollar im ersten Quartal 2026 im Vergleich zu 377,3 Millionen US-Dollar im vierten Quartal 2025. Nettogewinn von 13,1 Millionen US-Dollar oder 0,44 US-Dollar pro verwässerter Aktie im ersten Quartal 2026 im Vergleich zu einem Nettogewinn von 18,4 Millionen US-Dollar oder 0,6 US-Dollar.",Bristow Group Reports First Quarter 2026 Results,"HOUSTON, May 5, 2026 /PRNewswire/ -- First Quarter Highlights Total revenues of $388.7 million in Q1 2026 compared to $377.3 million in Q4 2025 Net income of $13.1 million, or $0.44 per diluted share, in Q1 2026 compared to net income of $18.4 million, or $0.…","Bristow Group Reports First Quarter 2026 Results. HOUSTON, May 5, 2026 /PRNewswire/ -- First Quarter Highlights Total revenues of $388.7 million in Q1 2026 compared to $377.3 million in Q4 2025 Net income of $13.1 million, or $0.44 per diluted share, in Q1 2026 compared to net income of $18.4 million, or $0.…","Bristow Group Renuntiationes Primae Quartae MMXVI Proventus. HOUSTON, V Maii 2026 /PRNewswire/ -- Prima Quarta Highlights Total vectigalia $388.7 decies centena in Q1 2026 comparata sunt $377.3 decies centena in Q4 2025 Net reditus $13.1 decies centena millia, vel $0,44 per dilutum portionem, in Q1 2026 comparati ad retia reditus $ 18.4 decies centena millia, aut $0...",https://www.prnewswire.com/news-releases/bristow-group-reports-first-quarter-2026-results-302763213.html,https://mma.prnewswire.com/media/1427443/Bristow_Group_Logo.jpg?p=facebook,,"HOUSTON, May 5, 2026 /PRNewswire/ -- 
First Quarter Highlights
<ul><li>Total revenues of $388.7 million in Q1 2026 compared to $377.3 million in Q4 2025</li><li>Net income of $13.1 million, or $0.4… [+66346 chars]",,2026-05-09 15:51:47+00:00,wmo,Canada,NEN,North-America
3945cd75d3badaeb80207a4b60a63ca7,2026-05-08T10:05:17Z,Snow&Ice,Ice New Zealand,punchng.com,en,0.3,"NEMA gibt vor der Regenzeit eine Überschwemmungswarnung für die Einwohner von Kebbi heraus. NEMA hat für die Regenzeit 2026 eine Kebbi-Überschwemmungswarnung herausgegeben und die Bewohner von Hochrisikogebieten gewarnt, sich auf mögliche Überschwemmungen und Evakuierungen vorzubereiten. Lesen Sie mehr: https://punchng.com/nema-issues-kebbi-residents-flood-alert-ahead-of-rainy-season/",NEMA issues Kebbi residents flood alert ahead of rainy season,"NEMA has issued a Kebbi flood alert for the 2026 rainy season, warning residents of high-risk areas to prepare for potential flooding and evacuation.

Read More: https://punchng.com/nema-issues-kebbi-residents-flood-alert-ahead-of-rainy-season/","NEMA issues Kebbi residents flood alert ahead of rainy season. NEMA has issued a Kebbi flood alert for the 2026 rainy season, warning residents of high-risk areas to prepare for potential flooding and evacuation.

Read More: https://punchng.com/nema-issues-kebbi-residents-flood-alert-ahead-of-rainy-season/","NEMA quaestiones Kebbi incolas diluvii intenti ante tempus pluviosum. NEMA diluvium Kebbi diluvium ad 2026 tempus pluviosum intentum edixit, incolas periculorum regionum summus monens ut potentiae inundationes et evacuationes praepararent.

Lege More: https://punchng.com/nema-issues-kebbi-residents-flood-alert-ahead-of-rainy-season/",https://punchng.com/nema-issues-kebbi-residents-flood-alert-ahead-of-rainy-season/,https://cdn.punchng.com/wp-content/uploads/2020/05/21151952/National-Emergency-Management-Agency-NEMA.jpg,,"The National Emergency Management Agency has alerted residents of Kebbi State to possible flooding and other weather-related hazards ahead of the 2026 rainy season.
The warning followed projections … [+3467 chars]",,2026-05-09 15:51:47+00:00,wmo,New Zealand,NZ,Oceania
caab4136c7ebd5f28a9ae65c5a284a8e,2026-05-01T15:45:09Z,Flood,Flood Parke IN Vermillion IN Vigo IN,gizmodo.com,en,0.2,"Der Mai bringt den Frühsommer in den Westen, während der Osten friert. Sowohl im Osten als auch im Westen sind im Mai ungewöhnliche Temperaturtrends zu verzeichnen, allerdings in entgegengesetzte Richtungen.",May to Bring Early Summer to the West While the East Freezes,"Both the East and West are in for unseasonable May temperature trends, but in opposite directions.","May to Bring Early Summer to the West While the East Freezes. Both the East and West are in for unseasonable May temperature trends, but in opposite directions.","May to bring early summer to the west, dum Eurus constringit. Tam Oriens quam Occidens in intempestivo Maio trends temperaturas sunt, sed in partes contrarias.",https://gizmodo.com/may-to-bring-early-summer-to-the-west-while-the-east-freezes-2000753204,https://gizmodo.com/app/uploads/2026/05/National-temp-outlook-May-8-14-1200x675.jpg,,"May typically ushers in mild, pleasant weather, but perhaps not this year. Two starkly different, but equally unseasonable temperature trends will split the U.S. this month, potentially worsening dro… [+3075 chars]",,2026-05-10 11:00:20+00:00,wmo,United States,CNA,North-America
de33639d7b44a41f8087a36536adbb13,2026-05-04T14:00:00Z,Fog,Fog Canada,journals.plos.org,en,0.2,"KAT6A ist für die Expression von Entwicklungskontrollgenen in neuralen Stamm- und Vorläuferzellen essentiell. Zusammenfassung des Autors Während der Embryonalentwicklung bestimmen bestimmte Familien von Transkriptionsfaktoren den frühen Embryo, um die Körper- und Organstruktur festzulegen und zu definieren. Allerdings sind die Mechanismen, die den Beginn des Ausdrucks dieser Entwicklungstranskriptionen steuern…",KAT6A is essential for developmental control gene expression in neural stem and progenitor cells,"Author summary During embryonic development, specific families of transcription factors pattern the early embryo to lay down and define the body and organ structure. However, the mechanisms governing the onset of the expression of these developmental transcri…","KAT6A is essential for developmental control gene expression in neural stem and progenitor cells. Author summary During embryonic development, specific families of transcription factors pattern the early embryo to lay down and define the body and organ structure. However, the mechanisms governing the onset of the expression of these developmental transcri…","KAT6A essentialis est expressionis generum progressus in potestate neurali in caule et cellulis progenitoris. Auctor summatim Per embryonalem evolutionem, propriae familiae factores transcriptionis formant primo embryonem ad corpus et organum structuram deponendam et definiendam. Nihilominus, machinae gubernantes impetum expressionis harum transcri- tionum developmentalium.",https://journals.plos.org/plosgenetics/article?id=10.1371/journal.pgen.1012133,https://journals.plos.org/plosgenetics/article/figure/image?id=10.1371/journal.pgen.1012133.g006&size=inline,,"Citation: Voss AK, Eccles S, Wichmann J, Abeysekera W, Bergamasco MI, Garnham AL, et al. (2026) KAT6A is essential for developmental control gene expression in neural stem and progenitor cells. PLoS … [+70651 chars]",,2026-05-10 11:00:20+00:00,wmo,Canada,NEN,North-America
e0aff35cc85a7a04d0926a06c9f320a7,2026-05-05T13:15:59Z,Precipitation,Precipitation Auckland and Great Barrier Island,whyevolutionistrue.com,en,0.2,"Tierfotos der Leser. Die heutigen Fotos stammen von Leser Jan Malik, der Wildblumen in den Catskills fotografiert hat. Jans Fotos und Ausweise sind eingerückt und können durch Anklicken vergrößert werden. Während meiner letzten Wanderung in den Catskills, in der Nähe von Woodstock, NY, entdeckte ich etwas Frühlingsfluss …",Readers’ wildlife photos,"Today’s photos come from reader Jan Malik, who took pictures of wildflowers in the Catskills. Jan’s photos and IDs are indented, and you can enlarge them by clicking on them. During my recent hike in the Catskills, near Woodstock, NY, I found some spring flow…","Readers’ wildlife photos. Today’s photos come from reader Jan Malik, who took pictures of wildflowers in the Catskills. Jan’s photos and IDs are indented, and you can enlarge them by clicking on them. During my recent hike in the Catskills, near Woodstock, NY, I found some spring flow…","Lectorum imagines truculenter. Hodiernae imagines ab lectore Jan Malik veniunt, qui imagines flosculorum in Catskills sumpsit. Imagines Ian et IDs incisae sunt, easque strepitando in illis augere potes. In recenti hike in Catskills, prope Wodestok, NY, inveni fontem quendam…",https://whyevolutionistrue.com/2026/05/05/readers-wildlife-photos-2594/,https://whyevolutionistrue.com/wp-content/uploads/2026/05/14.jpg,,"Today’s photos come from reader Jan Malik, who took pictures of wildflowers in the Catskills. Jan’s photos and IDs are indented, and you can enlarge them by clicking on them.
During my recent hike i… [+4445 chars]",,2026-05-10 11:00:20+00:00,wmo,New Zealand,NZ,Oceania
