index,published,topic,term,domain,language,valid,de,title,description,en,la,url,image,archive,content,quote,added,feed,country,ipcc,continent
1ab2c59a39446f85a28df7c21457b667,2026-05-07T17:51:13Z,Drought,Drought Namibia,www.businessinsider.com,en,0.2,"Ich habe es geliebt, in Florida zu leben. Die Naturkatastrophen und die ständigen Überschwemmungen haben mich vertrieben. Nachdem Lorraine English im Jahr 2024 mehrere Hurrikane erlebt hatte, wusste sie, dass sie Florida verlassen musste. Sie ist nach Asheville, North Carolina, gezogen und ist glücklicher.",I loved living in Florida. The natural disasters and constant flooding drove me out.,"After enduring back-to-back hurricanes in 2024, Lorraine English knew she had to leave Florida. She moved to Asheville, North Carolina, and is happier.","I loved living in Florida. The natural disasters and constant flooding drove me out.. After enduring back-to-back hurricanes in 2024, Lorraine English knew she had to leave Florida. She moved to Asheville, North Carolina, and is happier.","Vivens in Florida amavi. Clades naturales et assidua inundatio me expulit.. Post diuturnos turbines anno 2024, Lotharingia Anglica scivit se Floridam relinquere. Ashevillam, Carolinam Septentrionalem movit, et beatior est.",https://www.businessinsider.com/left-florida-hurricanes-flooding-moved-to-north-carolina-2026-5,https://i.insider.com/69f8d7ea9a23d20d291b6190?width=1200&format=jpeg,,"Homes in Bradenton, Florida.zimmytws/Getty Images
<ul><li>Lorraine English, 72, loved living in Florida, but hurricanes made life there difficult.</li><li>In 2025, she moved from Bradenton — a city … [+5681 chars]",,2026-05-10 20:44:37+00:00,edo,Namibia,WSAF,Africa
beceadceac87083a04fb61c1bb534a14,2026-05-07T22:41:51Z,Flood,Flashflood Chelan WA,variety.com,en,0.2,"Die Anwälte von Taylor Swift schlagen in der Markenrechtsklage zurück und nennen die Verletzungsvorwürfe des Ex-Vegas-Showgirls „absurd“. Die Anwälte von Taylor Swift haben eine Klage eines ehemaligen Showgirls aus Las Vegas zurückgewiesen, die behauptet, dass der Albumtitel „The Life of a Showgirl“ des Pop-Superstars ihr Markenzeichen für den Satz „Confessions of a Showgirl“ verletze. Die Anwälte nennen die a…","Taylor Swift’s Attorneys Fire Back in Trademark Lawsuit, Calling Ex-Vegas Showgirl’s Claims of Infringement ‘Absurd’",Taylor Swift’s attorneys have slapped back at a lawsuit filed by a former Las Vegas showgirl who claims that the pop superstar’s “The Life of a Showgirl” album title infringes on her trademark for the phrase “Confessions of a Showgirl.” The lawyers call the a…,"Taylor Swift’s Attorneys Fire Back in Trademark Lawsuit, Calling Ex-Vegas Showgirl’s Claims of Infringement ‘Absurd’. Taylor Swift’s attorneys have slapped back at a lawsuit filed by a former Las Vegas showgirl who claims that the pop superstar’s “The Life of a Showgirl” album title infringes on her trademark for the phrase “Confessions of a Showgirl.” The lawyers call the a…","Taylor Swift's Attorney Ignem Back in Trademark Causam, Ex Vegas Vocans Showgirl's Clamationis Infringement 'Absurd'. Taylor Swift attornatos in lite oblatam a priore Las Vegas showgirl inceptam reddiderunt qui affirmat pop superstar scriptoris ""Vitae Showgirl"" album titulum infringere in eius trademark pro locutione ""Confessionis Showgirl."" Iurisperiti vocant a…",https://variety.com/2026/music/news/taylor-swift-attorneys-fire-back-trademark-lawsuit-showgirl-1236741122/,https://variety.com/wp-content/uploads/2025/08/538429520_1326293905529091_8265958371857620387_n-e1756152870692.jpg?w=1000&h=563&crop=1,,Taylor Swift‘s attorneys have slapped back at a lawsuit filed by a former Las Vegas showgirl who claims that the pop superstar’s “The Life of a Showgirl” album title infringes on her trademark for th… [+6018 chars],,2026-05-10 20:44:37+00:00,wmo,United States,CNA,North-America
3a118d8ae4bd8b6363eaae5402d0447b,2026-05-08T02:00:00Z,Storm,Storm Surge Fiordland north of Bligh Sound,www.rte.ie,en,0.2,Die zweithöchsten Meeresoberflächentemperaturen wurden im April gemessen. Im April 2026 wurden die zweithöchsten Meeresoberflächentemperaturen seit Beginn der Aufzeichnungen für Ozeane außerhalb der Polarregionen verzeichnet.,Second highest sea surface temperatures recorded in April,April 2026 saw the second highest sea surface temperatures on record for oceans outside the polar regions.,Second highest sea surface temperatures recorded in April. April 2026 saw the second highest sea surface temperatures on record for oceans outside the polar regions.,Secundae summae maris superficiei temperaturae mense Aprili exposita sunt. Aprilis 2026 secundas temperaturas superficiei maris supremis in commentariis pro oceanis extra polarias regiones vidit.,https://www.rte.ie/news/2026/0508/1572257-sea-temperatures/,https://www.rte.ie/images/002354cd-1600.jpg,,"The month of April 2026 saw the second highest sea surface temperatures on record for oceans outside the polar regions.
Record high temperatures were registered across large parts of the tropical Pa… [+2289 chars]",,2026-05-10 20:44:37+00:00,wmo,New Zealand,NZ,Oceania
de76e25942de658b6e1a68d208c298db,2026-05-08T05:30:00Z,Flood,Flooding Benton IA Iowa IA,www.archdaily.com,en,0.2,"Kengo Kuma & Associates und Field Operations renovieren das Brandywine Conservancy & Museum of Art in Pennsylvania. Das Brandywine Conservancy & Museum of Art in der Nähe von Philadelphia widmet sich der Förderung der natürlichen und kulturellen Verbindungen zwischen der Landschaft, historischen Stätten und Künstlern der Region. Die Conservancy schützt Land und Wasserstraßen im gesamten Brand…",Kengo Kuma & Associates and Field Operations to Renovate Pennsylvania’s Brandywine Conservancy & Museum of Art,"The Brandywine Conservancy & Museum of Art, located near Philadelphia, is dedicated to promoting the natural and cultural connections between the region's landscape, historic sites, and artists. The Conservancy protects land and waterways throughout the Brand…","Kengo Kuma & Associates and Field Operations to Renovate Pennsylvania’s Brandywine Conservancy & Museum of Art. The Brandywine Conservancy & Museum of Art, located near Philadelphia, is dedicated to promoting the natural and cultural connections between the region's landscape, historic sites, and artists. The Conservancy protects land and waterways throughout the Brand…","Kengo Kuma & Associates and Field Operations to Renovate Pennsylvania's Brandywine Conservancy & Museum of Art. The Brandywine Conservancy & Museum Artis, prope Philadelphiam sita, dedicatum est ad nexus fovendos naturales et culturales inter landscape regionis, historicas situs et artifices. Conservantia terras et rivos per Brand ... tutatur.",https://www.archdaily.com/1041320/kengo-kuma-and-associates-and-field-operations-to-renovate-pennsylvanias-brandywine-conservancy-and-museum-of-art,https://images.adsttc.com/media/images/69fd/2460/fda2/da23/68dc/4b13/large_jpg/kengo-kuma-and-associates-and-field-operations-to-renovate-pennsylvanias-brandywine-conservancy-and-museum-of-art_3.jpg?1778197641,,"Courtesy of Kengo Kuma &amp; Associates and Field Operations
The Brandywine Conservancy &amp; Museum of Art, located near Philadelphia, is dedicated to promoting the natural and cultural connections… [+6950 chars]",,2026-05-10 20:44:37+00:00,wmo,United States,CNA,North-America
830d5f5fac25a1137cde6f474e101910,2026-05-08T07:14:52Z,Flood,Flashflood Richland WI Vernon WI,www.boredpanda.com,en,0.2,"Taylor Swift bricht ihr Schweigen zur „Showgirl“-Klage des Ex-Vegas-Darstellers mit einer vernichtenden Aussage. Taylor Swift gibt nicht nach, da sich ein Rechtsstreit zwischen ihr und einem ehemaligen Showgirl aus Las Vegas anbahnt, das der Sängerin vorwirft, ihr Markenzeichen verletzt zu haben.",Taylor Swift Breaks Silence On Ex-Vegas Performer’s ‘Showgirl’ Lawsuit With Scathing Statement,"Taylor Swift is not backing down, as a legal battle brews between her and a former Las Vegas showgirl, who accused the singer of infringing on her trademark.","Taylor Swift Breaks Silence On Ex-Vegas Performer’s ‘Showgirl’ Lawsuit With Scathing Statement. Taylor Swift is not backing down, as a legal battle brews between her and a former Las Vegas showgirl, who accused the singer of infringing on her trademark.","Taylor Swift Breaks Silentium De Ex-Vegas Performer 'Showgirl' causam cum Scathing Statement. Taylor Swift non est regressus, ut inter eam et priorem Las Vegas spectaculum puellarum saliarum proelium legale est, qui cantorem notae artis suae minuendae accusavit.",https://www.boredpanda.com/taylor-swift-breaks-silence-after-ex-vegas-performer-showgirl-lawsuit/,https://static.boredpanda.com/blog/wp-content/uploads/2026/05/fb_image_69fd7d00e6f82.png,,"With a legal feud on her hands, Taylor Swift is not backing down.
A legal battle is brewing between the 36-year-old singer and a former Las Vegas showgirl.
Swift’s legal team released a strong-word… [+6296 chars]",,2026-05-10 20:44:37+00:00,wmo,United States,CNA,North-America
746eccfbe2813d3926dacb62038a0f47,2026-05-08T09:00:00Z,Precipitation,Downpour Northland,www.propublica.org,en,0.2,"Trump hat einige der größten Umweltverschmutzer des Landes von den Luftqualitätsvorschriften ausgenommen. Alles, was es brauchte, war eine E-Mail. In einem beispiellosen Schritt hat die Regierung Industrieanlagen in 38 Bundesstaaten und Puerto Rico einen zweijährigen Aufschub von den Bundesvorschriften gemäß dem Clean Air Act gewährt. Der Präsident erwägt, noch mehr Ausnahmen einzuführen.",Trump Exempted Some of the Nation’s Biggest Polluters From Air Quality Rules. All It Took Was an Email.,"In an unprecedented move, the administration has granted industrial facilities in 38 states and Puerto Rico a two-year reprieve from federal rules under the Clean Air Act. The president is considering exempting even more.","Trump Exempted Some of the Nation’s Biggest Polluters From Air Quality Rules. All It Took Was an Email.. In an unprecedented move, the administration has granted industrial facilities in 38 states and Puerto Rico a two-year reprieve from federal rules under the Clean Air Act. The president is considering exempting even more.","BUCINUM Exempti Aliquot Nationis Maximae Polluters From Air Quality Rules. Omnia accepit electronica. In novo motu, administratio facultatem industrialem in 38 civitatibus et Puerto Rico biennium relaxavit a regulis foederatis sub Actus Tersus Air. Praeses etiam plura eximens considerat.",http://www.propublica.org/article/clean-air-act-exemptions-trump-emails,"https://www.propublica.org/wp-content/uploads/2026/04/SOCIAL20260428-Cohen-CleanAirAct-011_maxHeight_3000_maxWidth_3000-copy_preview_maxWidth_3000_maxHeight_3000_ppi_72_embedColorProfile_true_quality_95.jpg?resize=2000,1050",,<ul><li>Taken for Granted: The Trump administration has granted more than 180 polluting facilities nationwide a two-year pause on compliance with Clean Air Act rules.</li><li>Deregulating by Email: T… [+23658 chars],,2026-05-10 20:44:37+00:00,wmo,New Zealand,NZ,Oceania
e87f558c9cfe38ddaed09b83935ba68f,2026-05-08T10:52:49Z,Snow&Ice,Frost Milford Road SH94,www.thehindubusinessline.com,en,0.2,"Sensex heute | Börsen-Highlights: Benchmark-Indizes enden tiefer; Sensex fällt um 516 Punkte auf 77.328, Nifty schließt aufgrund der Spannungen in Westasien bei 24.176. Sensex, Nifty, Aktienkurse: Die indischen Aktienmärkte notierten am Freitag weiter im Minus, da die eskalierenden Spannungen zwischen den USA und dem Iran in der Nähe der Straße von Hormus die globale Stimmung erschütterten, während anhaltende Verkäufe ausländischer Investoren und zunehmende geopolitische Unsicherheit die Händler davon abhielten …","Sensex today | Stock Market Highlights: Benchmark indices end lower; Sensex drops 516 pts to 77,328, Nifty closes at 24,176 amid West Asia tensions","Sensex, Nifty, Share Prices: Indian equity markets continued to trade lower on Friday as escalating US-Iran tensions near the Strait of Hormuz rattled global sentiment, while sustained foreign investor selling and rising geopolitical uncertainty kept traders …","Sensex today | Stock Market Highlights: Benchmark indices end lower; Sensex drops 516 pts to 77,328, Nifty closes at 24,176 amid West Asia tensions. Sensex, Nifty, Share Prices: Indian equity markets continued to trade lower on Friday as escalating US-Iran tensions near the Strait of Hormuz rattled global sentiment, while sustained foreign investor selling and rising geopolitical uncertainty kept traders …","Sensex hodie | Stock Market Highlights: Probatio indices inferiores finiunt; Sensex guttae 516 pt ad 77,328, Nifty claudit ad 24, 176 inter Asiae tensiones. Sensex, Nifty, Participes Prices: Indicum mercatus aequitas mercaturae inferioris Veneris die continuata est ut tensiones US-Iran escalating prope Fretum Hormuz globalis sensus obstupefactus, dum investor exterae venditionis et ortu geopoliticae incertae negotiatores negotiatores sustinuerunt.",https://www.thehindubusinessline.com/markets/sensex-nifty50-today-stock-market-highlights-8th-may-2026/article70953659.ece,https://bl-i.thgim.com/public/incoming/h1knuk/article70953660.ece/alternates/LANDSCAPE_1200/2026-05-07T134452Z_1690055885_RC2C4LAEAK7U_RTRMADP_3_GLOBAL-MARKETS.JPG,,"<li></li>
May 8, 2026 16:22(This live blog is now closed)
<li></li>
May 8, 2026 15:58lsgec Heavy Engineering in agreement with other joint venture partner, Sumitomo SHI FW Energia OY for sale of i… [+84117 chars]",,2026-05-10 20:44:37+00:00,wmo,New Zealand,NZ,Oceania
6d70ea857980225cb4ae71678f86b164,2026-05-08T11:00:00Z,Snow&Ice,Freezing Taloyoak Gjoa Haven,www.theatlantic.com,en,0.2,"Der iranische Exilant, der König werden würde. Taktiken im MAGA-Stil und harte Berater haben Reza Pahlavis Profil geschärft und seine potenziellen Anhänger gespalten.",The Iranian Exile Who Would Be King,MAGA-style tactics and hardball advisers have raised Reza Pahlavi’s profile and divided his potential followers.,The Iranian Exile Who Would Be King. MAGA-style tactics and hardball advisers have raised Reza Pahlavi’s profile and divided his potential followers.,Exsilium Iranianum quis futurus est. MAGA-styli ratio militaris et consiliarii hardball Reza Pahlavi profile erexerunt et eius sectatores potentiales diviserunt.,https://www.theatlantic.com/international/2026/05/iran-exile-reza-pahlavi/687088/,https://cdn.theatlantic.com/thumbor/O7CieP3qZLulH_wsjYxU4-Bm5ZE=/0x756:2160x1881/1200x625/media/img/mt/2026/05/2026_03_Pahlavi_Lead/original.jpg,,"In early February, while much of the world was focused on a looming war in the Persian Gulf, an outspoken Iranian exile named Masood Masjoody disappeared in Canada. Days later, 10 other well-known di… [+19452 chars]",,2026-05-10 20:44:37+00:00,wmo,Canada,NEN,North-America
807468b0a3f126fc74adf8ffc9a3e893,2026-05-08T18:32:50Z,Snow&Ice,Freezing Qikiqtarjuaq,cleantechnica.com,en,0.2,"Key West und ein Nachhaltigkeitsplan, der die Bundesregierung zum Staunen bringen könnte. Ich war diese Woche in Key West unterwegs. Wenn Sie noch nicht an diesem südlichsten Punkt der USA waren, müssen Sie es unbedingt tun – es ist ein wahrer Genuss. Da Kuba nur 90 Meilen vor der Küste liegt, hebt sich Key West vom Rest der kontinentalen Vereinigten Staaten ab. Es ist authentisches Florida: …",Key West And A Sustainability Plan That Could Make The Federal Government Growl,"I’ve been traveling in Key West this week. If you haven’t been to this southernmost point of the US, you must — it’s a real treat. With Cuba just 90 miles offshore, Key West stands apart from the rest of the continental United States. It’s authentic Florida: …","Key West And A Sustainability Plan That Could Make The Federal Government Growl. I’ve been traveling in Key West this week. If you haven’t been to this southernmost point of the US, you must — it’s a real treat. With Cuba just 90 miles offshore, Key West stands apart from the rest of the continental United States. It’s authentic Florida: …","Clavis Occidentalis Et Sustineri Plan Quod Facere potuit Gubernatio Foederalis Gubernatio. Hac septimana in Key Occidentali iter habui. Si in hoc meridionali parte US non fuistis, necesse est — res tractata est. Cum Cuba tantum XC milia passuum ab litore distans, Clavis Occidentalis distans a reliquis Civitatibus Foederatis Americae continentibus. Vera est Florida: …",https://cleantechnica.com/2026/05/08/key-west-and-a-sustainability-plan-that-could-make-the-federal-government-growl/,https://cleantechnica.com/wp-content/uploads/2026/05/Key-West-1.jpg,,"Support CleanTechnica's work through a Substack subscription or on Stripe.
I’ve been traveling in Key West this week. If you haven’t been to this southernmost point of the US, you must — it’s a real… [+9763 chars]",,2026-05-10 20:44:37+00:00,wmo,Canada,NEN,North-America
af61cd09dbae3ccf2742f732359660e0,2026-05-09T07:04:54Z,Snow&Ice,Snow Akulivik Puvirnituq,cryptobriefing.com,en,0.2,"Die VAE treten nach fast 59 Jahren aus der OPEC aus, was die Spannungen mit Saudi-Arabien über die Ölförderung eskaliert. Der Austritt der VAE aus der OPEC könnte die globale Öldynamik verändern, möglicherweise die Preise senken und einen strategischen Schwenk hin zu einem diversifizierten Wirtschaftswachstum signalisieren. Der Austritt der Vereinigten Arabischen Emirate aus der OPEC nach fast 59 Jahren führt zu einer Eskalation der Spannungen mit Saudi-Arabien über die Aussicht auf Ölförderung.","UAE exits OPEC after nearly 59 years, escalating tensions with Saudi Arabia over oil production","The UAE's OPEC exit may reshape global oil dynamics, potentially lowering prices and signaling a strategic pivot towards diversified economic growth.
The post UAE exits OPEC after nearly 59 years, escalating tensions with Saudi Arabia over oil production appe…","UAE exits OPEC after nearly 59 years, escalating tensions with Saudi Arabia over oil production. The UAE's OPEC exit may reshape global oil dynamics, potentially lowering prices and signaling a strategic pivot towards diversified economic growth.
The post UAE exits OPEC after nearly 59 years, escalating tensions with Saudi Arabia over oil production appe…","UAE exit OPEC post 59 annos fere, contentiones cum Arabia Saudiana super productionem olei evadentes. Exitus OPEC UAE dynamicos oleum globalem resonare potest, potentia demissiones pretiis et opportuna undi ad incrementum oeconomicum diversificatum significans.
Post UAE exit OPEC post 59 annos fere, contentiones cum Arabia Saudiana super appe- productionem olei evadens.",https://cryptobriefing.com/uae-exits-opec-saudi-oil-tensions/,https://static.cryptobriefing.com/wp-content/uploads/2026/05/09030431/2012827113410759734_20.jpeg,,"The seventh-largest oil producer in the world just freed itself from production quotas, potentially flooding markets with over 1 million additional barrels per day. The United Arab Emirates is leavin… [+3106 chars]",,2026-05-10 20:44:37+00:00,wmo,Canada,NEN,North-America
b10b447206878a01a9fe1abad5e667eb,2026-05-09T07:23:17Z,Precipitation,Rain ALL provinces,skepticalscience.com,en,0.2,"EGU2026 – Fünf Tage virtuelles Lernen. Dieser Blog entstand in der Woche vom 4. bis 8. Mai 2026, in der ich ihn, je nach Zeit, von Tag zu Tag ergänzte. Es kann sein, dass es auch nach der vollständigen Veröffentlichung auf unserer Homepage noch einige Aktualisierungen gibt, sobald weitere Informationen verfügbar werden.
Die diesjährige Generalversammlung der…",EGU2026 - Five days of virtual learning,"This blog evolved over the week of May 4 to 8, 2026 when I was adding to it from day to day as time allowed. It may still see some updates even after fully published on our homepage as some more information becomes available.
This year's General Assembly of t…","EGU2026 - Five days of virtual learning. This blog evolved over the week of May 4 to 8, 2026 when I was adding to it from day to day as time allowed. It may still see some updates even after fully published on our homepage as some more information becomes available.
This year's General Assembly of t…","EGU2026 - Quinque dies doctrinae virtualis. Hoc blog evolvitur per hebdomadem 4 mensis Maii ad 8 , 2026 cum mihi ex die in diem ad tempus addere licet. Adhuc nonnulla updates videre potest etiam postquam in pagina nostra plene evulgata sunt, sicut quaedam plura indicia praesto sunt.
Hoc anno in Conventu Generali t…",https://skepticalscience.com/egu26-personal-diary.html,https://skepticalscience.com/public/assets/images/og/button_sks_200.jpg,,"Posted on 9 May 2026 by BaerbelW
This blog evolved over the week of May 4 to 8, 2026 when I was adding to it from day to day as time allowed. It may still see some updates even after fully published… [+56756 chars]",,2026-05-10 20:44:37+00:00,wmo,Solomon Islands,EPO,Oceania
b5ddbef658383d7ecc2b2f475090ba61,2026-05-09T09:00:26Z,Earthquake,Earthquake Solomon Islands,www.omanobserver.om,en,0.2,"Krieg und Energieknappheit verstärken Chinas Einfluss in Asien. HONGKONG: Während sich der Krieg im Iran hinzieht, hat China seinen Einfluss bei seinen an Treibstoffmangel leidenden Nachbarn vertieft und bietet an, die Knappheit zu lindern und gleichzeitig seine...",War and energy shortages boost China’s Influence in Asia,"HONG KONG: As the war in Iran drags on, China has deepened its influence with fuel-starved neighbors, offering to ease shortages while pushing its...","War and energy shortages boost China’s Influence in Asia. HONG KONG: As the war in Iran drags on, China has deepened its influence with fuel-starved neighbors, offering to ease shortages while pushing its...","Bellum et industria inopias boost Sinarum Influentia in Asia est. HONG KONG: Bellum in Irania trahit, Sinis vim suam cum finitimis ieiuna esca auget, offerens inopias lenire dum suam propellit...",https://www.omanobserver.om/article/1189303/business/energy/war-and-energy-shortages-boost-chinas-influence-in-asia,https://www.omanobserver.om/omanobserver/uploads/images/2026/05/09/thumbs/600x600/3378827.jpg,,"HONG KONG: As the war in Iran drags on, China has deepened its influence with fuel-starved neighbors, offering to ease shortages while pushing its renewable energy technology.
In the days after the … [+7182 chars]",,2026-05-10 20:44:37+00:00,usgs,Solomon Islands,SPO,Pacific Ocean
901364e02dba4544c43d87e1d3943864,2026-05-09T10:00:00Z,Wildfire,Wildfire Greeley Wichita,www.activistpost.com,en,0.2,"Die Praxian Genocidal Kill Chain – Teil 1. In dieser zweiteiligen Artikelserie untersucht Iain Davis, wie eine Klasse von Silicon-Valley-Oligarchen sich vorgenommen hat, den Planeten zu destabilisieren, um ihr Ziel einer multipolaren Welt miteinander verbundener Smart-City-Staaten zu erreichen; das heißt, eine regionalisierte Welt, die …",The Praxian Genocidal Kill Chain – Part 1,"In this two-part article series, Iain Davis examines how a class of Silicon Valley oligarchs have set about destabilising the planet in order to achieve their goal of a multipolar world of interconnected smart-city states; that is, a regionalised world that t…","The Praxian Genocidal Kill Chain – Part 1. In this two-part article series, Iain Davis examines how a class of Silicon Valley oligarchs have set about destabilising the planet in order to achieve their goal of a multipolar world of interconnected smart-city states; that is, a regionalised world that t…","Praxian Genocidal Catenam interfice - Pars 1. In hoc duorum articulo seriei Iain Davis examinat quomodo genus Vallis Siliconis oligarchi de stabilienda planeta constituerunt ut suum propositum consequantur multipolaris mundi civitatum quae inter se conexae sunt; id est, orbis regionalised t…",https://www.activistpost.com/the-praxian-genocidal-kill-chain-part-1/,https://www.activistpost.com/wp-content/uploads/2026/05/Praxian_01-1536x982-1.webp,,"In this two-part article series, Iain Davis examines how a class of Silicon Valley oligarchs have set about destabilising the planet in order to achieve their goal of a multipolar world of interconne… [+101367 chars]",,2026-05-10 20:44:37+00:00,wmo,United States,CNA,North-America
