index,published,topic,term,domain,language,valid,de,title,description,en,la,url,image,archive,content,quote,added,feed,country,ipcc,continent
279d62cba6d41621db5dda08cf4c173d,2026-02-01T06:33:29Z,Earthquake,Earthquake Mendi,punchng.com,en,0.2,"Ein schwerer Schneesturm stört den Reiseverkehr im Süden der USA. Ein heftiger Schneesturm im Süden der USA bringt Temperaturen unter Null mit sich, was in mehreren Bundesstaaten zu weit verbreiteten Reiseunterbrechungen, Flugausfällen und Stromausfällen führt. Lesen Sie mehr: https://punchng.com/severe-snowstorm-disrupts-travel-across-southern-us/",Severe snowstorm disrupts travel across Southern US,"A severe Southern US snowstorm brings subzero temps, causing widespread travel disruption, flight cancellations, and power outages across several states.

Read More: https://punchng.com/severe-snowstorm-disrupts-travel-across-southern-us/","Severe snowstorm disrupts travel across Southern US. A severe Southern US snowstorm brings subzero temps, causing widespread travel disruption, flight cancellations, and power outages across several states.

Read More: https://punchng.com/severe-snowstorm-disrupts-travel-across-southern-us/","Gravis nivis disrupts iter trans Southern US. Gravis tempestas meridionalis US subzero tentationes adfert, diffusa turbationem peregrinationem, fugam cancellations et potestatem outages per plures civitates. Lege More: https://punchng.com/severe-snowstorm-disrupts-travel-across-southern-us/",https://punchng.com/?p=2051679,https://cdn.punchng.com/wp-content/uploads/2016/10/17155511/punchlogo.png,,"Travel misery was set to continue Sunday as a powerful snowstorm blasted southern US states, bringing subzero temperatures to regions not accustomed to the deadly winter conditions.
The latest bout … [+3202 chars]",,2026-02-04 05:48:37+00:00,usgs,Papua New Guinea,SEA,Oceania
2f4e93e05bfde9c05dce77a3c22d809d,2026-02-02T10:00:00Z,Snow&Ice,Freezing Northern Herkimer Hamilton,wattsupwiththat.com,en,0.2,Wöchentliche Zusammenfassung der Klima- und Energienachrichten Nr. 677. Zitat der Woche: „Einsicht muss der Anwendung vorausgehen.“,Weekly Climate and Energy News Roundup #677,Quote of the Week: “Insight must precede application.”,Weekly Climate and Energy News Roundup #677. Quote of the Week: “Insight must precede application.”,"Weekly Climate and Energy News Rotundus #677. Locum Hebdomadae: ""Perspectio praecedere debet applicationem"".",https://wattsupwiththat.com/2026/02/02/weekly-climate-and-energy-news-roundup-677/,https://i0.wp.com/wattsupwiththat.com/wp-content/uploads/2026/02/charlesrotter_gorgeous_scenic_photo_of_mono_lake_with_snow_midjourney.webp?fit=1024%2C512&quality=75&ssl=1,,"Quote of the Week: Insight must precede application. 
  Max Planck
Number of the Week: 1-day in10 Years.
*********************
THIS WEEK:By Ken Haapala, President, Science and Environmental Polic… [+76943 chars]",,2026-02-04 15:42:00+00:00,wmo,United States,CNA,North-America
