index,published,topic,term,domain,language,valid,de,title,description,en,la,url,image,archive,content,quote,added,feed,country,ipcc,continent
9b72bdb439904c24d2f0ea73774a45c0,2026-04-08T19:54:22Z,Flood,Flashflood Bartholomew IN Jackson IN,www.abc.net.au,en,0.2,"Zyklon Maila bewegt sich erneut in Richtung der Küste von Far North Queensland. Zyklon Maila ist aufgewacht und zieht nach Westen, wobei das System der Kategorie vier am Montag wahrscheinlich noch den hohen Norden von Queensland erreichen wird.",Cyclone Maila moving again towards Far North Qld coast,"Cyclone Maila has woken up and is heading west, with the category four system still likely to reach Queensland's far north on Monday.","Cyclone Maila moving again towards Far North Qld coast. Cyclone Maila has woken up and is heading west, with the category four system still likely to reach Queensland's far north on Monday.","Cyclone Maila iterum movens ad oram ulteriorem septentrionalem Qld. Cyclone Maila experrectus est et occidentem tendit, cum quattuor systematis categoria adhuc die Lunae in septentrionem longinquam Reginensis attingere verisimile est.",https://www.abc.net.au/news/2026-04-09/severe-cyclone-maila-moving-from-solomon-sea-to-qld/106542380,https://live-production.wcms.abc-cdn.net.au/206a54816394006887c4e48947db9d6a?impolicy=wcms_watermark_news&cropH=570&cropW=1013&xPos=0&yPos=38&width=862&height=485&imformat=generic,,"Severe Tropical Cyclone Maila's days of rest are over, with the system again heading west towards Queensland after stalling in the Solomon Sea.
The Bureau of Meteorology said Maila was still expecte… [+2935 chars]",,2026-04-16 06:56:59+00:00,wmo,United States,CNA,North-America
e6b10b421c69f41d6d557d5a7bb622fb,2026-04-01T03:34:05Z,Tropical Cyclone,cyclone Australia,www.abc.net.au,en,0.8,"Ein Blutmond, ein Zyklon und Regenbögen – WAs Himmel, eingefangen von Ihnen. Die Natur hat im März für Westaustralien ein besonderes Schauspiel geboten, zu dem neben den spektakulären Sonnenuntergängen, für die der Staat bekannt ist, auch eine totale Mondfinsternis und die raue See eines mächtigen tropischen Wirbelsturms gehörten.","A blood moon, a cyclone and rainbows — WA's skies, captured by you","Nature put on a special show for Western Australia in March, including a total lunar eclipse and rough seas from a powerful tropical cyclone, in addition to the spectacular sunsets the state is known for.","A blood moon, a cyclone and rainbows — WA's skies, captured by you. Nature put on a special show for Western Australia in March, including a total lunar eclipse and rough seas from a powerful tropical cyclone, in addition to the spectacular sunsets the state is known for.","Luna sanguinea, cyclonus et irides — WA coelum a vobis captus. Natura singularem spectaculum in Australia occidentali mense Martio posuit, inter totalem eclipsis lunarem et aspera maria e cyclo tropico valido, praeter spectaculi occasum status notus est.",https://www.abc.net.au/news/2026-04-01/march-best-weather-photos-perth-western-australia/106518812,https://live-production.wcms.abc-cdn.net.au/8c7260b9a937b0d469aff6d8f43fe351?impolicy=wcms_watermark_news&cropH=720&cropW=1280&xPos=1&yPos=0&width=862&height=485&imformat=generic,,"From a rare total lunar eclipse to unique cloud formations and a severe tropical cyclone to close it out, March delivered a month to remember for nature enthusiasts in Western Australia.
As the firs… [+4510 chars]",,2026-04-16 06:56:59+00:00,aidr,Australia,CAU,Oceania
439d37bde5015018a9411d513ce257be,2026-04-06T09:24:12Z,Flood,Flooding Northern Oneida Southern Oneida,www.ibtimes.com.au,en,0.2,"Fluggesellschaften stornieren Tausende Flüge aufgrund von Treibstoffmangel und Preisanstieg aufgrund des Iran-Krieges. Große Fluggesellschaften auf der ganzen Welt haben damit begonnen, Tausende von Flügen zu streichen und die Tarife zu erhöhen, da sich die Kerosinpreise mehr als verdoppelt haben und die physischen Vorräte infolge des anhaltenden Krieges im Iran und der effektiven Schließung der Straße von Hormus knapp geworden sind.","Airlines Cancel Thousands of Flights Amid Jet Fuel Shortages, Price Surge From Iran War",Major airlines around the world have begun canceling thousands of flights and raising fares as jet fuel prices have more than doubled and physical supplies have tightened in the wake of the ongoing war in Iran and the effective closure of the Strait of Hormuz.,"Airlines Cancel Thousands of Flights Amid Jet Fuel Shortages, Price Surge From Iran War. Major airlines around the world have begun canceling thousands of flights and raising fares as jet fuel prices have more than doubled and physical supplies have tightened in the wake of the ongoing war in Iran and the effective closure of the Strait of Hormuz.","Airlines Cancel Milia volatus Inter Jet Fuel Shortages, Pretium Surge Ex Bellum Iran. Maiores airlines circa mundum milia fugarum distrahentes inceperunt et victualia ut jet pretia levandi plus habent quam duplicata et commeatus corporis in ortu belli permanentis in Irania et efficax clausurae Freti Hormuz constringuntur.",https://www.ibtimes.com.au/airlines-cancel-thousands-flights-amid-jet-fuel-shortages-price-surge-iran-war-1865551,https://d.ibtimes.com.au/en/full/1892946/united-airlines-air-travel.jpg,,Major airlines around the world have begun canceling thousands of flights and raising fares as jet fuel prices have more than doubled and physical supplies have tightened in the wake of the ongoing w… [+7730 chars],,2026-04-17 06:57:59+00:00,wmo,United States,CNA,North-America
380ff5b76bb593b2e926c4320d9bb2bc,2026-04-07T18:00:00Z,Storm,Storm Surge Jamaica,www.nzherald.co.nz,en,0.2,"Inside Economics: RBNZ in besserer Verfassung als die australische Zentralbank, außerdem könnte der Iran-Konflikt die Dominanz des US-Dollars beenden. ANALYSE: Liam Dann taucht tiefer in die Wirtschaftsnachrichten der Woche ein.","Inside Economics: RBNZ in better shape than Aussie central bank, plus could Iran conflict end US dollar dominance",ANALYSIS: Liam Dann takes a deeper dive into the week's economic news.,"Inside Economics: RBNZ in better shape than Aussie central bank, plus could Iran conflict end US dollar dominance. ANALYSIS: Liam Dann takes a deeper dive into the week's economic news.","Oeconomica intus: RBNZ meliori figura quam Aussie centralis ripam, plus Iran conflictus US pupa dominatum finire potuit. EXPLICATIO: Liam Dann profundiorem inducit nuntium oeconomicum hebdomadis.",https://www.nzherald.co.nz/business/economy/inside-economics-rbnz-in-better-shape-than-aussie-central-bank-plus-could-iran-conflict-end-us-dollar-dominance/premium/IMXEIR5WV5BT7COQYXBQ72BK54/,https://www.nzherald.co.nz/resizer/v2/3LHCOJR3A5F5PAXPWLCI5DVBYQ.jpg?auth=3db00ff66454ba473ee6159b6f7388478e764b0ea341fa8bb9f942c42f378e32&width=1200&height=675&quality=70&smart=true,,"More inflation and lower growth seem to be the general expectation of most economists. But what does that mean for monetary policy?
Will the supply-side inflation be transitory? How long can the RBN… [+12778 chars]",,2026-04-17 06:57:59+00:00,wmo,Jamaica,CAR,North-America
903a43038e7fbb78973297ed224b9896,2026-04-11T03:44:59Z,Drought,Lack of Rain Bahamas,www.nzherald.co.nz,en,0.2,"Zyklon Vaianu: Ausnahmezustand im westlichen BOP ausgerufen, Evakuierungen in Tauranga dringend erforderlich. Menschen in Küstengebieten oder tief gelegenen, überschwemmungsgefährdeten Gebieten werden aufgefordert, sich auf höher gelegene Gebiete zu begeben.","Cyclone Vaianu: State of emergency declared in Western BOP, evacuations urged in Tauranga",People in coastal or low-lying flood-prone areas urged to get to higher ground.,"Cyclone Vaianu: State of emergency declared in Western BOP, evacuations urged in Tauranga. People in coastal or low-lying flood-prone areas urged to get to higher ground.","Cyclone Vaianu: Status casus in Occidentis BOP declaratus, purgationes in Tauranga suasit. Homines in locis maritimis vel iacentibus diluviis pronis suaserunt ut ad altiorem terram pervenirent.",https://www.nzherald.co.nz/bay-of-plenty-times/news/cyclone-vaianu-state-of-emergency-declared-in-western-bop-evacuations-urged-in-tauranga/CW46PWWINRBDXLVTJXOEXM7A2Q/,https://www.nzherald.co.nz/resizer/v2/4WAQUUGU5NBG5IHLBX2H7QRKOI.jpg?auth=3d57f9b04b72eb01e82112bc8c0adda9006330e56e4d6b0d16e140e979951fd1&width=1200&height=675&quality=70&smart=true,,"It said there could be life-threatening high winds, falling trees, dangerous river conditions, landslides and flooding.
Large waves, high tides and coastal flooding were also a significant risk. 
P… [+6574 chars]",,2026-04-17 06:57:59+00:00,edo,Bahamas,CAR,North-America
a4d36e0e3f2c697c7858f02804975a05,2026-04-12T03:10:08Z,Flood,Flashflood Gratiot MI,www.surfer.com,en,0.2,"32 Fuß hoher Zyklon erschüttert Neuseeland, während Tausende fliehen (Video). Der tropische Wirbelsturm Vaianu traf am Wochenende auf Neuseeland und löste große, stürmische Wellen in dem Land sowie Evakuierungswarnungen wegen Überschwemmungen aus.",32-Foot Cyclone Swell Pummels New Zealand as Thousands Flee (Video),"Tropical Cyclone Vaianu hit New Zealand over the weekend, sending large and stormy surf to the nation, along with evacuation warnings due to flooding.","32-Foot Cyclone Swell Pummels New Zealand as Thousands Flee (Video). Tropical Cyclone Vaianu hit New Zealand over the weekend, sending large and stormy surf to the nation, along with evacuation warnings due to flooding.","32-Pes Cyclone tumescant Pummels Novae Zelandiae Milia Fugite (Video). Tropical Cyclone Vaianu Novae Zelandiae in volutpat vestibulum percussit, salo magno et procelloso ad gentem mittens, cum monitis evacuationibus ob inundationem.",https://www.surfer.com/news/32-foot-cyclone-swell-new-zealand-video,https://s.yimg.com/os/en/surfer_magazine_140/9f2975ccbd321e8b908f3bb2e890e318,,"Tropical Cyclone Vaianu rambled towards New Zealand over the weekend, bringing with it wild weather, large waves, and moments of brilliance for surfers.
Officials in charge even issued evacuation wa… [+1991 chars]",,2026-04-17 06:57:59+00:00,wmo,United States,CNA,North-America
4b42ea28b9ae7ec425d948390fab6115,2026-04-10T17:00:00Z,Flood,Flashflood Clinton IA Scott IA,www.nzherald.co.nz,en,0.2,"Zyklon Vaianu: Es ist besser, vorbereitet zu sein, als sich überraschen zu lassen – Leitartikel. MEINUNG: Menschen, die wahrscheinlich betroffen sind, müssen jetzt handeln, wenn sie es noch nicht getan haben.",Cyclone Vaianu: It’s better to be prepared than get caught out – Editorial,OPINION: People likely to be impacted need to act now if they haven’t already.,Cyclone Vaianu: It’s better to be prepared than get caught out – Editorial. OPINION: People likely to be impacted need to act now if they haven’t already.,Cyclone Vaianu: Praeparari melius est quam deprehensus est – Editorial. OPINIO: Homines solent impacti opus facere nunc si nondum habent.,https://www.nzherald.co.nz/nz/cyclone-vaianu-its-better-to-be-prepared-than-get-caught-out-editorial/premium/CBKEFPTPTRFRTJTLRTVARUNNZI/,https://www.nzherald.co.nz/resizer/v2/LM4INRZUKFCBNNAA62RANLDIUU.png?auth=7540871cb4391676ae10ef3e7be953f62777e86a80d5678fa7e9c4932363c557&width=1200&height=675&quality=70&smart=true,,"As of yesterday, we have more clarity. 
The first signs of the cyclone will make landfall tonight.
Severe gale-force winds exceeding 120km/h begin in Northland, Auckland and Great Barrier Island. H… [+3520 chars]",,2026-04-17 10:55:29+00:00,wmo,United States,CNA,North-America
1c4f276362e84ea65a110504307d3e19,2026-04-10T17:00:00Z,Flood,Flooding Lawrence PA Mercer PA,www.nzherald.co.nz,en,0.2,"Zyklon Vaianu: „Lebensbedrohliches“ Wetter droht Nordinsel zu treffen; Sintflutartiger Regen, 140 km/h Wind, 8 m hohe Wellen erwartet. Das „multi-gefährliche, potenziell lebensbedrohliche Ereignis“ soll am Sonntag über Land hereinbrechen.","Cyclone Vaianu: ‘Life-threatening’ weather set to hit North Island; torrential rain, 140km/h winds, 8m waves expected","The 'multi-hazard, potentially life-threatening event' is set to make landfall on Sunday.","Cyclone Vaianu: ‘Life-threatening’ weather set to hit North Island; torrential rain, 140km/h winds, 8m waves expected. The 'multi-hazard, potentially life-threatening event' is set to make landfall on Sunday.","Cyclone Vaianu: 'minas vitae' tempestatibus ad septentrionalem Islandiam feriendum profectus est; imbres torrentes, 140km/h ventos, 8m fluctus expectat. In ""multi-alexandria, eventum potentiae vitae imminens"", positum est ut die Dominico emitteretur.",https://www.nzherald.co.nz/nz/cyclone-vaianu-life-threatening-weather-set-to-hit-north-island-torrential-rain-140kmh-winds-8m-waves-expected/NN32RN7MPBGYJLH3PWBH2RNEOM/,https://www.nzherald.co.nz/resizer/v2/ZX54FNT3SVGRDBGFMHZPS3E2CQ.png?auth=4b763c9fa1ee2e6247b32fe968a7833300f8dc1ed1f2cd0d2e67b4460f033a96&width=1200&height=675&quality=70&smart=true,,"That rains going to approach from the north and then gradually through the day its going to become more persistent in the evening and heavy for Northland, Great Barrier Island and the Coromandel Peni… [+2954 chars]",,2026-04-17 10:55:29+00:00,wmo,United States,CNA,North-America
cf3346d88c31dc5dd1bb69440564ad7c,2026-04-01T14:37:00Z,Flood,Flashflood Clinton MI,www.globenewswire.com,en,0.2,"ThreatLocker wurde zum Hauptsponsor des CyberLaunch-Cybersicherheitswettbewerbs von Cyber ​​Florida für die Klassen 6–12 ernannt. CyberLaunch, präsentiert von ThreatLocker, erweitert den Zugang für Studenten aus Florida zum größten staatlich geförderten Cybersicherheitswettbewerb des Landes. CyberLaunch, präsentiert von ThreatLocker, erweitert den Zugang zu Studenten aus Florida für den größten staatlich geförderten Wettbewerb des Landes.",ThreatLocker named lead sponsor for Cyber Florida’s CyberLaunch cybersecurity competition for grades 6–12,"CyberLaunch, presented by ThreatLocker, expands access to Florida students for the nation’s largest state-sponsored cybersecurity competition CyberLaunch, presented by ThreatLocker, expands access to Florida students for the nation’s largest state-sponsored c…","ThreatLocker named lead sponsor for Cyber Florida’s CyberLaunch cybersecurity competition for grades 6–12. CyberLaunch, presented by ThreatLocker, expands access to Florida students for the nation’s largest state-sponsored cybersecurity competition CyberLaunch, presented by ThreatLocker, expands access to Florida students for the nation’s largest state-sponsored c…","ThreatLocker nominatus sponsor cyberLaunch cyberLaunch cybersecurity competition plumbi pro gradibus 6-12. CyberLaunch, praesentatus a ThreatLocker, accessum ad Floridam studentium amplissimam cyberLaunch cyberLaunch statu-sponsorie statu-sponsorie maximae gentis, praesentatus a ThreatLocker, accessum dilatat ad Florida studentibus pro maximis statu-sponsoribus nationis c…",https://www.globenewswire.com/news-release/2026/04/01/3266791/0/en/ThreatLocker-named-lead-sponsor-for-Cyber-Florida-s-CyberLaunch-cybersecurity-competition-for-grades-6-12.html,https://ml.globenewswire.com/Resource/Download/8dc375d4-d9a0-4abd-bc2c-cae2b4815386,,"Orlando, FL, April 01, 2026 (GLOBE NEWSWIRE) -- Cyber Florida at USF and ThreatLocker, a global leader in Zero Trust cybersecurity, today announced that ThreatLocker will serve as the lead sponsor of… [+3304 chars]",,2026-04-17 16:00:29+00:00,wmo,United States,CNA,North-America
a4e5f4f984d369a34dbd4f24a7db2e97,2026-04-02T21:47:38Z,Storm,Storm Glacier Bay,japantoday.com,en,0.2,"Die Bodycam zeigt einen fassungslosen Tiger Woods, der nach einem Überschlagsunfall in Florida mit Handschellen gefesselt ist. Tiger Woods zeigte sich erstaunt, als ihm Handschellen angelegt wurden, nachdem er letzte Woche mit seinem SUV in Florida einen Unfall verunglückt hatte. Dies geht aus am Donnerstag veröffentlichten Körperkameraaufnahmen hervor, auf denen auch Beamte zu sehen sind, die Woods zwei Pillen aus der Tasche nehmen. Separates Filmmaterial von der Rückseite der Patrouille …",Bodycam shows a stunned Tiger Woods handcuffed after a Florida rollover crash,"Tiger Woods expressed astonishment as he was handcuffed after crashing his SUV last week in Florida, according to body camera footage released Thursday that also shows deputies removing two pills from Woods' pocket. Separate footage from the back of the patro…","Bodycam shows a stunned Tiger Woods handcuffed after a Florida rollover crash. Tiger Woods expressed astonishment as he was handcuffed after crashing his SUV last week in Florida, according to body camera footage released Thursday that also shows deputies removing two pills from Woods' pocket. Separate footage from the back of the patro…","Ansgarius Bodycam Tiger Woods torpere ostendit post fragorem Floridae rollover. Tigris Woods stuporem expressit cum ansgarius cum SUV ultima septimana in Florida fragorem suum emisisset, secundum corpus camerae footage Iovis die dimissa est, quod etiam ostendit legatos duos pilulas e sinu Woods removisse. Separate a tergo patris footage ...",https://japantoday.com/category/sports/bodycam-shows-a-stunned-tiger-woods-handcuffed-after-a-florida-rollover-crash,,,"Tiger Woods expressed astonishment as he was handcuffed after crashing his SUV last week in Florida, according to body camera footage released Thursday that also shows deputies removing two pills fro… [+3813 chars]",,2026-04-17 16:00:29+00:00,wmo,United States,CNA,North-America
dfe5c2de2c0b913e61795078b8ea4f7b,2026-04-03T12:59:15Z,Precipitation,Torrential Rain Solomon Islands,fortune.com,en,0.2,"„Ich habe gerade mit dem Präsidenten gesprochen“: Das Bodycam-Video von Tiger Woods weist auf die Rolle von Trump hin. Man hörte Woods „Vielen Dank“ sagen, als er auflegte und der Stellvertreter näher kam.",‘I was just talking to to the president’: Tiger Woods bodycam video hints at Trump role,"Woods could be heard saying, “Thank you so much,” as he hung up and the deputy approached.","‘I was just talking to to the president’: Tiger Woods bodycam video hints at Trump role. Woods could be heard saying, “Thank you so much,” as he hung up and the deputy approached.","'Iustus locutus sum cum praesidi': Tiger Woods bodycam video innuit apud munus Trump. Silvae audiri poterant dicentes: ""Tantum gratias"", cum suspensus ac vicarius accessit.",https://fortune.com/2026/04/03/i-was-just-talking-to-to-the-president-tiger-woods-bodycam-video-hints-at-trump-role/,"https://fortune.com/img-assets/wp-content/uploads/2026/04/AP26092730468184.jpg?resize=1200,600",,"After crashing his SUV last week in Florida, Tiger Woods took out his phone and told a deputy, I was just talking to the president, according to body camera footage released Thursday showing Woods ar… [+4258 chars]",,2026-04-17 16:00:29+00:00,wmo,Solomon Islands,EPO,Oceania
7b38f44e745b34fa9720927d7e7e301f,2026-04-04T12:39:47Z,Drought,Drought Micronesia,www.usatoday.com,en,0.2,"UConn vs. Illinois Live-Updates, Neuigkeiten, Vorhersagen, wie man das Final Four-Spiel sehen kann. Hier erfahren Sie, was Sie über das Final-Four-Spiel zwischen UConn und Illinois am Samstag wissen müssen, einschließlich Prognosen und Anleitungen zum Zuschauen.","UConn vs Illinois live updates, news, predictions, how to watch Final Four game","Here's what you need to know for Saturday's Final Four game between UConn and Illinios, including predictions and how to watch.","UConn vs Illinois live updates, news, predictions, how to watch Final Four game. Here's what you need to know for Saturday's Final Four game between UConn and Illinios, including predictions and how to watch.","UConn vs Illinois updates, nuntium, praedictiones, quomodo spectare ludum finalem quattuor potest. Hic illud scire debes pro ludo Saturni finali quattuor inter UConn et Illinios, inter praedictiones et quomodo vigilare.",https://www.usatoday.com/story/sports/ncaab/2026/04/04/uconn-vs-illinois-basketball-live-score-updates-final-four-prediction-how-to-watch-march-madness/89448372007/,https://s.yimg.com/ny/api/res/1.2/HopB3VV_L0CT5gdR6BC.TA--/YXBwaWQ9aGlnaGxhbmRlcjt3PTEyMDA7aD04MDA7Y2Y9d2VicA--/https://media.zenfs.com/en/usa_today_sports_articles_558/d4a463a00748d47b6994ad41cb03257a,,"Billed as the appetizer to this Final Four's main course, but folks who have been to Indianapolis know the appetizer can oftentimes be the spicier dish.
While many are calling Arizona vs. Michigan t… [+11893 chars]",,2026-04-17 16:00:29+00:00,edo,Micronesia,NPO,Pacific Ocean
0ae08365acb3fc42efbf122fc5b71dca,2026-04-04T23:20:04Z,Drought,low water level New South Wales,www.espn.com,en,0.2,Quellen: Lakers' Reaves (oblique) fehlen 4-6 Wochen. Bei Lakers-Guard Austin Reaves wurde eine Verletzung des linken Schrägmuskels Grad 2 diagnostiziert und er wird für den Rest der regulären Saison ausfallen.,Sources: Lakers' Reaves (oblique) out 4-6 weeks,Lakers guard Austin Reaves has been diagnosed with a Grade 2 left oblique muscle injury and will be out for the remainder of the regular season.,Sources: Lakers' Reaves (oblique) out 4-6 weeks. Lakers guard Austin Reaves has been diagnosed with a Grade 2 left oblique muscle injury and will be out for the remainder of the regular season.,"Fontes: Lakers 'Reaves) ex 4-6 septimanas. Lakers guard Austin Reaves has been diagnosed with a Grade 2 left musculus obliquus externus, and will be out for the rest of the regular season.",https://www.espn.com/nba/story/_/id/48397148/lakers-reaves-oblique-remainder-regular-season,https://a.espncdn.com/combiner/i?img=%2Fphoto%2F2026%2F0404%2Fr1638541_1024x576_16%2D9.jpg,,"DALLAS -- With the team already reeling from the Luka Doncic left hamstring strain diagnosis that will sideline him indefinitely, the Los Angeles Lakers announced on Saturday that Austin Reaves has b… [+4749 chars]",,2026-04-17 16:00:29+00:00,acwe,Australia,EAU,Oceania
81b2404b5bfcddc6bab6e5141aacffd3,2026-04-07T03:04:50Z,Flood,Flood Clinton IA Scott IA,sports.yahoo.com,en,0.2,"Banchero erzielt 31 Punkte, Bane fügt 25 hinzu, um der Magie zu helfen, die Kolben zurückzudrehen. Paolo Banchero erzielte 31 Punkte, Desmond Bane fügte 25 hinzu und die Orlando Magic besiegten die Detroit Pistons am Montagabend mit 123-107. Jalen Suggs hatte 12 Punkte, 12 ...","Banchero scores 31, Bane adds 25 to help the Magic turn back the Pistons","Paolo Banchero scored 31 points, Desmond Bane added 25 and the Orlando Magic beat the Detroit Pistons 123-107 on Monday night. Jalen Suggs had 12 points, 12 ...","Banchero scores 31, Bane adds 25 to help the Magic turn back the Pistons. Paolo Banchero scored 31 points, Desmond Bane added 25 and the Orlando Magic beat the Detroit Pistons 123-107 on Monday night. Jalen Suggs had 12 points, 12 ...","Banchero pereuntis 31, Bane 25 addit ad auxilium Magicae Pistoris convertendi. Paolo Banchero notatos 31 puncta, Desmond Bane 25 addidit et Orlandus Magia Detroit Pistons 123-107 die Lunae nocte verberavit. Jalen Suggs habuit 12 puncta, 12 ...",https://sports.yahoo.com/articles/banchero-scores-31-bane-adds-030450200.html,https://s.yimg.com/ny/api/res/1.2/7lI2pUkTXJ_W22HbxTGySA--/YXBwaWQ9aGlnaGxhbmRlcjt3PTEyMDA7aD04MDA7Y2Y9d2VicA--/https://media.zenfs.com/en/ap.org/07f1dae4684f6dab58efe6ac2acb95ef,,"ORLANDO, Fla. (AP) Paolo Banchero scored 31 points, Desmond Bane added 25 and the Orlando Magic beat the Detroit Pistons 123-107 on Monday night.
Jalen Suggs had 12 points, 12 assists, six rebounds … [+2613 chars]",,2026-04-17 16:00:29+00:00,wmo,United States,CNA,North-America
47dcf042f67604940ee2bb11405ec0fd,2026-04-08T16:22:00Z,Flood,Flood Kent MI,www.covers.com,en,0.2,"Bucks vs. Pistons Prognose, Tipps und Quoten für das heutige NBA-Spiel. Duncan Robinson lässt in unseren Bucks vs. Pistons-Vorhersagen und NBA-Tipps für den 8. April Triples niederprasseln.","Bucks vs Pistons Prediction, Picks & Odds for Tonight’s NBA Game",Duncan Robinson rains down triples in our Bucks vs. Pistons predictions and NBA picks for April 8.,"Bucks vs Pistons Prediction, Picks & Odds for Tonight’s NBA Game. Duncan Robinson rains down triples in our Bucks vs. Pistons predictions and NBA picks for April 8.","Buck vs Pistons Prediction, Picks & Odds for Tonight's NBA Ludus. Duncan Robinson triplis pluit in nostro Buck vs Pistons praedictiones et NBA carpit pro VIII Aprilis.",https://www.covers.com/nba/bucks-vs-pistons-prediction-picks-best-bets-sgp-wednesday-4-7-2026,https://s.yimg.com/os/en/covers_articles_287/b27f5e84b8aa253053fadf97a0afdc9c,,"Want to get more Covers content? Add us as a preferred source on your Google account here.
If the massive point spread didn’t already give it away, the Milwaukee Bucks aren’t expected to put up much… [+4151 chars]",,2026-04-17 16:00:29+00:00,wmo,United States,CNA,North-America
