index,published,topic,term,domain,language,valid,de,title,description,en,la,url,image,archive,content,quote,added,feed,country,ipcc,continent
f356b0114649b052033e704f0d1133ab,2026-05-05T14:00:00Z,Snow&Ice,Ice Red Bay to L'Anse au Clair,journals.plos.org,en,0.2,"Ultraschall-Neuromodulation zeigt unterschiedliche Rollen des dorsalen anterioren cingulären Kortex und der vorderen Insula beim Lernen. Pawlowsche Ansatz-Vermeidungstendenzen können die flexible Handlungskontrolle stören, die kausalen Beiträge bestimmter neuronaler Regionen bleiben jedoch unklar. Diese Studie zeigt, dass die Stimulation der vorderen Insula die Lernverzerrung verringert, während die Stimulation der dorsalen ACC zunimmt.",Ultrasound neuromodulation reveals distinct roles of the dorsal anterior cingulate cortex and anterior insula in learning,"Pavlovian approach–avoidance tendencies can disrupt flexible action control, but the causal contributions of specific neural regions remain unclear. This study shows that anterior insula stimulation reduces learning bias, while dorsal ACC stimulation increase…","Ultrasound neuromodulation reveals distinct roles of the dorsal anterior cingulate cortex and anterior insula in learning. Pavlovian approach–avoidance tendencies can disrupt flexible action control, but the causal contributions of specific neural regions remain unclear. This study shows that anterior insula stimulation reduces learning bias, while dorsal ACC stimulation increase…","Neuromodulatio ultrasounds partes dorsalis cingulate cortex et insulae anterioris in discendo distinctas exhibet. Accessus Pavlovian-declinatio tendentiarum flexibilem actionem dominii perturbare potest, sed contributiones causales regionum specificarum neuralis obscurae manent. Hoc studium ostendit quod insula stimulationis anterioris studium discendi minuit, dum dorsalis ACC excitanda incrementa…",https://journals.plos.org/plosbiology/article?id=10.1371/journal.pbio.3003767,https://journals.plos.org/plosbiology/article/figure/image?id=10.1371/journal.pbio.3003767.strk&size=inline,,"Citation: Koutsoumpari N, Algermissen J, Yaakub SN, den Ouden HE, Bault N, Fouragnan E (2026) Ultrasound neuromodulation reveals distinct roles of the dorsal anterior cingulate cortex and anterior in… [+98906 chars]",,2026-05-10 11:00:20+00:00,wmo,Canada,NEN,North-America
fb337674c169225d28f10e5410ca978b,2026-05-05T14:19:29Z,Precipitation,wet spell Western Australia,fortune.com,en,0.2,"Der milliardenschwere CEO von GameStop ist ein Unternehmer ohne Hochschulabschluss, der Chewy mitbegründet hat. Jetzt hat er es sich zum Ziel gesetzt, eBay für 56 Milliarden Dollar zu kaufen. Ryan Cohen wurde von 100 Investoren abgelehnt, bevor er Chewy für 3,35 Milliarden US-Dollar verkaufte.",GameStop’s billionaire CEO is an entrepreneur without a college degree who cofounded Chewy. Now he has his sights set on buying eBay for $56 billion,Ryan Cohen was rejected by 100 investors before selling Chewy for $3.35 billion.,GameStop’s billionaire CEO is an entrepreneur without a college degree who cofounded Chewy. Now he has his sights set on buying eBay for $56 billion. Ryan Cohen was rejected by 100 investors before selling Chewy for $3.35 billion.,De billionaire GameStop CEO manceps est sine gradu collegii qui Chewy confudit. Nunc visus habet in emendo eBay pro $56 sescenti. Ryan Cohen reiecta est a 100 obsidibus antequam Chewy venderet pro $3.35 sescenti.,https://fortune.com/2026/05/05/gamestop-billionaire-entrepreneur-ceo-ryan-cohen-chewy-cofounder-meme-stocks/,"https://fortune.com/img-assets/wp-content/uploads/2026/05/GettyImages-2274484444-e1777990150793.jpg?resize=1200,600",,"GameStop CEO Ryan Cohen is a billionaire entrepreneur who is known for taking big risks. Yet, his biggest challenge may be his attempt to revive the struggling gaming retail chain.With GameStops unso… [+3576 chars]",,2026-05-10 11:00:20+00:00,acwe,Australia,CAU,Oceania
55e629b1783d43a2f3756d2b215007b7,2026-05-06T07:43:44Z,Flood,Flooding Pulaski IN,www.rt.com,en,0.2,"Die USA geben der Ukraine grünes Licht für den Bombendeal. Die USA haben den möglichen Verkauf von JDAM-ER-Bausätzen an die Ukraine genehmigt, die zur Umwandlung von Bomben in Lenkmunition verwendet werden. Den vollständigen Artikel finden Sie auf RT.com",US greenlights bomb deal for Ukraine,"The US has approved the potential sale of JDAM-ER kits to Ukraine, used for converting bombs into guided munitions Read Full Article at RT.com","US greenlights bomb deal for Ukraine. The US has approved the potential sale of JDAM-ER kits to Ukraine, used for converting bombs into guided munitions Read Full Article at RT.com","Bomb lusoriae US pro Ucraina paciscor. US venditionem potentialem JDAM-ER kits Ucrainae approbavit, usus est ad bombas convertendas in munimenta ducenda Read Full Article at RT.com",https://www.rt.com/news/639510-us-greenlights-bomb-deal-ukraine/,https://mf.b37mrtl.ru/files/2026.05/article/69faf0bf85f54029191223a1.jpg,,"The administration of US President Donald Trump has approved the potential sale of precision-guided bomb kits worth $373.6 million to Ukraine, following congressional pressure over stalled arms deliv… [+2303 chars]",,2026-05-10 11:00:20+00:00,wmo,United States,CNA,North-America
5b0a21ebbd212681012743c7d1f8d2d8,2026-05-06T15:23:41Z,Storm,Storm Surge Northland,www.dailymail.com,en,0.2,"Lernen Sie die Männer kennen, die auf der zum Scheitern verurteilten Franklin-Expedition von 1845 ums Leben kamen: DNA-Proben bestätigen die Identität von vier Mitgliedern – darunter eines, das 80 Meilen von seinem Schiff entfernt gefunden wurde. Wissenschaftler haben die Identität von vier weiteren Männern enthüllt, die bei Sir John Franklins gescheiterter Expedition im Jahr 1845 ums Leben kamen.",Meet the men who perished on the doomed 1845 Franklin Expedition: DNA samples confirm the identities of four members - including one found 80 miles away from his ship,Scientists have revealed the identities of four more men who perished in Sir John Franklin's doomed 1845 expedition.,Meet the men who perished on the doomed 1845 Franklin Expedition: DNA samples confirm the identities of four members - including one found 80 miles away from his ship. Scientists have revealed the identities of four more men who perished in Sir John Franklin's doomed 1845 expedition.,"Obviam hominibus qui in Expeditione perdita 1845 Franklin perierunt: DNA exemplaria identitates quattuor membrorum confirmant, incluso uno LXXX miliario ab eius navi invento. Scientistae identitates quattuor hominum aperuerunt qui in expeditione Ioannis Franklini damnati 1845 perierunt.",https://www.dailymail.com/sciencetech/article-15795149/Franklin-Expedition-crew-members-identified.html,https://i.dailymail.com/1s/2026/05/06/16/108416295-0-image-m-9_1778080711570.jpg,,"Scientists have revealed the identities of four men who perished in Sir John Franklin's doomed 1845 expedition.
The Franklin Expedition was an attempt to discover the fabled Northwest Passage throug… [+8123 chars]",,2026-05-10 11:00:20+00:00,wmo,New Zealand,NZ,Oceania
b57c70bc833a2c1ece83a872cad2ce85,2026-05-08T06:00:00Z,Heat Wave,Heat Wave Tualatin Valley,www.naturalnews.com,en,0.2,"Die USA genehmigen ein Präzisionsbombenpaket im Wert von 373,6 Millionen US-Dollar für die Ukraine und erweitern damit die Fähigkeit zu Langstreckenangriffen. Das US-Außenministerium genehmigte am 6. Mai 2026 einen potenziellen Verkauf von 1.532 präzisionsgelenkten JDAM-ER-Bombenbausätzen an die Ukraine im Wert von 373,6 Millionen US-Dollar.","U.S. approves $373.6 million precision bomb package for Ukraine, expanding long-range strike capability","The U.S. State Department approved a potential $373.6 million sale of 1,532 JDAM-ER precision-guided bomb kits to Ukraine on May 6, 2026. The extended-range kits convert unguided bombs into GPS-guided munitions capable of striking targets more than 40 nautica…","U.S. approves $373.6 million precision bomb package for Ukraine, expanding long-range strike capability. The U.S. State Department approved a potential $373.6 million sale of 1,532 JDAM-ER precision-guided bomb kits to Ukraine on May 6, 2026. The extended-range kits convert unguided bombs into GPS-guided munitions capable of striking targets more than 40 nautica…","US $ 373.6 decies centena praecisionem bomb sarcina pro Ucraina approbat, diuturno ictu facultatem dilatandi. Department US Civitatis nostrae approbavit potentialem $37.6 decies centena millia venditionis JDAM-ER 1,532 bombae subtilitatis ad Ucrainam deductae die 6 mensis Maii anno 2026. Protractum rhoncus rhoncus convertunt bombs ingentia in GPS munimenta quae ad scuta percutiendi plus quam 40 nautica...",https://www.naturalnews.com/2026-05-08-us-approves-precision-bomb-package-for-ukraine.html,https://www.naturalnews.com/wp-content/uploads/sites/91/2026/05/Ukraine-War-Airplane-Bombs-Nukes.jpg,,"<ul><li>The U.S. State Department approved a potential $373.6 million sale of 1,532 JDAM-ER precision-guided bomb kits to Ukraine on May 6, 2026.</li><li>The extended-range kits convert unguided bomb… [+6933 chars]",,2026-05-10 11:00:20+00:00,wmo,United States,CNA,North-America
8d09cb3953be2cec61265c83ef706c08,2026-05-06T20:00:19Z,Snow&Ice,Ice United States,www.shtfplan.com,en,0.7,"Die USA genehmigen einen Bombendeal für die Ukraine. Da der Schwerpunkt auf den Treibstoffpreisen liegt, während sich die Krise in der Straße von Hormus ausweitet, vergisst man leicht, dass ein weiterer Krieg weiter wütet und die Vereinigten Staaten ihn weiterhin finanzieren. Washington hat einem Bombendeal für die Ukraine zugestimmt, da diese weiterhin durch … explodiert.",US Approves a Bomb Deal For Ukraine,"With all the focus being on fuel prices as the Strait of Hormuz crisis expands, it was easy to forget that another war continues to rage and the United States continues to fund it. Washington has approved a bomb deal for Ukraine as it continues to blow throug…","US Approves a Bomb Deal For Ukraine. With all the focus being on fuel prices as the Strait of Hormuz crisis expands, it was easy to forget that another war continues to rage and the United States continues to fund it. Washington has approved a bomb deal for Ukraine as it continues to blow throug…","US Bomb fac pro Ucraina probat. Cum omnibus focus in esca pretia sicut Fretum Hormuz discriminis dilatat, facile erat oblivisci aliud bellum saevire et pergere in Civitatibus Foederatis. Washington bomb multum pro Ucraina approbavit quod pergit throug flare ...",https://www.shtfplan.com/war/us-approves-a-bomb-deal-for-ukraine,https://www.shtfplan.com/wp-content/uploads/2024/06/weaponsdeal.jpg,,"With all the focus being on fuel prices as the Strait of Hormuz crisis expands, it was easy to forget that another war continues to rage and the United States continues to fund it. Washington has app… [+2463 chars]",,2026-05-10 11:00:20+00:00,wmo,United States,CNA,North-America
d85b7e17fba2756010d841358689e9ba,2026-05-06T16:33:54Z,Heat Wave,heatwave New South Wales,www.artsjournal.com,en,0.2,"Wie groß ist also das Kulturpublikum? (Vergleiche, die vielleicht zum Umdenken anregen). Gemessen am Umsatz ist der gemeinnützige Kunstsektor klein – etwa 73 Milliarden US-Dollar an Organisationsausgaben im Vergleich zu 1,17 Billionen US-Dollar an der gesamten US-amerikanischen Kunst- und Kulturproduktion. Allein der Jahresumsatz von Disney ist größer als der aller gemeinnützigen US-amerikanischen Kulturinstitutionen im Land …",So Just How Big is the Culture Audience? (comparisons that may make you rethink),"By revenue, the nonprofit arts sector is small — about $73 billion in organizational spending compared to $1.17 trillion in total US arts and cultural production. Disney's annual revenue alone is larger than every US nonprofit cultural institution in the coun…","So Just How Big is the Culture Audience? (comparisons that may make you rethink). By revenue, the nonprofit arts sector is small — about $73 billion in organizational spending compared to $1.17 trillion in total US arts and cultural production. Disney's annual revenue alone is larger than every US nonprofit cultural institution in the coun…","Ita Just quam Big est Culture Audientia? (Comparationes quae recogitare possunt). Proventus, sector non quaestus artium parva est - circa $73 miliarda in norma normarum impendio comparata ad $1.17 trillion in summa US artium et culturae productionis. Solus reditus annui Disney maius est quam omnibus US non prodest institutio culturalis in consilio…",https://www.artsjournal.com/diacritical/2026/05/so-just-how-big-is-the-culture-audience-comparisons-that-may-make-you-rethink.html,https://www.artsjournal.com/diacritical/wordpress/wp-content/uploads/2026/05/https___d3ec1vt3scx7rr.cloudfront.net_files_images_image_1670970322_luce_-_view_from_above_-_3x2.jpg,,"Luce Foundation Center for American Art at the Smithsonian African American Museum
A few months ago I attended a virtual convening of non-profit arts leaders from across America gathering to discuss… [+19337 chars]",,2026-05-10 20:44:37+00:00,acwe,Australia,EAU,Oceania
159ee1e62a21dff7ba0d509f940ac491,2026-05-06T20:15:00Z,Flood,Flood Angelina TX Nacogdoches TX,www.prnewswire.com,en,0.2,"Albemarle gibt Ergebnisse für das erste Quartal 2026 bekannt. CHARLOTTE, NC, 6. Mai 2026 /PRNewswire/ -- Albemarle Corporation (NYSE: ALB), ein weltweit führender Anbieter wesentlicher Elemente für Mobilität, Energie, Konnektivität und Gesundheit, gab heute seine Ergebnisse für das erste Quartal bekannt, das am 31. März 2026 endete. Erstes Quartal…",Albemarle Reports First Quarter 2026 Results,"CHARLOTTE, N.C., May 6, 2026 /PRNewswire/ -- Albemarle Corporation (NYSE: ALB), a global leader in providing essential elements for mobility, energy, connectivity and health, today announced its results for the first quarter ended March 31, 2026. First Quarte…","Albemarle Reports First Quarter 2026 Results. CHARLOTTE, N.C., May 6, 2026 /PRNewswire/ -- Albemarle Corporation (NYSE: ALB), a global leader in providing essential elements for mobility, energy, connectivity and health, today announced its results for the first quarter ended March 31, 2026. First Quarte…","Albemarle Renuntiationes Primae Quartae 2026 Proventus. CHARLOTTE, NC, die 6 Maii 2026 / PRNewswire/ -- Albemarle Corporation (NYSE: ALB), dux globalis elementa essentialia mobilitatis, industriae, connectivity et sanitatis providens, hodie eventus suos pronuntiavit pro quarta prima die 31 Martii 2026. Prima Quarta…",https://www.prnewswire.com/news-releases/albemarle-reports-first-quarter-2026-results-302764556.html,https://mma.prnewswire.com/media/75024/ALBEMARLE_CORPORATION_LOGO_updated.jpg?p=facebook,,"CHARLOTTE, N.C., May 6, 2026 /PRNewswire/ -- Albemarle Corporation (NYSE: ALB), a global leader in providing essential elements for mobility, energy, connectivity and health, today announced its resu… [+48658 chars]",,2026-05-10 20:44:37+00:00,wmo,United States,CNA,North-America
6009cbf4e310e07d8500a3908a11cf8a,2026-05-06T20:17:35Z,Flood,Flood South Australia Cooper Creek,financialpost.com,en,0.2,"OR Royalties meldet im ersten Quartal 2026 einen Anstieg des Cashflows aus dem operativen Geschäft um 56 % gegenüber dem Vorjahr. MONTREAL, 6. Mai 2026 (GLOBE NEWSWIRE) – OR Royalties Inc. („OR Royalties“ oder das „Unternehmen“) (OR: TSX & NYSE) freut sich, seine konsolidierten Finanzergebnisse für das erste Quartal 2026 bekannt zu geben. Die angegebenen Beträge sind in US-Dollar angegeben, es sei denn, …",OR Royalties Reports 56% Year-Over-Year Increase in Cash Flows from Operations in Q1 2026,"MONTREAL, May 06, 2026 (GLOBE NEWSWIRE) — OR Royalties Inc. (“OR Royalties” or the “Company”) (OR: TSX & NYSE) is pleased to announce its consolidated financial results for the first quarter of 2026. Amounts presented are in United States dollars, except wher…","OR Royalties Reports 56% Year-Over-Year Increase in Cash Flows from Operations in Q1 2026. MONTREAL, May 06, 2026 (GLOBE NEWSWIRE) — OR Royalties Inc. (“OR Royalties” or the “Company”) (OR: TSX & NYSE) is pleased to announce its consolidated financial results for the first quarter of 2026. Amounts presented are in United States dollars, except wher…","OR Royalties Reports 56% Annus Plus-Annus Incrementum in Nummis defluit ab Operationibus in Q1 2026. MONTREAL, May 06, 2026 (GLOBE NEWSWIRE) - OR Regalia Inc. (""OR Regalia"" vel ""Societas"") (OR: TSX & NYSE) consentit nuntiare eius Civitates solidatas, praeter nummarios proventus primorum partium in 2026.",https://financialpost.com/globe-newswire/or-royalties-reports-56-year-over-year-increase-in-cash-flows-from-operations-in-q1-2026,,,"A reconciliation of net earnings to adjusted net earnings is presented below:
<table><tr><td> </td><td>Three months endedMarch 31,</td><td> </td></tr><tr><td> </td><td>2026</td><td> </td><td>2025</t… [+13474 chars]",,2026-05-10 20:44:37+00:00,wmo,Australia,CAU,Oceania
ac0e18d3b62f6c41a1cafc254151fde9,2026-05-06T20:30:00Z,Flood,Flooding Maui HI,www.prnewswire.com,en,0.2,"Franco-Nevada veröffentlicht Asset-Handbuch und Nachhaltigkeitsbericht 2026. (in US-Dollar, sofern nicht anders angegeben) TORONTO, 6. Mai 2026 /PRNewswire/ – Franco-Nevada Corporation („Franco-Nevada“ oder das „Unternehmen“) (TSX: FNV) (NYSE: FNV) gibt die Veröffentlichung seines 2026 Asset Handbook und 2026 Sustainability Report bekannt. „Unsere Vermögensverwaltung …",Franco-Nevada Launches 2026 Asset Handbook and Sustainability Report,"(in U.S. dollars unless otherwise noted) TORONTO, May 6, 2026 /PRNewswire/ - Franco-Nevada Corporation (""Franco-Nevada"" or the ""Company"") (TSX: FNV) (NYSE: FNV) announces the publication of its 2026 Asset Handbook and 2026 Sustainability Report. ""Our Asset Ha…","Franco-Nevada Launches 2026 Asset Handbook and Sustainability Report. (in U.S. dollars unless otherwise noted) TORONTO, May 6, 2026 /PRNewswire/ - Franco-Nevada Corporation (""Franco-Nevada"" or the ""Company"") (TSX: FNV) (NYSE: FNV) announces the publication of its 2026 Asset Handbook and 2026 Sustainability Report. ""Our Asset Ha…","Franco-Nevada Launches 2026 Asset Handbook and Sustainability Report. TORONTO, die 6 Maii 2026 /PRNewswire/ - Corporation Franco-Nevada (""Franco-Nevada"" vel ""Societas"") (TSX: FNV) (NYSE: FNV) nuntiat publicationem sui 2026 Asset Enchiridion et 2026 Sustinebilitatem Report. ""Nostra Asset Ha ...",https://www.prnewswire.com/news-releases/franco-nevada-launches-2026-asset-handbook-and-sustainability-report-302764681.html,,,"(in U.S. dollars unless otherwise noted)
TORONTO, May 6, 2026 /PRNewswire/ - Franco-Nevada Corporation (""Franco-Nevada"" or the ""Company"") (TSX: FNV) (NYSE: FNV) announces the publication of its 2026… [+13939 chars]",,2026-05-10 20:44:37+00:00,wmo,United States,CNA,North-America
6e228e43813ab54872dd08d1c5eb991f,2026-05-06T21:02:00Z,Flood,Flashflood Canada,www.globenewswire.com,en,0.2,"Endeavour Silver gibt Finanzergebnisse für das erste Quartal 2026 bekannt. VANCOUVER, British Columbia, 6. Mai 2026 (GLOBE NEWSWIRE) – Endeavour Silver Corp. („Endeavour“ oder das „Unternehmen“) (NYSE: EXK; TSX: EDR) gibt seine Finanz- und Betriebsergebnisse für die drei Monate bis zum 31. März 2026 bekannt. Das Unternehmen wird eine Konferenz veranstalten…",Endeavour Silver Announces Q1 2026 Financial Results,"VANCOUVER, British Columbia, May 06, 2026 (GLOBE NEWSWIRE) -- Endeavour Silver Corp. (“Endeavour” or the “Company”) (NYSE: EXK; TSX: EDR) announces its financial and operating results for the three months ended March 31, 2026. The Company will host a conferen…","Endeavour Silver Announces Q1 2026 Financial Results. VANCOUVER, British Columbia, May 06, 2026 (GLOBE NEWSWIRE) -- Endeavour Silver Corp. (“Endeavour” or the “Company”) (NYSE: EXK; TSX: EDR) announces its financial and operating results for the three months ended March 31, 2026. The Company will host a conferen…","Cona Argentum annuntiationes Q1 2026 Proventus Financial. VANCOUVER, British Columbia, die 6 mensis Maii, 2026 (GLOBE NEWSWIRE) -- Cura Argentum Corp. (""Cona"" seu ""Societas"") (NYSE: EXK; TSX: EDR) nuntiat suum oeconomicum et operantem proventum tribus mensibus ante diem tertium Kalendas Aprilis 2026. Collatio conferendi exercitum habebit.",https://www.globenewswire.com/news-release/2026/05/06/3289455/0/en/Endeavour-Silver-Announces-Q1-2026-Financial-Results.html,https://ml.globenewswire.com/Resource/Download/5584e194-3e6f-4531-8afe-2b9b1662a648,,"VANCOUVER, British Columbia, May 06, 2026 (GLOBE NEWSWIRE) -- Endeavour Silver Corp. (Endeavour or the Company) (NYSE: EXK; TSX: EDR) announces its financial and operating results for the three month… [+38049 chars]",,2026-05-10 20:44:37+00:00,wmo,Canada,NEN,North-America
477f91472262294a5af071d11d158900,2026-05-06T22:07:00Z,Flood,Flashflood Cass IL Fulton IL Mason IL,www.globenewswire.com,en,0.2,"Taseko gibt weiterhin starke Betriebs- und Finanzergebnisse im ersten Quartal 2026 bekannt. VANCOUVER, British Columbia, 6. Mai 2026 (GLOBE NEWSWIRE) – Taseko Mines Limited (TSX: TKO; NYSE American: TGB; LSE: TKO) („Taseko“ oder das „Unternehmen“) meldet für das erste Quartal 2026 ein bereinigtes EBITDA* von 93 Millionen US-Dollar und einen Gewinn aus Bergbaubetrieben zuvor erschöpfen…",Taseko Announces Continued Strong Operational and Financial Results in the First Quarter 2026,"VANCOUVER, British Columbia, May 06, 2026 (GLOBE NEWSWIRE) -- Taseko Mines Limited (TSX: TKO; NYSE American: TGB; LSE: TKO) (""Taseko"" or the ""Company"") reports first quarter 2026 Adjusted EBITDA* of $93 million and Earnings from mining operations before deple…","Taseko Announces Continued Strong Operational and Financial Results in the First Quarter 2026. VANCOUVER, British Columbia, May 06, 2026 (GLOBE NEWSWIRE) -- Taseko Mines Limited (TSX: TKO; NYSE American: TGB; LSE: TKO) (""Taseko"" or the ""Company"") reports first quarter 2026 Adjusted EBITDA* of $93 million and Earnings from mining operations before deple…","Taseko Announces Fortis Operationales et Financiales Proventus in Parte Prima 2026. VANCOUVER, British Columbia, die 06, 2026 (GLOBE NEWSWIRE) -- Taseko fodinae limitatae (TSX: TKO; NYSE American: TGB; LSE: TKO) (""Taseko"" seu ""Societas"") refert primam quartam decies centena millia decies centena millia operationum et deminutum.",https://www.globenewswire.com/news-release/2026/05/06/3289499/0/en/Taseko-Announces-Continued-Strong-Operational-and-Financial-Results-in-the-First-Quarter-2026.html,https://ml.globenewswire.com/Resource/Download/1337acab-c25e-4bd8-b99c-1a6d6a7f69c8,,"VANCOUVER, British Columbia, May 06, 2026 (GLOBE NEWSWIRE) -- Taseko Mines Limited (TSX: TKO; NYSE American: TGB; LSE: TKO) (""Taseko"" or the ""Company"") reports first quarter 2026 Adjusted EBITDA* of … [+61709 chars]",,2026-05-10 20:44:37+00:00,wmo,United States,CNA,North-America
869b5e57abf6bc6af6c4e08188345974,2026-05-06T22:10:04Z,Thunderstorm,Thunderstorm Botswana,financialpost.com,en,0.2,"Taseko gibt weiterhin starke Betriebs- und Finanzergebnisse im ersten Quartal 2026 bekannt. VANCOUVER, British Columbia, 6. Mai 2026 (GLOBE NEWSWIRE) – Taseko Mines Limited (TSX: TKO; NYSE American: TGB; LSE: TKO) („Taseko“ oder das „Unternehmen“) meldet für das erste Quartal 2026 ein bereinigtes EBITDA* von 93 Millionen US-Dollar und einen Gewinn aus Bergbaubetrieben zuvor erschöpfen…",Taseko Announces Continued Strong Operational and Financial Results in the First Quarter 2026,"VANCOUVER, British Columbia, May 06, 2026 (GLOBE NEWSWIRE) — Taseko Mines Limited (TSX: TKO; NYSE American: TGB; LSE: TKO) (“Taseko” or the “Company”) reports first quarter 2026 Adjusted EBITDA* of $93 million and Earnings from mining operations before deplet…","Taseko Announces Continued Strong Operational and Financial Results in the First Quarter 2026. VANCOUVER, British Columbia, May 06, 2026 (GLOBE NEWSWIRE) — Taseko Mines Limited (TSX: TKO; NYSE American: TGB; LSE: TKO) (“Taseko” or the “Company”) reports first quarter 2026 Adjusted EBITDA* of $93 million and Earnings from mining operations before deplet…","Taseko Announces Fortis Operationales et Financiales Proventus in Parte Prima 2026. VANCOUVER, British Columbia, die 06, 2026 (GLOBE NEWSWIRE) — Taseko fodinae limitatae (TSX: TKO; NYSE American: TGB; LSE: TKO) (""Taseko"" seu ""Societas"") nuntiat primam quartam partem MMXXVI $93 decies centena millia operationum ante deplet…",https://financialpost.com/globe-newswire/taseko-announces-continued-strong-operational-and-financial-results-in-the-first-quarter-2026,https://smartcdn.gprod.postmedia.digital/financialpost/wp-content/uploads/2026/05/florence-copper-wellfield.jpeg,,"Non-GAAP Performance Measures continued
Earnings from mining operations before depletion, amortization and non-recurring items
Earnings from mining operations before depletion, amortization and non… [+13103 chars]",,2026-05-10 20:44:37+00:00,wmo,Botswana,WSAF,Africa
