index,published,topic,term,domain,language,valid,de,title,description,en,la,url,image,archive,content,quote,added,feed,country,ipcc,continent
134127bd56f29203ac9942952f9c38ac,2026-04-15T10:00:00Z,Flood,Flood Barry MI,www.bigblueview.com,en,0.2,"Giants-Neuigkeiten, 15.04.: Gedanken von Joe Schoen vor dem Entwurf, Handelsgerüchte zum Entwurf. Schlagzeilen der New York Giants am Mittwoch","Giants news, 4/15: Joe Schoen pre-draft thoughts, draft trade rumors",New York Giants headlines for Wednesday,"Giants news, 4/15: Joe Schoen pre-draft thoughts, draft trade rumors. New York Giants headlines for Wednesday","Gigantes nuntium, 4/15: Joe Schoen prae-captura cogitationum, rumorum captura artis. New York Gigantes headlines pro Mercurii",https://www.bigblueview.com/new-york-giants-news/159334/joe-schoen-press-conference-dexter-lawrence-contract-nfl-draft-marcus-freeman,https://s.yimg.com/ny/api/res/1.2/zfAmcOt3aY3HfqO7VFHaqw--/YXBwaWQ9aGlnaGxhbmRlcjt3PTEyMDA7aD04MDA7Y2Y9d2VicA--/https://media.zenfs.com/en/sb_nation_articles_115/c5176e2243c44683c2d372e1d6007aee,,"Good morning, New York Giants fans!
<ul><li>NY Giants GM Joe Schoen: Well see where it goes with Dexter Lawrence
</li><li>NFL Draft trade rumors: Are the Dallas Cowboys trying to jump the Giants?
… [+5509 chars]",,2026-04-17 16:00:29+00:00,wmo,United States,CNA,North-America
053658505994555d1585bb6c1e3da344,2026-04-04T16:24:34Z,Precipitation,Rain Eswatini,hoopshype.com,en,0.3,"Die 20 größten Defensivzentren aller Zeiten: Die HoopsHype-Liste. Wir haben die Liste unserer 78 besten defensiven NBA-Spieler aller Zeiten in fünf Positionen aufgeteilt: Point Guards, Shooting Guards,",20 greatest defensive centers ever: The HoopsHype list,"We have taken our 78 greatest defensive NBA players ever list and split it into five positions: point guards, shooting guards,","20 greatest defensive centers ever: The HoopsHype list. We have taken our 78 greatest defensive NBA players ever list and split it into five positions: point guards, shooting guards,","20 Centra maxima defensiva semper: HoopsHype album. Nostras 78 maximas defensivas NBA lusores semper recensevimus et in quinque positiones divisimus: custodes punctum, custodes dirigentes;",https://hoopshype.com/lists/20-greatest-defensive-centers-ever-the-hoopshype-list/,https://s.yimg.com/ny/api/res/1.2/7v445aBaFAV5SQtt4HZxcA--/YXBwaWQ9aGlnaGxhbmRlcjt3PTEyMDA7aD02NzU7Y2Y9d2VicA--/https://media.zenfs.com/en/hoops_hype_usa_today_sports_articles_974/406951946a176caf2bda747ca88c1805,,"We have taken our 79 greatest defensive NBA players ever list and split it into five positions: point guards, shooting guards, small forwards, power forwards and centers. The players who received som… [+26946 chars]",,2026-04-17 16:00:29+00:00,wmo,Eswatini,ESAF,Africa
ef2f7e577f7ac6c3c6629244b27a96e8,2026-04-05T00:41:49Z,Heat Wave,heatwave Western Australia,www.usatoday.com,en,0.3,"Das Playoff-Szenario der Lakers ist getrübt, da Luka Doncic und Austin Reaves verletzt sind. Die Los Angeles Lakers haben nach dem NBA All-Star Game eine starke Leistung gezeigt, um den dritten Platz im Westen zu erreichen.","Lakers playoff scenario clouded with Luka Doncic, Austin Reaves injured",The Los Angeles Lakers produced a strong effort following the NBA All-Star Game to reach the third seed in the West.,"Lakers playoff scenario clouded with Luka Doncic, Austin Reaves injured. The Los Angeles Lakers produced a strong effort following the NBA All-Star Game to reach the third seed in the West.","Turpis playoffs missionis obscuratae cum Luka Doncic, Austin Reaves laesit. Los Angeles Lakers validum conatum edidit post NBA All-Star Ludus ut semen tertium in Occidente perveniat.",https://www.usatoday.com/story/sports/nba/lakers/2026/04/04/luka-doncic-austin-reaves-la-lakers-injuries-playoffs/89471706007/,https://s.yimg.com/ny/api/res/1.2/.wzkWemWlRMS98qw8b1DIQ--/YXBwaWQ9aGlnaGxhbmRlcjt3PTEyMDA7aD04MDA7Y2Y9d2VicA--/https://media.zenfs.com/en/usa_today_sports_articles_558/a414e2cc06ae81584587b9d9a9588c20,,"The Los Angeles Lakers produced a strong effort following the NBA All-Star Game to reach the third seed in the Western Conference standings.
The Lakers were looking like a true playoff contender, ha… [+3083 chars]",,2026-04-17 16:00:29+00:00,acwe,Australia,CAU,Oceania
b5727626cf735e7364952dba4a92905b,2026-04-08T11:32:27Z,Flood,Flashflood Genesee NY Monroe NY,financialpost.com,en,0.3,"Rio Silver Inc. meldet: Erste Silber-, Gold- und Bleigewinnung von 85 %, 74 % bzw. 77 % aus Maria Norte in Zentralperu. Erste Testarbeiten belegen eine gute Silberausbeute, hochgradige Konzentrate und einen niedrigen Arsengehalt durch konventionelle Flotationsmethoden im historischen peruanischen Silberbezirk Vancouver, British Columbia, 8. April 2026 (GLOBE NEWSWIRE) – Rio Silver Inc. („Rio Sil…“","Rio Silver Inc. Reports: Initial Silver – Gold – Lead Recoveries of 85 %, 74 % and 77% Respectively From the Maria Norte in Central Peru","Initial Test Work Demonstrates Good Silver Recovery, High Grade Concentrates and Low Arsenic, through conventional flotation methods, in Historic Peruvian Silver District VANCOUVER, British Columbia, April 08, 2026 (GLOBE NEWSWIRE) — Rio Silver Inc. (“Rio Sil…","Rio Silver Inc. Reports: Initial Silver – Gold – Lead Recoveries of 85 %, 74 % and 77% Respectively From the Maria Norte in Central Peru. Initial Test Work Demonstrates Good Silver Recovery, High Grade Concentrates and Low Arsenic, through conventional flotation methods, in Historic Peruvian Silver District VANCOUVER, British Columbia, April 08, 2026 (GLOBE NEWSWIRE) — Rio Silver Inc. (“Rio Sil…","Rio Silver Inc. Renuntiationes: Argentum initiale - Aurum - Recuperationes plumbi 85 %, 74% et 77% Respective A Maria Norte in Central Peru. Initialis Testis Opus demonstrat bonum Argentum Recuperatio, High Gradus intendit et Arsenicum, per rationes conventionales flotationum, in historica Peruviana District Argenti VANCOUVER, British Columbia, die 8 Aprilis, 2026 (GLOBE NEWSWIRE) — Rio Silver Inc. (""Rio Sil...",https://financialpost.com/globe-newswire/rio-silver-inc-reports-initial-silver-gold-lead-recoveries-of-85-74-and-77-respectively-from-the-maria-norte-in-central-peru,,,"We are focused on advancing toward bulk sampling, concentrate generation, and processing in 2026 and 2027, and we are highly encouraged by the progress being made. The months ahead are expected to be… [+4279 chars]",,2026-04-17 16:00:29+00:00,wmo,United States,CNA,North-America
935e9dace9e021daa86359cf8e2ec307,2026-04-09T23:19:25Z,Wildfire,Wildfire West Bengal,www.vanquishthefoe.com,en,0.3,"Rangliste der Big 12 Quarterbacks im Jahr 2026: Wo steht Bear Bachmeier von BYU?. Die Fußballsaison 2026 ist noch einige Monate entfernt. Also, welche Jahreszeit ist es? Es ist Ranking-Saison. Ja, es ist an der Zeit, eine Rangliste der Big 12-Quarterbacks zu erstellen, die voraussichtlich im Jahr 2026 für ihre jeweiligen Programme starten werden. In den Big 12 gibt es eine enorme Fluktuation in Bezug auf …",Ranking the Big 12 Quarterbacks in 2026: Where Does BYU’s Bear Bachmeier Stand?,"The 2026 football season is still several months away. So what season is it? It’s ranking season. Yes, it’s time to rank the Big 12 quarterbacks who are projected to start for their respective programs in 2026. There is massive turnover in the Big 12 in regar…","Ranking the Big 12 Quarterbacks in 2026: Where Does BYU’s Bear Bachmeier Stand?. The 2026 football season is still several months away. So what season is it? It’s ranking season. Yes, it’s time to rank the Big 12 quarterbacks who are projected to start for their respective programs in 2026. There is massive turnover in the Big 12 in regar…","Ranking Big 12 Quarterbacks in 2026: Where Does BYU's Bear Bachmeier Stand?. 2026 Tempus eu tempus adhuc pluribus mensibus abest. Quod tempus est? Nulla tempus est. Etiam tempus est ponere Big XII quarteria, quae proiciuntur ut committitur pro respectivis programmatis in 2026. In Big 12 in regar est ingens turnover.",https://www.vanquishthefoe.com/byu-football/26901/ranking-the-big-12-quarterbacks-in-2026-where-does-byus-bear-bachmeier-stand,https://s.yimg.com/ny/api/res/1.2/CgD7ij3zQdBbBtuxkuVDrw--/YXBwaWQ9aGlnaGxhbmRlcjt3PTEyMDA7aD04MDE7Y2Y9d2VicA--/https://media.zenfs.com/en/sb_nation_articles_115/ba9c567e8476a3701ef8f8d1150400d7,,"The 2026 football season is still several months away. So what season is it? Its ranking season.
Yes, its time to rank the Big 12 quarterbacks who are projected to start for their respective program… [+10843 chars]",,2026-04-17 16:00:29+00:00,wmo,India,SAS,Asia
c62cb094fe072f4caafb5a5e3ac7a983,2026-04-11T03:07:07Z,Flood,Flooding Gibson IN Knox IN,www.thechampaignroom.com,en,0.3,"10 Spieler, die Illinois helfen könnten, das Transferportal zu gewinnen. ﻿Welche Portalfunde könnten Illinois zum Offseason-Champion der College-Basketballwelt machen?",10 players who could help Illinois win the transfer portal,﻿What portal finds could make Illinois offseason champions of the college basketball world?,10 players who could help Illinois win the transfer portal. ﻿What portal finds could make Illinois offseason champions of the college basketball world?,10 histriones qui auxilium Illinois portal translationis vincere poterant. Quae portae invenit propugnatores Illinois offseason efficere ultrices mundi collegii?,https://www.thechampaignroom.com/illinois-fighting-illini-basketball-news/53406/10-players-who-could-help-illinois-win-the-transfer-portal-fighting-illini-brad-underwood-john-blackwell-acaden-lewis-ncaa-big-ten,https://s.yimg.com/ny/api/res/1.2/_2_ubm8xiw5oUo0qSNKzlQ--/YXBwaWQ9aGlnaGxhbmRlcjt3PTEyMDA7aD04MDA7Y2Y9d2VicA--/https://media.zenfs.com/en/sb_nation_articles_115/c755b12a0bf3f2bc4ecae08f567711c3,,"Tis the season for words like bag and speed dating in reference to college hoops portal activity.
The Illini are always an ever-present force in Portal Kombat. Whether its their most notorious misse… [+12954 chars]",,2026-04-17 16:00:29+00:00,wmo,United States,CNA,North-America
fd4ddfe153cf1deb5a4548beaefd2ded,2026-04-13T01:48:10Z,Storm,Storm Surge Southern Chatham Strait,sports.yahoo.com,en,0.3,Cooper Flaggs Rookie-Saison endet mit einer Knöchelverstauchung im Saisonfinale der Mavericks. Flaggs Rookie-Jahr ging am Sonntag unerwartet früh zu Ende.,Cooper Flagg's rookie season ends with ankle sprain in Mavericks' season finale,Flagg's rookie year came to an unexpectedly early end on Sunday.,Cooper Flagg's rookie season ends with ankle sprain in Mavericks' season finale. Flagg's rookie year came to an unexpectedly early end on Sunday.,Cooper Flagg's rookie season ends with tals disprain in Mavericks' season finale. Flagg rookie annus ad extremum inopinato die Dominica.,https://sports.yahoo.com/nba/article/cooper-flaggs-rookie-season-ends-with-ankle-sprain-in-mavericks-season-finale-014810014.html,https://s.yimg.com/ny/api/res/1.2/CVZ6ax9RCS4gt6SHVBEccg--/YXBwaWQ9aGlnaGxhbmRlcjt3PTEyMDA7aD04MDA7Y2Y9d2VicA--/https://d29szjachogqwa.cloudfront.net/images/2026-04/f143700b-605a-4e10-aa12-e9da72f9e678,,"The Dallas Mavericks season was set to end on Sunday anyway, but an injury took star rookie Cooper Flagg out a little earlier. Flagg exited Dallas season finale against the Chicago Bulls in the secon… [+1181 chars]",,2026-04-17 16:00:29+00:00,wmo,United States,CNA,North-America
c263a2a5357a45a503e9bbf9aa3637da,2026-04-13T01:48:10Z,Wildfire,Wildfire Assam,sports.yahoo.com,en,0.3,Cooper Flagg verlässt das Saisonfinale der Mavericks mit einer Knöchelverstauchung. Flaggs Rookie-Jahr ging am Sonntag unerwartet früh zu Ende.,Cooper Flagg exits Mavericks' season finale with ankle sprain,Flagg's rookie year came to an unexpectedly early end on Sunday.,Cooper Flagg exits Mavericks' season finale with ankle sprain. Flagg's rookie year came to an unexpectedly early end on Sunday.,Cooper Flagg exit Maverici tempore ultimo cum talo distorsio. Flagg rookie annus ad extremum inopinato die Dominica.,https://sports.yahoo.com/nba/article/cooper-flagg-exits-mavericks-season-finale-with-ankle-sprain-014810387.html,https://s.yimg.com/ny/api/res/1.2/CVZ6ax9RCS4gt6SHVBEccg--/YXBwaWQ9aGlnaGxhbmRlcjt3PTEyMDA7aD04MDA7Y2Y9d2VicA--/https://d29szjachogqwa.cloudfront.net/images/2026-04/f143700b-605a-4e10-aa12-e9da72f9e678,,"The Dallas Mavericks season was set to end on Sunday anyway, but an injury took star rookie Cooper Flagg out a little earlier. Flagg exited Dallas season finale against the Chicago Bulls in the secon… [+1275 chars]",,2026-04-17 16:00:29+00:00,wmo,India,SAS,Asia
5b396c66a8279508cea11ea91d52bf4a,2026-04-13T08:00:00Z,Flood,Flood Erie NY Wyoming NY,stylebyemilyhenderson.com,en,0.3,"Orlando ist ZURÜCK: Er hilft seiner besten Freundin Chad, einen spanischen Bungalow in einen… spanischen Bungalow zu verwandeln!. Der talentierte Orlando Soria ist mit einem neuen Projekt zurück! Diesmal ist es ein spanischer Bungalow, den sein bester Freund gerade gekauft hat. Kommen Sie und lesen Sie die Hintergrundgeschichte.",Orlando Is BACK: Helping His Bestie Chad Transform A Spanish Bungalow Into A… Spanish Bungalow!,The talented Orlando Soria is back with a new project! This time it's a Spanish Bungalow his best friend just bought. Come read the backstory.,Orlando Is BACK: Helping His Bestie Chad Transform A Spanish Bungalow Into A… Spanish Bungalow!. The talented Orlando Soria is back with a new project! This time it's a Spanish Bungalow his best friend just bought. Come read the backstory.,Orlandus BACK: Auxilio Bestie Chad Transformat Hispanica Bungalow in A… Hispanica Bungalow!. Orlando Soria ingeniosus reversus est cum novo incepto! Hoc tempore suus amicus Bungalow Hispanicus modo emit. Come read backstory.,https://stylebyemilyhenderson.com/transforming-a-spanish-bungalow-intro,https://stylebyemilyhenderson.com/wp-content/uploads/2026/04/Emily-Henderson_Orlando-Soria_New-Project_Spanish-Bungalow_Intro-Story_OPENER.jpg,,"I met Chad (in 2018?) at my friend Matthew’s house in Palm Springs. I could immediately tell we had a lot in common. When you’re meeting people by a pool in the desert, you usually end up having dumb… [+10434 chars]",,2026-04-17 16:00:29+00:00,wmo,United States,CNA,North-America
8def6c316b76cd3808a45225441e2427,2026-04-15T02:27:00Z,Wildfire,Wildfire Madhya Pradesh,www.sun-sentinel.com,en,0.3,"Heat verliert Adebayo, führt spät, fällt im Play-in mit 127-126 im Over gegen die Hornets, gegen Ende der Saison. CHARLOTTE – Der Play-In-Magie ist verschwunden. Und das gilt auch für die Miami Heat. Nachdem die Heat in den letzten drei Jahren die tückische Play-in-Runde gemeistert haben, um die Playoffs und sogar das NBA-Finale im Jahr 2023 zu erreichen, ist die Serie von sechs aufeinanderfolgenden Saisons in den Playoffs vorbei …","Heat lose Adebayo, late leads, fall 127-126 in OT to Hornets in play-in as season comes to end","CHARLOTTE — The play-in magic is gone. And so are the Miami Heat. After navigating the treacherous play-in round the past three years to make it to the playoffs, and even the NBA Finals in 2023, the Heat’s run of six consecutive seasons in the playoffs is ove…","Heat lose Adebayo, late leads, fall 127-126 in OT to Hornets in play-in as season comes to end. CHARLOTTE — The play-in magic is gone. And so are the Miami Heat. After navigating the treacherous play-in round the past three years to make it to the playoffs, and even the NBA Finals in 2023, the Heat’s run of six consecutive seasons in the playoffs is ove…","Calor amittit Adebayo, sero ducit, cadunt 127-126 in OT ad crabrones in fabula-in tempore finitur. CHARLOTTE — Fabula in magica abiit. Ita sunt Miami Caloris. Postquam navigantes fallacis fabulae in circum praeteritis tribus annis ut eam in lusoriis ac etiam NBA finalibus 2023 faceremus, aestus cursus sex continuis temporibus in playoffs est acem…",https://www.sun-sentinel.com/2026/04/14/heat-lose-adebayo-late-leads-fall-127-126-in-ot-to-hornets-in-play-in-as-season-comes-to-end/,https://s.yimg.com/cv/apiv2/sports/share/PD_010626-Social_Share_GENRIC_YAHOO_SPORTS-1200x630.jpg,,"CHARLOTTE The play-in magic is gone. And so are the Miami Heat.
After navigating the treacherous play-in round the past three years to make it to the playoffs, and even the NBA Finals in 2023, the H… [+5220 chars]",,2026-04-17 16:00:29+00:00,wmo,India,SAS,Asia
a56de2d9382b66365132aa22d79a2c73,2026-04-15T09:00:46Z,Flood,Flood King WA,nymag.com,en,0.3,"Stellen Sie Alvin Braggs Methoden in Frage, aber die Zahlen lügen nicht. Der Bezirksstaatsanwalt von Manhattan, Alvin Bragg, hat bewiesen, dass eine „harte Haltung gegenüber Kriminalität“ nicht notwendig ist, um die öffentliche Sicherheit in New York zu gewährleisten.","Question Alvin Bragg’s Methods, But the Numbers Don’t Lie",Manhattan District Attorney Alvin Bragg has proved that a “tough on crime” attitude isn’t necessary to achieve public safety in New York.,"Question Alvin Bragg’s Methods, But the Numbers Don’t Lie. Manhattan District Attorney Alvin Bragg has proved that a “tough on crime” attitude isn’t necessary to achieve public safety in New York.","Quaestio Alvin Bragg's Methodi, Numeri autem non mentiuntur. Manhattan Districtus Attorney Alvin Bragg probavit ""lentum sceleris"" habitum non esse necessarium ad salutem publicam in New York consequendam.",http://nymag.com/intelligencer/article/question-alvin-braggs-methods-but-the-numbers-dont-lie.html,https://pyxis.nymag.com/v1/imgs/969/f2a/b4e2af7c7d6a7d73723dfe24a448e915c3-alvinbragg-success.1x.rsocial.w1200.jpg,,"Alvin Bragg does not like to, well, brag about his record as Manhattan District Attorney, but the numbers dont lie.
The ultimate metric is that shootings are down during my tenure, down 70 percent i… [+7991 chars]",,2026-04-17 16:00:29+00:00,wmo,United States,CNA,North-America
b65ae70f522d9900073bccd9f50b5af8,2026-04-16T10:00:00Z,Storm,Storm Surge India,people.com,en,0.3,Wo sind die „Jail Blazers“ jetzt? Einblicke in das Leben der Portland-Basketballspieler nach Kontroversen auf und neben dem Spielfeld. Die Portland Trail Blazers wurden Ende der 90er und 2000er Jahre wegen Fehlverhaltens auf dem Spielfeld und außergerichtlicher Strafanzeigen als „Jail Blazers“ bekannt,Where are the 'Jail Blazers' Now? Inside the Portland Basketball Players' Lives After Controversy On and Off the Court,The late ‘90s and 2000s Portland Trail Blazers became known as the 'Jail Blazers' for on-court misbehavior and off-court criminal charges,Where are the 'Jail Blazers' Now? Inside the Portland Basketball Players' Lives After Controversy On and Off the Court. The late ‘90s and 2000s Portland Trail Blazers became known as the 'Jail Blazers' for on-court misbehavior and off-court criminal charges,Ubi sunt 'Carceres Blazers' Nunc? Intra Portland Basketball Histriones Vitas Post Controversiam De et Off Curia. Nuper '90s et 2000s Portland Trail Blazers notum factum est ut 'Jail Blazers' pro in curia culpae et extemporalis criminibus,https://people.com/where-are-the-jail-blazers-now-11948982,https://s.yimg.com/ny/api/res/1.2/jWbn1N3_CsE.awSkqbh93w--/YXBwaWQ9aGlnaGxhbmRlcjt3PTEyMDA7aD04MDA7Y2Y9d2VicA--/https://media.zenfs.com/en/people_218/908e999e8bb2a3d970320ea7665690b1,,"In the late 90s and early 2000s, the Portland Trail Blazers earned themselves the catchy, but controversial nickname, the ""Jail Blazers.""
In 1994, Bob Whitsitt became general manager of the Trail Bl… [+9635 chars]",,2026-04-17 16:00:29+00:00,wmo,India,SAS,Asia
05b2bdeddb76f9b64a377446ca5ae030,2026-04-08T14:19:37Z,Storm,Storm Australia,hackread.com,en,0.8,"Storm-1175 setzt Medusa-Ransomware innerhalb von 24 Stunden nach Offenlegung des Fehlers ein. Microsoft-Forscher haben eine schnelllebige Gruppe, Storm-1175, aufgedeckt, die Hochgeschwindigkeits-Medusa-Ransomware-Angriffe gegen den Gesundheits- und Bildungssektor in Großbritannien, den USA und Australien startet, indem sie Sicherheitslücken in nur 24 Stunden ausnutzt.",Storm-1175 Deploys Medusa Ransomware Within 24 Hours of Flaw Disclosure,"Microsoft researchers have uncovered a fast-moving group, Storm-1175, launching high-speed Medusa ransomware attacks against healthcare and education sectors in the UK, US, and Australia by exploiting security flaws in as little as 24 hours.","Storm-1175 Deploys Medusa Ransomware Within 24 Hours of Flaw Disclosure. Microsoft researchers have uncovered a fast-moving group, Storm-1175, launching high-speed Medusa ransomware attacks against healthcare and education sectors in the UK, US, and Australia by exploiting security flaws in as little as 24 hours.","Storm-1175 Explicat Medusam Ransomware Within 24 Horae Flaw Disclosure. Microsoft Inquisitores detexerunt coetus velocissimi, Storm-1175, altum celeritatem Medusae redemptionis inducentes contra sectores sanitatis et educationis in UK, US, et Australia per quam minimum viginti horarum vitia opprimunt.",https://hackread.com/storm-1175-hackers-24-hour-medusa-ransomware-flaw/,https://hackread.com/wp-content/uploads/2026/04/storm-1175-hackers-24-hour-medusa-ransomware-flaw.jpg,,"A notorious group of hackers is currently causing major disruption globally by deploying the devastating Medusa ransomware. Tracked by Microsoft Threat Intelligence as Storm-1175, these hackers have … [+3833 chars]",,2026-04-17 20:42:50+00:00,wmo,Australia,CAU,Oceania
af8c15ec4be021869441cd4b29b26713,2026-04-03T09:45:13Z,Storm,Storm East UP,www.independent.ie,en,0.7,"Sturm Dave: Die Warnungen könnten erhöht werden, da Met Éireann sagt, dass die Winde am „stärkeren Ende von Gelb“ sein werden. Für das Wochenende gilt eine landesweite Windwarnung mit Status Gelb, wobei Sturm Dave über Ostern „sehr starke“ Winde bringen wird.",Storm Dave: warnings may be upgraded as Met Éireann says winds will be on ‘stronger end of yellow’,"A nationwide Status Yellow wind warning is in place for the weekend, with Storm Dave set to bring “very strong” winds over Easter.","Storm Dave: warnings may be upgraded as Met Éireann says winds will be on ‘stronger end of yellow’. A nationwide Status Yellow wind warning is in place for the weekend, with Storm Dave set to bring “very strong” winds over Easter.","Storm Dave: admonitiones upgraded ut Met Éireann dicit venti erunt in 'finis flavi firmior'. Nationis Status Flavus ventus monitus est in loco volutpat vestibulum, cum Storm Dave posuit ut ventos ""valdissimos"" per Pascha adduceret.",https://www.independent.ie/weather/storm-dave-warnings-may-be-upgraded-as-met-eireann-says-winds-will-be-on-stronger-end-of-yellow/a409021855.html,https://focus.independent.ie/thumbor/jzmlP7R9imxNL8pYcZqHOy0OXks=/629x460/smart/prod-mh-ireland/fa2ecd2b-c5bd-4b36-ba6e-30f45e51fe3b/eb4b1031-ae60-4133-981a-15eb464240f8/t%20Bray%20Head%20cross_5.jpg,,"A nationwide Status Yellow wind warning is in place for the weekend, with Storm Dave set to bring very strong winds over Easter.The warning, which will run from 2pm to 11pm on Saturday, advises the p… [+4054 chars]",,2026-04-18 02:11:17+00:00,wmo,India,SAS,Asia
beede38ca03103853abd8b1342f56f60,2026-04-01T12:54:44Z,Storm,Storm Ireland,www.rte.ie,en,0.8,"Am Osterwochenende wird Irland von stürmischem Wetter heimgesucht. Am Osterwochenende wird das Land von einer Phase unbeständigen und möglicherweise stürmischen Wetters heimgesucht, wobei Met Éireann vor potenziell schädlichen Stürmen und Überschwemmungen an der Küste warnt.",Stormy weather set to hit Ireland over Easter weekend,"A spell of unsettled and possibly stormy weather is set to hit the country over the Easter weekend, with Met Éireann warning of potentially damaging gales and coastal flooding.","Stormy weather set to hit Ireland over Easter weekend. A spell of unsettled and possibly stormy weather is set to hit the country over the Easter weekend, with Met Éireann warning of potentially damaging gales and coastal flooding.","Tempestas turbulenta constituit ut Hiberniam per weekend Paschae feriret. Incantatae et fortasse tempestatum procellae constituuntur ut regionem in weekend paschale feriant, cum Met Éireann monuerit de potentia flaminis damnosis et inundationibus maritimis.",https://www.rte.ie/news/ireland/2026/0401/1566285-ireland-weather/,https://www.rte.ie/images/001b0a45-1600.jpg,,"A spell of unsettled and possibly stormy weather is set to hit the country over the Easter weekend, with Met Éireann warning of potentially damaging gales and coastal flooding.
In an advisory issued… [+943 chars]",,2026-04-18 02:11:17+00:00,wmo,Ireland,NEU,Europe
