index,published,topic,term,domain,language,valid,de,title,description,en,la,url,image,archive,content,quote,added,feed,country,ipcc,continent
9b4d9717441cc594632fc07fcfcbc6e0,2026-05-01T14:30:59Z,Drought,lack of rain Tasmania,brobible.com,en,0.2,"CBS Sports macht einen Rückzieher, nachdem es Wettquoten verwendet hat, um die Auswirkungen von Brendan Sorsbys Glücksspielproblem abzudecken. Anfang dieser Woche erfuhren wir, dass Texas Tech QB Brendan Sorsby das Team verlassen hatte, um sich wegen seiner Spielsucht behandeln zu lassen. Diese Entwicklung war die letzte Geschichte, die ein Licht auf die dunkle Seite der weit verbreiteten Legalisierung von Sportwetten wirft, und CBS Sports …",CBS Sports Backtracks After Using Betting Odds To Cover Impact Of Brendan Sorsby’s Gambling Issue,"Earlier this week, we learned Texas Tech QB Brendan Sorsby had left the team to seek treatment for a gambling addiction. That development was the lastest story to shine a light on the dark side of the widespread legalization of sports betting, and CBS Sports …","CBS Sports Backtracks After Using Betting Odds To Cover Impact Of Brendan Sorsby’s Gambling Issue. Earlier this week, we learned Texas Tech QB Brendan Sorsby had left the team to seek treatment for a gambling addiction. That development was the lastest story to shine a light on the dark side of the widespread legalization of sports betting, and CBS Sports …","CBS Sports Backtracks After Using Betting Odds To Cover Impact Of Brendan Sorsby alea Issue. Ante hac septimana didicimus Texas Tech QB Brendan Sorsby turmam discessisse ad curationem alea PROCLIVITAS quaerendam. Haec progressio fuit fabula postrema ut lux in tenebris late diffusa legalization of ludis sponsio luceret, et CBS ludis ...",https://brobible.com/sports/article/brendan-sorsby-texas-tech-gambling-addiction-cbs-sports-odds/,https://brobible.com/wp-content/uploads/2026/04/Brendan-Sorsby.jpg,,"© Nathan Giese/Avalanche-Journal / USA TODAY NETWORK via Imagn Images
Earlier this week, we learned Texas Tech QB Brendan Sorsby had left the team to seek treatment for a gambling addiction. That de… [+3380 chars]",,2026-05-15 20:59:40+00:00,acwe,Australia,SAU,Oceania
dca4613b092c375ef609ecac530ecdb3,2026-05-02T07:00:00Z,Drought,Lack of Rain Lesotho,cointelegraph.com,en,0.2,"Kraken-Muttergesellschaft Payward schließt Bitnomial-Deal zur Ausweitung von US-Krypto-Derivaten ab. Payward schließt seine Bitnomial-Übernahme ab und sichert sich einen vollständigen CFTC-lizenzierten Derivate-Stack, während die Börsen in den USA einen regulierten Kryptohandel aufbauen.",Kraken parent Payward closes Bitnomial deal to expand US crypto derivatives,"Payward completes its Bitnomial acquisition, securing a full CFTC-licensed derivatives stack as exchanges build regulated crypto trading in the US.","Kraken parent Payward closes Bitnomial deal to expand US crypto derivatives. Payward completes its Bitnomial acquisition, securing a full CFTC-licensed derivatives stack as exchanges build regulated crypto trading in the US.","Kraken parens Payward multum claudit Bitnomial ad derivationes crypto US expandendas. Payward acquisitionem Bitnomialem perficit, plenam derivativam ACERVUM CfTc licentiatum obtinens permutationes crypto concretas mercaturae in US aedificandi.",https://cointelegraph.com/news/kraken-parent-payward-closes-bitnomial-deal-to-expand-us-crypto-derivatives,https://payload.cointelegraph.com/api/article-covers/file/HI%20JAPAN%20What%20is%20an%20investment%20trust-1.jpg?prefix=media%2Farticle-covers,,"Payward, the parent company of Kraken, announced it has completed its acquisition of crypto derivatives venue Bitnomial, giving it control of a fully CFTC-regulated derivatives stack in the United St… [+3052 chars]",,2026-05-15 20:59:40+00:00,edo,Lesotho,ESAF,Africa
a027dde972022fafc7ae0c677534bbe9,2026-05-05T00:10:30Z,Snow&Ice,Freezing Canada,www.app.com,en,0.2,"Auf welchem ​​Kanal laufen die Ducks heute Abend? Auf welchem ​​Kanal laufen die Golden Knights? Die heutige NHL-Playoff-Action umfasst zwei große Spiele: Flyers vs. Hurricanes und Ducks vs. Golden Knights. Hier erfahren Sie, wie Sie zuschauen können.",What channel are the Ducks on tonight? What channel are the Golden Knights on?,Tonight's NHL playoff action features two big games: Flyers vs. Hurricanes and Ducks vs. Golden Knights. Here's how to watch.,What channel are the Ducks on tonight? What channel are the Golden Knights on?. Tonight's NHL playoff action features two big games: Flyers vs. Hurricanes and Ducks vs. Golden Knights. Here's how to watch.,Quid est anates in hac nocte channel? Quo alveo sunt Aurei Equites in ?. NHL playoffs actionis hac nocte notantur duo magni ludi: Volaces vs turbinum et anates vs. Aurei Equites. Hic est quam vigilare.,https://www.app.com/story/sports/nhl/2026/05/04/ducks-golden-knights-may-4-2026/89927456007/,https://s.yimg.com/ny/api/res/1.2/p_eqtKFZi27ws3Yhfie.xw--/YXBwaWQ9aGlnaGxhbmRlcjt3PTEyMDA7aD04MDA7Y2Y9d2VicA--/https://media.zenfs.com/en/app-com-asbury-park-press/445504b81e85909cccefbb85b7163e0a,,"Tonights NHL playoff action features two big games that will help decide which teams move one step closer to the 2026 Stanley Cup Finals.
In the Eastern Conference, the Philadelphia Flyers are feeli… [+3806 chars]",,2026-05-15 20:59:40+00:00,wmo,Canada,NEN,North-America
53304f38703fd5ba23aa1ce7d71d44e9,2026-05-06T07:00:00Z,Cold Wave,cold snap Tasmania,cointelegraph.com,en,0.2,"Kraken ermöglicht berechtigten US-Einzelhändlern den Onshore-Spot-Margin-Handel. Kraken hat über ein bei der CFTC registriertes Unternehmen den regulierten Spot-Margin-Handel für berechtigte US-Einzelhandelsnutzer eingeführt, der eine bis zu 10-fache Hebelwirkung bietet.",Kraken brings spot margin trading onshore for eligible US retail traders,"Kraken has launched regulated spot margin trading for eligible US retail users through a CFTC-registered entity, offering up to 10x leverage.","Kraken brings spot margin trading onshore for eligible US retail traders. Kraken has launched regulated spot margin trading for eligible US retail users through a CFTC-registered entity, offering up to 10x leverage.","Kraken profert macula marginem mercaturam oram ad habiles US scruta negotiatores. Kraken marginem maculam ordinatam negotiandi ad eligendos US grossos per entitatem CfTc descripserunt, offerens usque ad 10x pressionem.",https://cointelegraph.com/news/kraken-opens-regulated-spot-margin-trading-to-us-retail-users,https://payload.cointelegraph.com/api/article-covers/file/HI%20Kraken%20review%20US.jpg?prefix=media%2Farticle-covers,,"Kraken has launched spot margin trading for eligible US retail users on Kraken Pro through a CFTC-registered entity, expanding access to leveraged crypto trading on a regulated domestic platform.
Th… [+2754 chars]",,2026-05-15 20:59:40+00:00,acwe,Australia,SAU,Oceania
342c290d85b99419a48f8af121ad9bce,2026-05-07T00:10:18Z,Storm,Storm Salluit,www.app.com,en,0.2,"Auf welchem ​​Kanal laufen die Ducks heute Abend? Auf welchem ​​Kanal laufen die Golden Knights? Die NHL-Playoffs gehen heute Abend weiter, während Buffalo in Spiel 1 Montreal empfängt und Anaheim in Spiel 2 versucht, die Serie gegen Vegas auszugleichen. Hier erfahren Sie, wie Sie zuschauen können.",What channel are the Ducks on tonight? What channel are the Golden Knights on?,The NHL playoffs continue tonight as Buffalo hosts Montreal for Game 1 and Anaheim tries to even the series against Vegas in Game 2. Here's how to watch.,What channel are the Ducks on tonight? What channel are the Golden Knights on?. The NHL playoffs continue tonight as Buffalo hosts Montreal for Game 1 and Anaheim tries to even the series against Vegas in Game 2. Here's how to watch.,Quid est anates in hac nocte channel? Quo alveo sunt Aurei Equites in ?. NHL ludi pergunt hac nocte ut Buffalo Exercituum Montrealensi pro Ludus 1 et Anaheim etiam seriem contra Vegas in Ludus tentat 2. Hic vigilare est.,https://www.app.com/story/sports/nhl/2026/05/06/golden-knights-ducks-may-6-2026/89958906007/,https://s.yimg.com/ny/api/res/1.2/KCNPeZXDHW8l1udRIYYWAA--/YXBwaWQ9aGlnaGxhbmRlcjt3PTEyMDA7aD04MDA7Y2Y9d2VicA--/https://media.zenfs.com/en/app-com-asbury-park-press/20decb93ed72ac5128f5debb08b73aec,,"The NHL playoffs continue tonight with a fresh series opener in the East and a critical rematch in the West.
The Buffalo Sabres and Montreal Canadiens face off for Game 1 of their semifinal series. … [+3686 chars]",,2026-05-15 20:59:40+00:00,wmo,Canada,NEN,North-America
5624822957adf6c23a05bb2d39035f37,2026-05-08T00:18:34Z,Flood,Flood Tangipahoa LA,www.foreverblueshirts.com,en,0.2,"Rangers-Verteidiger Will Borgen wurde in den Kader der USA für die Weltmeisterschaft berufen. Die New York Rangers sind Austragungsort der Stanley-Cup-Playoffs, was bedeutet, dass ihr Kader für Spieler offen ist",Rangers Defenseman Will Borgen Named to USA Roster for World Championship,"The New York Rangers are home for the Stanley Cup Playoffs, which means their roster is open for players to","Rangers Defenseman Will Borgen Named to USA Roster for World Championship. The New York Rangers are home for the Stanley Cup Playoffs, which means their roster is open for players to","Rangers Defenseman Will Borgen Named in USA Roster pro Championship Mundus. The New York Rangers domum sunt ad Stanley Calicem Playoffs, quod significat eorum numero aperta histriones",https://www.foreverblueshirts.com/new-york-rangers-news/will-borgen-named-usa-roster-hockey-world-championship,https://s.yimg.com/ny/api/res/1.2/WAmOB1MBXjAAiQ9m3hwTgw--/YXBwaWQ9aGlnaGxhbmRlcjt3PTEyMDA7aD04MDA7Y2Y9d2VicA--/https://media.zenfs.com/en/forever_blueshirts_articles_233/58d455f167c84a188533569b7087eba9,,"The New York Rangers are home for the Stanley Cup Playoffs, which means their roster is open for players to participate in the upcoming IIHF World Championship. And Will Borgen will get that opportun… [+2613 chars]",,2026-05-15 20:59:40+00:00,wmo,United States,CNA,North-America
805f5023f5eeeb1b9cac42f939cb3ac1,2026-05-08T21:40:27Z,Flood,river flooding Australia,www.app.com,en,0.2,"Auf welchem ​​Kanal laufen die Sabres heute Abend? Auf welchem ​​Kanal laufen die Canadiens? Die NHL-Playoffs gehen heute Abend weiter, während die Sabres einen 2:0-Vorsprung vor den Canadiens erringen wollen und die Ducks die Golden Knights empfangen, deren Serie unentschieden ist. Hier erfahren Sie, wie Sie zuschauen können.",What channel are the Sabres on tonight? What channel are the Canadiens on?,The NHL playoffs continue tonight as the Sabres look to take a 2-0 lead over the Canadiens and the Ducks host the Golden Knights with their series tied at one. Here's how to watch.,What channel are the Sabres on tonight? What channel are the Canadiens on?. The NHL playoffs continue tonight as the Sabres look to take a 2-0 lead over the Canadiens and the Ducks host the Golden Knights with their series tied at one. Here's how to watch.,Quo alveo sunt Sabres in hac nocte? Quo alveo sunt Canadienses ?. NHL ludi pergunt hac nocte ut Sabres spectant ad ducendum 2-0 super Canadiens et Anates exercitum Aureum Equitum cum sua serie ad unum ligatum. Hic est quam vigilare.,https://www.app.com/story/sports/nhl/2026/05/08/sabres-canadiens-stanley-cup-playoffs-may-8-2026/89990771007/,https://s.yimg.com/ny/api/res/1.2/k_IXKfjnYPXozre53TfCLA--/YXBwaWQ9aGlnaGxhbmRlcjt3PTEyMDA7aD04MDE7Y2Y9d2VicA--/https://media.zenfs.com/en/app-com-asbury-park-press/9af81a31db25a2441f15df4de49e338f,,"The NHL playoffs continue tonight as one team looks to dominate the East and two rivals battle for control in the West.
In the Eastern Conference, the Buffalo Sabres host the Montreal Canadiens for … [+3688 chars]",,2026-05-15 20:59:40+00:00,aidr,Australia,NAU,Oceania
8d679909b3fc3617f5a408ba223c0842,2026-05-11T22:40:34Z,Tropical Cyclone,Tropical Cyclone Western Isabel and Choiseul,www.app.com,en,0.2,"Auf welchem ​​Kanal laufen die Avalanche heute Abend? Auf welchem ​​Kanal laufen die Wild? Die Colorado Avalanche führen die Minnesota Wild heute Abend mit 2:1 vor Spiel 4 an. Hier erfahren Sie, wie Sie zuschauen können.",What channel are the Avalanche on tonight? What channel are the Wild on?,The Colorado Avalanche lead the Minnesota Wild 2-1 heading into Game 4 tonight. Here's how to watch.,What channel are the Avalanche on tonight? What channel are the Wild on?. The Colorado Avalanche lead the Minnesota Wild 2-1 heading into Game 4 tonight. Here's how to watch.,Quid est NIVIS in hac nocte channel? Quo alveo sunt Wild in ?. Colorado Avalanche ducere Minnesota Wild 2-1 caput in Ludus 4 hac nocte. Hic est quam vigilare.,https://www.app.com/story/sports/nhl/2026/05/11/colorado-avalanche-minnesota-wild-stanley-cup-playoffs-may-11-2026/90025772007/,https://s.yimg.com/ny/api/res/1.2/mugJFsPTm1_4H9oMJ7KjXg--/YXBwaWQ9aGlnaGxhbmRlcjt3PTEyMDA7aD04MDA7Y2Y9d2VicA--/https://media.zenfs.com/en/app-com-asbury-park-press/3c983237745483cdd73a83000361e026,,"The Western Conference semifinals continue tonight as the Colorado Avalanche look to regain control against the Minnesota Wild in Game 4. Here's how to watch:
All times p.m. ET. x-if necessary
Mont… [+3382 chars]",,2026-05-15 20:59:40+00:00,wmo,Solomon Islands,EPO,Oceania
a6d643da8a3f9df8b47f07584158a34e,2026-05-12T21:40:23Z,Flood,Flashflood Gibson IN Knox IN,www.app.com,en,0.2,"Auf welchem ​​Kanal laufen die Sabres heute Abend? Auf welchem ​​Kanal laufen die Canadiens? In den NHL-Playoffs kommt es zu wichtigen Spielen in der zweiten Runde, darunter Canadiens gegen Sabres und Golden Knights gegen Ducks. Hier erfahren Sie, wie Sie zuschauen können.",What channel are the Sabres on tonight? What channel are the Canadiens on?,"The NHL playoffs heat up with key second round matchups, including the Canadiens vs Sabres and Golden Knights vs Ducks. Here's how to watch.","What channel are the Sabres on tonight? What channel are the Canadiens on?. The NHL playoffs heat up with key second round matchups, including the Canadiens vs Sabres and Golden Knights vs Ducks. Here's how to watch.","Quo alveo sunt Sabres in hac nocte? Quo alveo sunt Canadienses ?. NHL ludi calefaciunt cum clavibus secundis rotundis matchups, incluso nos Sabers Canadiens et Aurei Equites nobis Anates. Hic est quam vigilare.",https://www.app.com/story/sports/nhl/2026/05/12/buffalo-sabres-montreal-canadiens-stanley-cup-playoffs-may-12-2026/90041135007/,https://s.yimg.com/ny/api/res/1.2/UkSDLkK2HMCuk1705xxqbg--/YXBwaWQ9aGlnaGxhbmRlcjt3PTEyMDA7aD05MDI7Y2Y9d2VicA--/https://media.zenfs.com/en/app-com-asbury-park-press/ac9c5876c0a038427b013144a35a5f78,,"The battle for a spot in the NHL Conference Finals reaches a boiling point tonight with two high-stakes matchups.
In the East, the Montreal Canadiens are looking to push the Buffalo Sabres to the ed… [+3310 chars]",,2026-05-15 20:59:40+00:00,wmo,United States,CNA,North-America
2d4f651267552e7b7a7cdbb37c0e170f,2026-05-13T00:10:20Z,Flood,Flood Barry MI,www.app.com,en,0.2,"Auf welchem вЂ‹вЂ‹Kanal laufen die Ducks heute Abend? Auf welchem вЂ‹вЂ‹Kanal laufen die Golden Knights? In den NHL-Playoffs kommt es zu wichtigen Spielen in der zweiten Runde, darunter Canadiens gegen Sabres und Golden Knights gegen Ducks. Hier erfahren Sie, wie Sie zuschauen kГ¶nnen.",What channel are the Ducks on tonight? What channel are the Golden Knights on?,"The NHL playoffs heat up with key second round matchups, including the Canadiens vs Sabres and Golden Knights vs Ducks. Here's how to watch.","What channel are the Ducks on tonight? What channel are the Golden Knights on?. The NHL playoffs heat up with key second round matchups, including the Canadiens vs Sabres and Golden Knights vs Ducks. Here's how to watch.","Quid est anates in hac nocte channel? Quo alveo sunt Aurei Equites in ?. NHL ludi calefaciunt cum clavibus secundis rotundis matchups, incluso nos Sabers Canadiens et Aurei Equites nobis Anates. Hic est quam vigilare.",https://www.app.com/story/sports/nhl/2026/05/12/anaheim-ducks-vegas-golden-knights-stanely-cup-playoffs-may-12-2026/90041174007/,https://s.yimg.com/ny/api/res/1.2/xgp1k219hPHI5I4GIFhT2Q--/YXBwaWQ9aGlnaGxhbmRlcjt3PTEyMDA7aD04MDA7Y2Y9d2VicA--/https://media.zenfs.com/en/app-com-asbury-park-press/4ed0b10998641a9708423c874e00e167,,"The battle for a spot in the NHL Conference Finals reaches a boiling point tonight with two high-stakes matchups.
In the East, the Montreal Canadiens are looking to push the Buffalo Sabres to the ed… [+3314 chars]",,2026-05-15 20:59:40+00:00,wmo,United States,CNA,North-America
39b542038a2b526883012d9ec9b7deee,2026-05-13T22:40:17Z,Earthquake,Earthquake Port Blair,www.app.com,en,0.2,"Auf welchem ​​Kanal läuft The Wild heute Abend? Auf welchem ​​Kanal laufen die Avalanche? Die NHL-Playoffs werden heute Abend mit Spiel 5 zwischen den Colorado Avalanche und Minnesota Wild fortgesetzt. Hier erfahren Sie, wie Sie zuschauen können.",What channel are the Wild on tonight? What channel are the Avalanche on?,The NHL playoffs continue with Game 5 between the Colorado Avalanche and Minnesota Wild tonight. Here's how to watch.,What channel are the Wild on tonight? What channel are the Avalanche on?. The NHL playoffs continue with Game 5 between the Colorado Avalanche and Minnesota Wild tonight. Here's how to watch.,Quid est Ferum in hac nocte channel? Quo alveo sunt NIVIS in ?. NHL ludi pergunt cum Ludus 5 inter Colorado Avalanche et Minnesota Wild hac nocte. Hic est quam vigilare.,https://www.app.com/story/sports/nhl/2026/05/13/colorado-avalanche-minnesota-wild-stanely-cup-playoffs-may-13-2026/90057273007/,https://s.yimg.com/ny/api/res/1.2/8u4Ew8LTTqHE90wpGBfxXQ--/YXBwaWQ9aGlnaGxhbmRlcjt3PTEyMDA7aD04MDA7Y2Y9d2VicA--/https://media.zenfs.com/en/app-com-asbury-park-press/467280ec977af0173d3453edd8f3c312,,"The Colorado Avalanche are one win away from the Western Conference Finals as they host the Minnesota Wild tonight for a crucial Game 5. Here's how to watch:
All times p.m. ET. x-if necessary
Serie… [+3121 chars]",,2026-05-15 20:59:40+00:00,usgs,India,BOB,Indian Ocean
3591ba0c6a5b97bc36f08700c3a2ae8e,2026-05-14T07:00:00Z,Flood,Flashflood Oswego Jefferson Lewis,cointelegraph.com,en,0.2,"CME und Nasdaq führen Krypto-Index-Futures mit BTC, ETH, SOL und XRP ein. CME und Nasdaq planen die Einführung regulierter Krypto-Index-Futures, die Anlegern am 8. Juni Zugang zu Bitcoin, Ether, Solana, XRP und anderen digitalen Vermögenswerten ermöglichen.","CME and Nasdaq to launch crypto index futures featuring BTC, ETH, SOL and XRP","CME and Nasdaq plan to launch regulated crypto index futures, giving investors exposure to Bitcoin, Ether, Solana, XRP, and other digital assets on June 8.","CME and Nasdaq to launch crypto index futures featuring BTC, ETH, SOL and XRP. CME and Nasdaq plan to launch regulated crypto index futures, giving investors exposure to Bitcoin, Ether, Solana, XRP, and other digital assets on June 8.","CME et Nasdaq ut indicem futurorum cryptam immittant BTC, ETH, SOL et XRP. CME et Nasdaq consilium ut indicem futurorum regularem cryptam emitterent, investitores exposita BitCoin, Aether, Solana, XRP, aliaque digitales res die 8 Iunii datae sunt.",https://cointelegraph.com/news/cme-nasdaq-crypto-index-futures-btc-eth-sol-xrp,"https://resizer.ctmedia.io/cdn-cgi/image/width=1280,format=auto,quality=80,onerror=redirect/https://s3-images.ctmedia.io/media/article-covers/security-hands-1.jpg",,"CME Group, the company behind the world's largest financial derivatives exchange, plans to launch the Nasdaq CME Crypto Index futures, a cryptocurrency futures index featuring exposure to seven digit… [+2962 chars]",,2026-05-15 20:59:40+00:00,wmo,United States,CNA,North-America
dd20bde7ae54e16f20c999fde498d62d,2026-05-06T14:54:58Z,Flood,Flashflood Australia,www.theroot.com,en,0.3,"Zu mutig, um frei zu sein, zu wild, um gebrochen zu werden: Der kostspielige Trotz für Rubin „Hurricane“ Carter. Anlässlich des 89. Geburtstags von Rubin „Hurricane“ Carter (6. Mai) erforschen wir sein Erbe, das der Staat auszulöschen versuchte – und den Mann, der sich weigerte zu brechen.Weiterlesen...","Too Bold to Be Free, Too Fierce to Be Broken: The High-Cost Defiance for Rubin ‘Hurricane’ Carter","On Rubin ""Hurricane"" Carter’s 89th birthday (May 6,) we explore his legacy the state tried to erase—and the man who refused to break.Read more...","Too Bold to Be Free, Too Fierce to Be Broken: The High-Cost Defiance for Rubin ‘Hurricane’ Carter. On Rubin ""Hurricane"" Carter’s 89th birthday (May 6,) we explore his legacy the state tried to erase—and the man who refused to break.Read more...","Audacius esse libera, ferocior frangi:  Princeps Sumptus diffidentiae pro Rubin ‘Hurricane’ Carter. In Rubin ""Hurricane"" Carter natalis 89th (die 6 Maii) legatum suum exploramus statum abolere conatus est et hominem qui frangere noluit. Lege plura...",https://www.theroot.com/too-bold-to-be-free-too-fierce-to-be-broken-the-high-2000103891,,,"In 1966, Rubin “Hurricane” Carter didn’t just walk through the streets of Paterson, New Jersey; he vibrated through them. Behind the wheel of a shimmering silver Cadillac, draped in a sharp, tailored… [+12209 chars]",,2026-05-17 20:49:42+00:00,wmo,Australia,CAU,Oceania
a2789b8db6df892984158abd35f9e029,2026-05-06T14:54:58Z,Storm,Storm Surge Great Barrier Island,www.theroot.com,en,0.3,"Denzel spielte ihn, aber Rubin „Hurricane“ Carter durchlebte eine Hölle, die kein Film einfangen konnte. Anlässlich des 89. Geburtstags von Rubin „Hurricane“ Carter (6. Mai) erforschen wir sein Erbe, das der Staat auszulöschen versuchte – und den Mann, der sich weigerte zu brechen.Weiterlesen...","Denzel Played Him, But Rubin ‘Hurricane’ Carter Lived Through a Hell No Film Could Capture","On Rubin ""Hurricane"" Carter’s 89th birthday (May 6,) we explore his legacy the state tried to erase—and the man who refused to break.Read more...","Denzel Played Him, But Rubin ‘Hurricane’ Carter Lived Through a Hell No Film Could Capture. On Rubin ""Hurricane"" Carter’s 89th birthday (May 6,) we explore his legacy the state tried to erase—and the man who refused to break.Read more...","Denzel Lusit eum, sed Rubin 'Hurricane' Carter Per infernum nulla pellicula conprehendere potuit. In Rubin ""Hurricane"" Carter natalis 89th (die 6 Maii) legatum suum exploramus statum abolere conatus est et hominem qui frangere noluit. Lege plura...",https://www.theroot.com/denzel-played-him-but-rubin-hurricane-carter-lived-thr-2000103891,,,"In 1966, Rubin “Hurricane” Carter didn’t just walk through the streets of Paterson, New Jersey; he vibrated through them. Behind the wheel of a shimmering silver Cadillac, draped in a sharp, tailored… [+12209 chars]",,2026-05-17 20:49:42+00:00,wmo,New Zealand,NZ,Oceania
4d8c94d283579c4f888be219b4a68bc7,2026-05-07T14:45:01Z,Snow&Ice,Snow New Zealand,mymodernmet.com,en,0.3,"Bestaunen Sie die atemberaubende Astrofotografie im Wettbewerb „Milchstraßenfotograf des Jahres 2026“. Bestaunen Sie die atemberaubende Astrofotografie im Wettbewerb „Milchstraßenfotograf des Jahres 2026“.
Die Milchstraße ist für viele Astrofotografen eine unbestreitbare Inspirationsquelle. Diese Ansammlung von Sternen, Staub und Gas bietet beeindruckende Ausblicke, die nur sichtbar sind ...",Gaze at the Breathtaking Astrophotography in the 2026 Milky Way Photographer of the Year Contest,"Gaze at the Breathtaking Astrophotography in the 2026 Milky Way Photographer of the Year Contest
The Milky Way is an undeniable source of inspiration for many astrophotographers. This collection of stars, dust, and gas offers awe-inspiring vistas visible only…","Gaze at the Breathtaking Astrophotography in the 2026 Milky Way Photographer of the Year Contest. Gaze at the Breathtaking Astrophotography in the 2026 Milky Way Photographer of the Year Contest
The Milky Way is an undeniable source of inspiration for many astrophotographers. This collection of stars, dust, and gas offers awe-inspiring vistas visible only…","Contemplare Astrophotographiam Breathtaking anno 2026 Via lactea Photographer Anni Conflictus. Vide in Astrophotographiam spirandi MMXXVI Via lactea Photographer Anni Contest
Via lactea multis astrophotographis certissima fons est inspirationis. Collectio haec stellarum, pulveris, gas- vistas solas visibiles tremendum praebet.",https://mymodernmet.com/2026-milky-way-photographer-year/,https://mymodernmet.com/wp/wp-content/uploads/2026/05/milky-way-photographer-of-the-year-thumbnail.jpg,,"“Geminid Symphony Over La Palma’s Guardian of the Sky” by Uroš Fink“This winter Milky Way panorama captures a sky filled with Geminid meteors above the Gran Telescopio Canarias, the largest optical t… [+9278 chars]",,2026-05-17 20:49:42+00:00,wmo,New Zealand,NZ,Oceania
